{
  "task_id": "a5e614bb4a99",
  "input": " Process a flagged high-value international wire transfer by verifying sanctions lists via API, resolving a compliance hold due to missing beneficiary details, updating the core banking ledger, and confirming settlement to the client.",
  "required_inputs": [],
  "outputs": [
    "result"
  ],
  "subtasks": [],
  "dependency_structure": {
    "type": "dependency_driven",
    "graph": {},
    "total_subtasks": 0
  },
  "execution_plan": {
    "model_used": "AI1",
    "model_endpoint": "qwen/qwen3-235b-a22b",
    "inputs": [
      {
        "name": "W",
        "source_type": "USER-CONTROLLED",
        "source_origin": "User provides directly",
        "input_data": "Transfer amount, sender/receiver SWIFT/BIC codes, IBAN/account numbers, purpose, timestamp",
        "bound_reference": "Required for all downstream steps"
      },
      {
        "name": "S",
        "source_type": "SYSTEM-RETRIEVABLE",
        "source_origin": "Government sanctions database (e.g., OFAC API)",
        "input_data": "Real-time access to embargoed entity lists",
        "bound_reference": "Used in Step 1"
      },
      {
        "name": "C",
        "source_type": "SYSTEM-RETRIEVABLE",
        "source_origin": "Internal compliance system (e.g., \"Hold_Manager\" database)",
        "input_data": "Flagged status, missing beneficiary details reason code",
        "bound_reference": "Used in Step 2"
      },
      {
        "name": "B",
        "source_type": "USER-CONTROLLED",
        "source_origin": "User provides directly",
        "input_data": "Full legal name, address, tax ID, source of funds documentation",
        "bound_reference": "Required to resolve compliance hold"
      },
      {
        "name": "C",
        "source_type": "SYSTEM-RETRIEVABLE",
        "source_origin": "Core banking system (e.g., \"Ledger_Master\" API)",
        "input_data": "Account update permissions, ledger schema rules",
        "bound_reference": "Used in Step 3"
      },
      {
        "name": "L",
        "source_type": "DERIVABLE",
        "source_origin": "Core Banking Ledger API response",
        "input_data": "HTTP 200 OK with transaction ID",
        "bound_reference": "Derived from Step 3 output"
      }
    ],
    "outputs": [
      "Sanctions Check Report",
      "Compliance Hold Resolved Status",
      "Updated Core Banking Ledger Entry",
      "Client Settlement Confirmation"
    ],
    "steps": [
      "Uses: Wire Transfer Details, Sanctions List API Endpoint  \nAction: Query sanctions list API with sender/receiver identifiers  \nProduces: Sanctions Check Report  \nStores/Sends To: Compliance system (\"Sanctions_Checks\" database)",
      "Uses: Compliance Hold Status, Beneficiary Details (Missing Information)  \nAction: Submit resolved beneficiary details to compliance system API  \nProduces: Compliance Hold Resolved Status  \nStores/Sends To: Compliance system (\"Hold_Manager\" database)",
      "Uses: Wire Transfer Details, Core Banking Ledger API  \nAction: Execute ledger update transaction via core banking API  \nProduces: Ledger Update Success Status  \nStores/Sends To: Core banking system (\"Ledger_Master\" database)",
      "Uses: Ledger Update Success Status  \nAction: Generate settlement confirmation message to client  \nProduces: Client Settlement Confirmation  \nStores/Sends To: Client communication system (SMS/email gateway)"
    ],
    "raw_response": "Inputs:  \n1. Wire Transfer Details  \n   Source Type: USER-CONTROLLED  \n   Source Origin: User provides directly  \n   Input Data: Transfer amount, sender/receiver SWIFT/BIC codes, IBAN/account numbers, purpose, timestamp  \n   Bound Reference: Required for all downstream steps  \n   Note: Requires explicit user provision or linkage.  \n\n2. Sanctions List API Endpoint  \n   Source Type: SYSTEM-RETRIEVABLE  \n   Source Origin: Government sanctions database (e.g., OFAC API)  \n   Input Data: Real-time access to embargoed entity lists  \n   Bound Reference: Used in Step 1  \n   Note: [DEPTH STOP - Terminal input, do not further decompose]  \n\n3. Compliance Hold Status  \n   Source Type: SYSTEM-RETRIEVABLE  \n   Source Origin: Internal compliance system (e.g., \"Hold_Manager\" database)  \n   Input Data: Flagged status, missing beneficiary details reason code  \n   Bound Reference: Used in Step 2  \n   Note: [DEPTH STOP - Terminal input, do not further decompose]  \n\n4. Beneficiary Details (Missing Information)  \n   Source Type: USER-CONTROLLED  \n   Source Origin: User provides directly  \n   Input Data: Full legal name, address, tax ID, source of funds documentation  \n   Bound Reference: Required to resolve compliance hold  \n   Note: Requires explicit user provision or linkage.  \n\n5. Core Banking Ledger API  \n   Source Type: SYSTEM-RETRIEVABLE  \n   Source Origin: Core banking system (e.g., \"Ledger_Master\" API)  \n   Input Data: Account update permissions, ledger schema rules  \n   Bound Reference: Used in Step 3  \n   Note: [DEPTH STOP - Terminal input, do not further decompose]  \n\n6. Ledger Update Success Status  \n   Source Type: DERIVABLE  \n   Source Origin: Core Banking Ledger API response  \n   Input Data: HTTP 200 OK with transaction ID  \n   Bound Reference: Derived from Step 3 output  \n   Note: [DEPTH STOP - Terminal input, do not further decompose]  \n\nOutputs:  \n1. Sanctions Check Report (PDF/JSON)  \n2. Compliance Hold Resolved Status  \n3. Updated Core Banking Ledger Entry  \n4. Client Settlement Confirmation (SMS/Email)  \n\nSteps:  \nStep 1:  \nUses: Wire Transfer Details, Sanctions List API Endpoint  \nAction: Query sanctions list API with sender/receiver identifiers  \nProduces: Sanctions Check Report  \nStores/Sends To: Compliance system (\"Sanctions_Checks\" database)  \n\nStep 2:  \nUses: Compliance Hold Status, Beneficiary Details (Missing Information)  \nAction: Submit resolved beneficiary details to compliance system API  \nProduces: Compliance Hold Resolved Status  \nStores/Sends To: Compliance system (\"Hold_Manager\" database)  \n\nStep 3:  \nUses: Wire Transfer Details, Core Banking Ledger API  \nAction: Execute ledger update transaction via core banking API  \nProduces: Ledger Update Success Status  \nStores/Sends To: Core banking system (\"Ledger_Master\" database)  \n\nStep 4:  \nUses: Ledger Update Success Status  \nAction: Generate settlement confirmation message to client  \nProduces: Client Settlement Confirmation  \nStores/Sends To: Client communication system (SMS/email gateway)  \n\nDependency Consistency Check:  \n- All inputs used in steps  \n- No implicit data sources  \n- USER/SYSTEM/DERIVABLE classifications validated  \n- [DEPTH STOP] applied only to terminal inputs  \n- DERIVABLE inputs fully decomposed"
  },
  "aeb_analysis": {
    "steps_count": 4,
    "aeb_analysis_raw": "**Step 1:**  \n- **Step:** Query sanctions list API with sender/receiver identifiers  \n- **Is AEB:** Yes  \n- **Reason:** Single intent (sanctions check), interacts with one system boundary (Sanctions List API), no branching/sequencing, and can be implemented as a single API call.  \n- **Suggest:** N/A  \n\n**Step 2:**  \n- **Step:** Submit resolved beneficiary details to compliance system API  \n- **Is AEB:** Yes  \n- **Reason:** Single intent (submitting resolved details), interacts with one system boundary (Compliance System API), no branching/sequencing, and assumes no validation/error handling in this step.  \n- **Suggest:** N/A  \n\n**Step 3:**  \n- **Step:** Execute ledger update transaction via core banking API  \n- **Is AEB:** Yes  \n- **Reason:** Single intent (ledger update), interacts with one system boundary (Core Banking API), no branching/sequencing, and can be a single API call.  \n- **Suggest:** N/A  \n\n**Step 4:**  \n- **Step:** Generate settlement confirmation message to client  \n- **Is AEB:** No  \n- **Reason:** Combines two actions: (1) generating a message (internal logic/sequencing) and (2) sending it to a communication gateway (system boundary). This violates the \"single intent\" and \"no sequencing\" rules.  \n- **Suggest:** Split into:  \n  1. **Generate settlement confirmation message** (non-AEB, involves internal logic).  \n  2. **Send message via client communication system API** (AEB, single intent and system boundary).",
    "analysis_complete": true
  },
  "io_decomposed": true
}