{
  "task_id": "b2982ca98301",
  "input": "Coordinate a patient's procedure by checking OR availability, resolving scheduling conflicts, updating the medical record and billing system, and confirming the final appointment.",
  "required_inputs": [],
  "outputs": [
    "result"
  ],
  "subtasks": [],
  "dependency_structure": {
    "type": "dependency_driven",
    "graph": {},
    "total_subtasks": 0
  },
  "execution_plan": {
    "model_used": "AI1",
    "model_endpoint": "qwen/qwen3-235b-a22b",
    "inputs": [
      {
        "name": "O",
        "source_type": "SYSTEM-RETRIEVABLE",
        "source_origin": "Hospital OR Scheduling API",
        "input_data": "Available time slots, room capacities, equipment availability",
        "bound_reference": "N/A"
      },
      {
        "name": "P",
        "source_type": "SYSTEM-RETRIEVABLE",
        "source_origin": "Electronic Health Record (EHR) System API",
        "input_data": "Patient ID, procedure requirements, contraindications",
        "bound_reference": "N/A"
      },
      {
        "name": "P",
        "source_type": "SYSTEM-RETRIEVABLE",
        "source_origin": "Physician Scheduling System API",
        "input_data": "Physician availability, blocked times",
        "bound_reference": "N/A"
      },
      {
        "name": "P",
        "source_type": "USER-CONTROLLED",
        "source_origin": "Patient",
        "input_data": "Preferred dates/times, contact preferences",
        "bound_reference": "Requires explicit user provision or linkage."
      },
      {
        "name": "P",
        "source_type": "DERIVABLE",
        "source_origin": "Patient Medical History (Input 2)",
        "input_data": "Physician-ordered procedure code",
        "bound_reference": "Derived from Input 2"
      },
      {
        "name": "P",
        "source_type": "DERIVABLE",
        "source_origin": "OR Schedule Data (Input 1), Patient Availability Preferences (Input 4)",
        "input_data": "Resolved time slot, room assignment",
        "bound_reference": "Derived from Inputs 1 and 4"
      },
      {
        "name": "B",
        "source_type": "DERIVABLE",
        "source_origin": "Procedure Type (Input 5)",
        "input_data": "CPT/ICD-10 code mapped to procedure type",
        "bound_reference": "Derived from Input 5"
      },
      {
        "name": "P",
        "source_type": "SYSTEM-RETRIEVABLE",
        "source_origin": "EHR System API (Input 2)",
        "input_data": "Phone number, email address",
        "bound_reference": "N/A"
      }
    ],
    "outputs": [
      "Updated OR Schedule",
      "Updated Medical Record",
      "Updated Billing System Entry",
      "Appointment Confirmation Message"
    ],
    "steps": [
      "Uses: OR Schedule Data (Input 1)  \nAction: Query OR Scheduling API for available time slots matching procedure requirements  \nProduces: Available OR Time Slots  \nStores/Sends To: Temporary memory",
      "Uses: Patient Medical History (Input 2)  \nAction: Retrieve patient contraindications and procedure requirements from EHR  \nProduces: Patient Eligibility Profile  \nStores/Sends To: Temporary memory",
      "Uses: Physician Schedule (Input 3), Patient Availability Preferences (Input 4)  \nAction: Cross-reference physician availability with patient preferences to identify conflict-free windows  \nProduces: Valid Scheduling Window List  \nStores/Sends To: Temporary memory",
      "Uses: Valid Scheduling Window List (Step 3 output), Available OR Time Slots (Step 1 output)  \nAction: Resolve conflicts by selecting first mutually available OR/patient/physician time slot  \nProduces: Final Procedure Date/Time/Room (Input 6)  \nStores/Sends To: Input 6",
      "Uses: Procedure Type (Input 5), Final Procedure Date/Time/Room (Input 6)  \nAction: Update OR Scheduling System with confirmed procedure details  \nProduces: OR Schedule Update Confirmation  \nStores/Sends To: OR Scheduling API",
      "Uses: Final Procedure Date/Time/Room (Input 6), Patient Medical History (Input 2)  \nAction: Append procedure log to EHR with date, type, and room details  \nProduces: EHR Update Confirmation  \nStores/Sends To: EHR System API",
      "Uses: Billing Code (Input 7)  \nAction: Create charge record in billing system using derived billing code  \nProduces: Billing System Update Confirmation  \nStores/Sends To: Billing System API",
      "Uses: Patient Contact Information (Input 8), Final Procedure Date/Time/Room (Input 6)  \nAction: Generate and send confirmation message via SMS/email  \nProduces: Appointment Confirmation Delivery Receipt  \nStores/Sends To: Communication system log  \n\n[DEPTH STOP CONDITIONS MET: All DERIVABLE inputs (5,6,7) decomposed into SYSTEM-RETRIEVABLE (1,2,3,8) or USER-CONTROLLED (4) sources]"
    ],
    "raw_response": "Inputs:  \n1. OR Schedule Data  \n   Source Type: SYSTEM-RETRIEVABLE  \n   Source Origin: Hospital OR Scheduling API  \n   Input Data: Available time slots, room capacities, equipment availability  \n   Bound Reference: N/A  \n\n2. Patient Medical History  \n   Source Type: SYSTEM-RETRIEVABLE  \n   Source Origin: Electronic Health Record (EHR) System API  \n   Input Data: Patient ID, procedure requirements, contraindications  \n   Bound Reference: N/A  \n\n3. Physician Schedule  \n   Source Type: SYSTEM-RETRIEVABLE  \n   Source Origin: Physician Scheduling System API  \n   Input Data: Physician availability, blocked times  \n   Bound Reference: N/A  \n\n4. Patient Availability Preferences  \n   Source Type: USER-CONTROLLED  \n   Source Origin: Patient  \n   Input Data: Preferred dates/times, contact preferences  \n   Bound Reference: Requires explicit user provision or linkage.  \n\n5. Procedure Type  \n   Source Type: DERIVABLE  \n   Source Origin: Patient Medical History (Input 2)  \n   Input Data: Physician-ordered procedure code  \n   Bound Reference: Derived from Input 2  \n\n6. Procedure Date/Time/Room  \n   Source Type: DERIVABLE  \n   Source Origin: OR Schedule Data (Input 1), Patient Availability Preferences (Input 4)  \n   Input Data: Resolved time slot, room assignment  \n   Bound Reference: Derived from Inputs 1 and 4  \n\n7. Billing Code  \n   Source Type: DERIVABLE  \n   Source Origin: Procedure Type (Input 5)  \n   Input Data: CPT/ICD-10 code mapped to procedure type  \n   Bound Reference: Derived from Input 5  \n\n8. Patient Contact Information  \n   Source Type: SYSTEM-RETRIEVABLE  \n   Source Origin: EHR System API (Input 2)  \n   Input Data: Phone number, email address  \n   Bound Reference: N/A  \n\nOutputs:  \n1. Updated OR Schedule  \n   Type: Persisted state change in OR system  \n2. Updated Medical Record  \n   Type: Persisted procedure log in EHR  \n3. Updated Billing System Entry  \n   Type: Charge record in billing system  \n4. Appointment Confirmation Message  \n   Type: SMS/email sent to patient  \n\nSteps:  \nStep 1:  \nUses: OR Schedule Data (Input 1)  \nAction: Query OR Scheduling API for available time slots matching procedure requirements  \nProduces: Available OR Time Slots  \nStores/Sends To: Temporary memory  \n\nStep 2:  \nUses: Patient Medical History (Input 2)  \nAction: Retrieve patient contraindications and procedure requirements from EHR  \nProduces: Patient Eligibility Profile  \nStores/Sends To: Temporary memory  \n\nStep 3:  \nUses: Physician Schedule (Input 3), Patient Availability Preferences (Input 4)  \nAction: Cross-reference physician availability with patient preferences to identify conflict-free windows  \nProduces: Valid Scheduling Window List  \nStores/Sends To: Temporary memory  \n\nStep 4:  \nUses: Valid Scheduling Window List (Step 3 output), Available OR Time Slots (Step 1 output)  \nAction: Resolve conflicts by selecting first mutually available OR/patient/physician time slot  \nProduces: Final Procedure Date/Time/Room (Input 6)  \nStores/Sends To: Input 6  \n\nStep 5:  \nUses: Procedure Type (Input 5), Final Procedure Date/Time/Room (Input 6)  \nAction: Update OR Scheduling System with confirmed procedure details  \nProduces: OR Schedule Update Confirmation  \nStores/Sends To: OR Scheduling API  \n\nStep 6:  \nUses: Final Procedure Date/Time/Room (Input 6), Patient Medical History (Input 2)  \nAction: Append procedure log to EHR with date, type, and room details  \nProduces: EHR Update Confirmation  \nStores/Sends To: EHR System API  \n\nStep 7:  \nUses: Billing Code (Input 7)  \nAction: Create charge record in billing system using derived billing code  \nProduces: Billing System Update Confirmation  \nStores/Sends To: Billing System API  \n\nStep 8:  \nUses: Patient Contact Information (Input 8), Final Procedure Date/Time/Room (Input 6)  \nAction: Generate and send confirmation message via SMS/email  \nProduces: Appointment Confirmation Delivery Receipt  \nStores/Sends To: Communication system log  \n\n[DEPTH STOP CONDITIONS MET: All DERIVABLE inputs (5,6,7) decomposed into SYSTEM-RETRIEVABLE (1,2,3,8) or USER-CONTROLLED (4) sources]"
  },
  "aeb_analysis": {
    "steps_count": 8,
    "aeb_analysis_raw": null,
    "analysis_complete": true
  },
  "io_decomposed": true
}