{
  "task_id": "2c087569ef1d",
  "input": " Research patient concerns to develop consistent blogs, videos, and social posts across channels while setting measurable KPIs to track healthcare campaign engagement and outcomes.",
  "required_inputs": [],
  "outputs": [
    "result"
  ],
  "subtasks": [],
  "dependency_structure": {
    "type": "dependency_driven",
    "graph": {},
    "total_subtasks": 0
  },
  "execution_plan": {
    "model_used": "AI1",
    "model_endpoint": "qwen/qwen3-235b-a22b",
    "inputs": [
      {
        "name": "Patient Concern Data",
        "source_type": "DERIVABLE",
        "source_origin": "Combination of existing patient feedback systems and new research initiatives",
        "input_data": "Raw patient feedback records, social media comments, support tickets, and survey responses",
        "bound_reference": "Decomposes into Inputs 2-4"
      },
      {
        "name": "Electronic Health Records (EHR) System Data",
        "source_type": "SYSTEM-RETRIEVABLE",
        "source_origin": "Hospital EHR API endpoint (e.g., Epic/MyChart integration)",
        "input_data": "Structured patient interaction logs containing complaint/treatment metadata",
        "bound_reference": null
      },
      {
        "name": "Social Media Listening API",
        "source_type": "SYSTEM-RETRIEVABLE",
        "source_origin": "Brandwatch/Hootsuite API credentials",
        "input_data": "Real-time social media posts mentioning healthcare keywords",
        "bound_reference": null
      },
      {
        "name": "User-Generated Survey Responses",
        "source_type": "USER-CONTROLLED",
        "source_origin": "Marketing team-created Google Forms/Qualtrics links",
        "input_data": "Structured CSV/JSON export of patient concern survey results",
        "bound_reference": null
      },
      {
        "name": "Brand Content Guidelines",
        "source_type": "USER-CONTROLLED",
        "source_origin": "Internal marketing strategy document repository",
        "input_data": "PDF/Word document specifying tone, style, and compliance requirements",
        "bound_reference": null
      },
      {
        "name": "Campaign Objectives",
        "source_type": "USER-CONTROLLED",
        "source_origin": "Stakeholder meeting minutes and strategy briefs",
        "input_data": "Documented goals (e.g., \"Increase diabetes awareness by 30% Q3\")",
        "bound_reference": null
      },
      {
        "name": "Content Distribution Platforms",
        "source_type": "USER-CONTROLLED",
        "source_origin": "Marketing team's platform selection (LinkedIn, YouTube, etc.)",
        "input_data": "Platform-specific content format requirements (e.g., Instagram Reels specs)",
        "bound_reference": null
      }
    ],
    "outputs": [
      "Structured Patient Concern Taxonomy",
      "Content Calendar with Channel-Specific Posts",
      "Published Blog Articles",
      "Video Content Repository",
      "Social Media Post Schedule",
      "KPI Dashboard",
      "Engagement Analytics Report"
    ],
    "steps": [
      "Uses: Inputs 2,3,4  \nAction: Aggregate patient concern data from EHR, social listening tools, and user surveys  \nProduces: Unified Patient Concern Dataset  \nStores/Sends To: Internal data warehouse (Snowflake/BigQuery)",
      "Uses: Input 6  \nAction: Derive KPI framework from campaign objectives (e.g., \"Engagement rate >15%\")  \nProduces: KPI Definition Document  \nStores/Sends To: Google Drive (shared analytics folder)",
      "Uses: Input 5  \nAction: Apply brand guidelines to create content templates  \nProduces: Blog/Video/Social Post Template Library  \nStores/Sends To: Internal Confluence page",
      "Uses: Input 7  \nAction: Configure platform-specific content parameters (aspect ratios, hashtags, etc.)  \nProduces: Channel-Specific Content Specification Sheet  \nStores/Sends To: Marketing team Notion workspace",
      "Uses: Output 1, Input 5  \nAction: Generate SEO-optimized blog posts using concern taxonomy and brand voice  \nProduces: Draft Blog Articles (Markdown files)  \nStores/Sends To: WordPress CMS draft queue",
      "Uses: Output 1, Input 7  \nAction: Produce patient concern explainer videos with platform-specific durations  \nProduces: Rendered Video Files + Captions  \nStores/Sends To: YouTube/Vimeo private channels",
      "Uses: Output 1, Input 6  \nAction: Schedule social posts with concern-specific CTAs across platforms  \nProduces: API Calls to Social Media Platforms  \nStores/Sends To: Hootsuite scheduling interface",
      "Uses: Input 3, Output 2, Output 6  \nAction: Implement tracking pixels and UTM parameters for engagement metrics  \nProduces: Real-Time Analytics Dashboard  \nStores/Sends To: Power BI service (live connection)",
      "Uses: Output 4, Output 7  \nAction: Generate weekly performance report comparing KPIs vs actuals  \nProduces: PDF Analytics Report  \nStores/Sends To: Stakeholder email distribution list  \n\n---"
    ],
    "raw_response": "Inputs:  \n1. **Patient Concern Data**  \n   Source Type: DERIVABLE  \n   Source Origin: Combination of existing patient feedback systems and new research initiatives  \n   Input Data: Raw patient feedback records, social media comments, support tickets, and survey responses  \n   Bound Reference: Decomposes into Inputs 2-4  \n\n2. **Electronic Health Records (EHR) System Data**  \n   Source Type: SYSTEM-RETRIEVABLE  \n   Source Origin: Hospital EHR API endpoint (e.g., Epic/MyChart integration)  \n   Input Data: Structured patient interaction logs containing complaint/treatment metadata  \n   Note: [DEPTH STOP - Terminal input]  \n\n3. **Social Media Listening API**  \n   Source Type: SYSTEM-RETRIEVABLE  \n   Source Origin: Brandwatch/Hootsuite API credentials  \n   Input Data: Real-time social media posts mentioning healthcare keywords  \n   Note: [DEPTH STOP - Terminal input]  \n\n4. **User-Generated Survey Responses**  \n   Source Type: USER-CONTROLLED  \n   Source Origin: Marketing team-created Google Forms/Qualtrics links  \n   Input Data: Structured CSV/JSON export of patient concern survey results  \n   Note: Requires explicit user provision or linkage.  \n\n5. **Brand Content Guidelines**  \n   Source Type: USER-CONTROLLED  \n   Source Origin: Internal marketing strategy document repository  \n   Input Data: PDF/Word document specifying tone, style, and compliance requirements  \n   Note: Requires explicit user provision or linkage.  \n\n6. **Campaign Objectives**  \n   Source Type: USER-CONTROLLED  \n   Source Origin: Stakeholder meeting minutes and strategy briefs  \n   Input Data: Documented goals (e.g., \"Increase diabetes awareness by 30% Q3\")  \n   Note: Requires explicit user provision or linkage.  \n\n7. **Content Distribution Platforms**  \n   Source Type: USER-CONTROLLED  \n   Source Origin: Marketing team's platform selection (LinkedIn, YouTube, etc.)  \n   Input Data: Platform-specific content format requirements (e.g., Instagram Reels specs)  \n   Note: Requires explicit user provision or linkage.  \n\n---\n\nOutputs:  \n1. Structured Patient Concern Taxonomy (CSV file)  \n2. Content Calendar with Channel-Specific Posts (Google Sheets)  \n3. Published Blog Articles (URLs)  \n4. Video Content Repository (MP4 files + transcripts)  \n5. Social Media Post Schedule (Platform-specific API calls)  \n6. KPI Dashboard (Power BI/Tableau link)  \n7. Engagement Analytics Report (PDF/Excel)  \n\n---\n\nSteps:  \nStep 1:  \nUses: Inputs 2,3,4  \nAction: Aggregate patient concern data from EHR, social listening tools, and user surveys  \nProduces: Unified Patient Concern Dataset  \nStores/Sends To: Internal data warehouse (Snowflake/BigQuery)  \n\nStep 2:  \nUses: Input 6  \nAction: Derive KPI framework from campaign objectives (e.g., \"Engagement rate >15%\")  \nProduces: KPI Definition Document  \nStores/Sends To: Google Drive (shared analytics folder)  \n\nStep 3:  \nUses: Input 5  \nAction: Apply brand guidelines to create content templates  \nProduces: Blog/Video/Social Post Template Library  \nStores/Sends To: Internal Confluence page  \n\nStep 4:  \nUses: Input 7  \nAction: Configure platform-specific content parameters (aspect ratios, hashtags, etc.)  \nProduces: Channel-Specific Content Specification Sheet  \nStores/Sends To: Marketing team Notion workspace  \n\nStep 5:  \nUses: Output 1, Input 5  \nAction: Generate SEO-optimized blog posts using concern taxonomy and brand voice  \nProduces: Draft Blog Articles (Markdown files)  \nStores/Sends To: WordPress CMS draft queue  \n\nStep 6:  \nUses: Output 1, Input 7  \nAction: Produce patient concern explainer videos with platform-specific durations  \nProduces: Rendered Video Files + Captions  \nStores/Sends To: YouTube/Vimeo private channels  \n\nStep 7:  \nUses: Output 1, Input 6  \nAction: Schedule social posts with concern-specific CTAs across platforms  \nProduces: API Calls to Social Media Platforms  \nStores/Sends To: Hootsuite scheduling interface  \n\nStep 8:  \nUses: Input 3, Output 2, Output 6  \nAction: Implement tracking pixels and UTM parameters for engagement metrics  \nProduces: Real-Time Analytics Dashboard  \nStores/Sends To: Power BI service (live connection)  \n\nStep 9:  \nUses: Output 4, Output 7  \nAction: Generate weekly performance report comparing KPIs vs actuals  \nProduces: PDF Analytics Report  \nStores/Sends To: Stakeholder email distribution list  \n\n---\n\nDependency Consistency Check:  \n✅ All DERIVABLE inputs fully decomposed to SYSTEM/USER sources  \n✅ SYSTEM-RETRIEVABLE inputs specify API endpoints  \n✅ USER-CONTROLLED inputs require explicit provision  \n✅ Output artifacts externally verifiable via URLs/files  \n✅ Step inputs match declared input names  \n✅ No implicit data sources present"
  },
  "aeb_analysis": {
    "steps_count": 9,
    "aeb_analysis_raw": "### Step-by-Step Analysis\n\n---\n\n**Step 1**  \n- **Is AEB**: No  \n- **Reason**: Aggregates data from **multiple system boundaries** (EHR, social listening tools, surveys). Contains implicit **sequencing** (fetching from multiple sources) and **processing logic**.  \n- **Suggestion**: Break into separate AEBs:  \n  - Fetch patient concern data from EHR → AEB  \n  - Fetch patient concern data from social listening tools → AEB  \n  - Fetch patient concern data from user surveys → AEB  \n  - Merge datasets into unified format → AEB  \n\n---\n\n**Step 2**  \n- **Is AEB**: Yes  \n- **Reason**: Single intent (derive KPIs from campaign objectives), interacts with **one system boundary** (Google Drive). No branching/sequencing implied (e.g., parsing objectives into a document).  \n- **Suggestion**: N/A  \n\n---\n\n**Step 3**  \n- **Is AEB**: No  \n- **Reason**: Applies brand guidelines to **multiple output types** (blog, video, social posts), which implies **branching logic** (different templates for different formats).  \n- **Suggestion**: Break into separate AEBs:  \n  - Apply brand guidelines to blog templates → AEB  \n  - Apply brand guidelines to video templates → AEB  \n  - Apply brand guidelines to social post templates → AEB  \n\n---\n\n**Step 4**  \n- **Is AEB**: No  \n- **Reason**: Configures parameters for **multiple platforms** (e.g., aspect ratios, hashtags), implying **branching logic** and **multiple system boundaries**.  \n- **Suggestion**: Break into platform-specific AEBs:  \n  - Configure content parameters for Instagram → AEB  \n  - Configure content parameters for Twitter → AEB  \n  - Configure content parameters for LinkedIn → AEB  \n\n---\n\n**Step 5**  \n- **Is AEB**: Yes  \n- **Reason**: Single intent (generate SEO-optimized blog posts), interacts with **one system boundary** (WordPress CMS). Assumes a single API call to a content-generation tool.  \n- **Suggestion**: N/A  \n\n---\n\n**Step 6**  \n- **Is AEB**: No  \n- **Reason**: Produces videos with **platform-specific durations** (e.g., TikTok vs. YouTube), implying **branching logic** (different rendering parameters).  \n- **Suggestion**: Break into platform-specific AEBs:  \n  - Render 15s TikTok explainer video → AEB  \n  - Render 60s YouTube explainer video → AEB  \n\n---\n\n**Step 7**  \n- **Is AEB**: Yes  \n- **Reason**: Single intent (schedule social posts), interacts with **one system boundary** (Hootsuite API). Assumes Hootsuite handles cross-platform scheduling as a unified action.  \n- **Suggestion**: N/A  \n\n---\n\n**Step 8**  \n- **Is AEB**: No  \n- **Reason**: Combines **multiple actions** (tracking pixels for content, UTM parameters for URLs, and video tracking). Uses multiple inputs (Input 3, Output 2, Output 6).  \n- **Suggestion**: Break into separate AEBs:  \n  - Add UTM parameters to blog posts → AEB  \n  - Embed tracking pixels in videos → AEB  \n  - Configure Power BI dashboard for live metrics → AEB  \n\n---\n\n**Step 9**  \n- **Is AEB**: Yes  \n- **Reason**: Single intent (generate PDF report), interacts with **one system boundary** (email distribution). Assumes a single API call to export and email the report.  \n- **Suggestion**: N/A  \n\n---\n\n### Summary of AEBs  \n**Valid AEBs**: Steps 2, 5, 7, 9  \n**Invalid AEBs**: Steps 1, 3, 4, 6, 8 (require decomposition into smaller AEBs).",
    "analysis_complete": true
  },
  "io_decomposed": true
}