{
  "task_id": "d694a9e573a0",
  "input": "Research and produce a multi-format educational campaign maintaining brand voice across channels to achieve specific engagement and conversion targets.",
  "required_inputs": [],
  "outputs": [
    "result"
  ],
  "subtasks": [],
  "dependency_structure": {
    "type": "dependency_driven",
    "graph": {},
    "total_subtasks": 0
  },
  "execution_plan": {
    "model_used": "AI1",
    "model_endpoint": "qwen/qwen3-235b-a22b",
    "inputs": [
      {
        "name": "B",
        "source_type": "USER-CONTROLLED",
        "source_origin": "Internal marketing team",
        "input_data": "Documented style guide, tone examples, prohibited language",
        "bound_reference": "None"
      },
      {
        "name": "E",
        "source_type": "USER-CONTROLLED",
        "source_origin": "Campaign stakeholders",
        "input_data": "Numeric thresholds (e.g., 20% click-through rate, 5% conversion rate)",
        "bound_reference": "None"
      },
      {
        "name": "T",
        "source_type": "USER-CONTROLLED",
        "source_origin": "Marketing team",
        "input_data": "Qualitative audience personas, cultural context notes",
        "bound_reference": "Input 3"
      },
      {
        "name": "C",
        "source_type": "USER-CONTROLLED",
        "source_origin": "Creative director",
        "input_data": "Required formats (video, blog, social posts) and technical specs",
        "bound_reference": "None"
      },
      {
        "name": "A",
        "source_type": "USER-CONTROLLED",
        "source_origin": "Distribution team",
        "input_data": "Approved platforms (LinkedIn, YouTube, website) with access credentials",
        "bound_reference": "None"
      },
      {
        "name": "H",
        "source_type": "SYSTEM-RETRIEVABLE",
        "source_origin": "Google Analytics + Socialbakers API",
        "input_data": "Past campaign performance by format/channel",
        "bound_reference": "None"
      },
      {
        "name": "B",
        "source_type": "USER-CONTROLLED",
        "source_origin": "Finance department",
        "input_data": "Numeric spend limits per format/channel",
        "bound_reference": "None"
      },
      {
        "name": "R",
        "source_type": "SYSTEM-RETRIEVABLE",
        "source_origin": "Industry compliance database",
        "input_data": "Legal restrictions (e.g., GDPR, FTC guidelines)",
        "bound_reference": "None"
      }
    ],
    "outputs": [
      "Cross-Format Content Assets",
      "Campaign Execution Plan",
      "Engagement Tracking Dashboard",
      "Brand Compliance Audit Report",
      "Conversion Funnel Configuration"
    ],
    "steps": [
      "Uses: Input 1 (Brand Voice Guidelines), Input 3.2 (Audience Insights)\nAction: Develop brand-compliant content framework\nProduces: Style adaptation guidelines\nStores/Sends To: Shared team drive (Folder: Campaign/Brand_Framework)",
      "Uses: Input 3 (Target Audience Data), Input 6 (Historical Metrics)\nAction: Perform audience-channel alignment analysis\nProduces: Channel effectiveness matrix\nStores/Sends To: Google Sheets (Workbook: Channel_Strategy)",
      "Uses: Input 4 (Content Formats), Input 5 (Available Channels)\nAction: Map formats to channels with technical specifications\nProduces: Format-channel specification sheet\nStores/Sends To: Shared team drive (Folder: Campaign/Specs)",
      "Uses: Input 1 (Brand Voice Guidelines), Input 3.1 (CRM Data)\nAction: Generate brand voice compliance scoring model\nProduces: Voice consistency algorithm\nStores/Sends To: NLP system (Model ID: BV_2024)",
      "Uses: Input 7 (Budget Constraints), Input 2 (Engagement Targets)\nAction: Calculate format/channel budget allocations\nProduces: Budget distribution plan\nStores/Sends To: Financial planning system (Project ID: CAMPAIGN_2024)",
      "Uses: Input 8 (Regulatory Requirements), Input 3.2 (Audience Insights)\nAction: Implement compliance filters for each format\nProduces: Legal compliance checklist\nStores/Sends To: Shared team drive (Folder: Campaign/Legal)",
      "Uses: Input 4 (Content Formats), Output from Step 1, Step 3, Step 5\nAction: Create multi-format educational content\nProduces: Campaign content assets\nStores/Sends To: Digital asset management system (Project: EDUCATION_2024)",
      "Uses: Output from Step 7, Input 1 (Brand Voice Guidelines)\nAction: Run automated brand voice consistency check\nProduces: Compliance audit report\nStores/Sends To: Quality assurance system (Report ID: QA_BV_2024)",
      "Uses: Output from Step 8, Input 2 (Engagement Targets)\nAction: Deploy content with conversion tracking parameters\nProduces: Active campaign with tracking\nStores/Sends To: All specified channels + analytics dashboard",
      "Uses: Input 6 (Historical Metrics), Output from Step 9\nAction: Monitor real-time engagement vs targets\nProduces: Dynamic optimization recommendations\nStores/Sends To: Campaign manager dashboard (Tab: Performance)"
    ],
    "raw_response": "Inputs:\n1. Brand Voice Guidelines\n   Source Type: USER-CONTROLLED\n   Source Origin: Internal marketing team\n   Input Data: Documented style guide, tone examples, prohibited language\n   Bound Reference: None\n   Note: Requires explicit user provision or linkage.\n\n2. Engagement Targets\n   Source Type: USER-CONTROLLED\n   Source Origin: Campaign stakeholders\n   Input Data: Numeric thresholds (e.g., 20% click-through rate, 5% conversion rate)\n   Bound Reference: None\n   Note: Requires explicit user provision or linkage.\n\n3. Target Audience Data\n   Source Type: DERIVABLE\n   Source Origin: CRM system + user-provided insights\n   Input Data: Demographic profiles, behavioral patterns, platform preferences\n   Bound Reference: Inputs 3.1 and 3.2\n   Note: [DEPTH STOP - Terminal input, do not further decompose]\n\n3.1. CRM Data\n   Source Type: SYSTEM-RETRIEVABLE\n   Source Origin: Salesforce CRM API\n   Input Data: Customer interaction history, purchase data, segmentation\n   Bound Reference: Input 3\n\n3.2. Audience Insights\n   Source Type: USER-CONTROLLED\n   Source Origin: Marketing team\n   Input Data: Qualitative audience personas, cultural context notes\n   Bound Reference: Input 3\n   Note: Requires explicit user provision or linkage.\n\n4. Content Format Requirements\n   Source Type: USER-CONTROLLED\n   Source Origin: Creative director\n   Input Data: Required formats (video, blog, social posts) and technical specs\n   Bound Reference: None\n   Note: Requires explicit user provision or linkage.\n\n5. Available Channels\n   Source Type: USER-CONTROLLED\n   Source Origin: Distribution team\n   Input Data: Approved platforms (LinkedIn, YouTube, website) with access credentials\n   Bound Reference: None\n   Note: Requires explicit user provision or linkage.\n\n6. Historical Engagement Metrics\n   Source Type: SYSTEM-RETRIEVABLE\n   Source Origin: Google Analytics + Socialbakers API\n   Input Data: Past campaign performance by format/channel\n   Bound Reference: None\n   Note: [DEPTH STOP - Terminal input, do not further decompose]\n\n7. Budget Constraints\n   Source Type: USER-CONTROLLED\n   Source Origin: Finance department\n   Input Data: Numeric spend limits per format/channel\n   Bound Reference: None\n   Note: Requires explicit user provision or linkage.\n\n8. Regulatory Requirements\n   Source Type: SYSTEM-RETRIEVABLE\n   Source Origin: Industry compliance database\n   Input Data: Legal restrictions (e.g., GDPR, FTC guidelines)\n   Bound Reference: None\n   Note: [DEPTH STOP - Terminal input, do not further decompose]\n\nOutputs:\n1. Cross-Format Content Assets\n   Type: Digital media files (video, text, graphics)\n   Verification: Format compliance checks, file accessibility\n\n2. Campaign Execution Plan\n   Type: Documented workflow with timelines\n   Verification: Stakeholder sign-off\n\n3. Engagement Tracking Dashboard\n   Type: Interactive BI dashboard\n   Verification: Real-time metric visualization\n\n4. Brand Compliance Audit Report\n   Type: PDF report with scoring\n   Verification: Automated brand voice analysis\n\n5. Conversion Funnel Configuration\n   Type: System state change in CRM\n   Verification: Funnel stage tracking activation\n\nSteps:\nStep 1:\nUses: Input 1 (Brand Voice Guidelines), Input 3.2 (Audience Insights)\nAction: Develop brand-compliant content framework\nProduces: Style adaptation guidelines\nStores/Sends To: Shared team drive (Folder: Campaign/Brand_Framework)\n\nStep 2:\nUses: Input 3 (Target Audience Data), Input 6 (Historical Metrics)\nAction: Perform audience-channel alignment analysis\nProduces: Channel effectiveness matrix\nStores/Sends To: Google Sheets (Workbook: Channel_Strategy)\n\nStep 3:\nUses: Input 4 (Content Formats), Input 5 (Available Channels)\nAction: Map formats to channels with technical specifications\nProduces: Format-channel specification sheet\nStores/Sends To: Shared team drive (Folder: Campaign/Specs)\n\nStep 4:\nUses: Input 1 (Brand Voice Guidelines), Input 3.1 (CRM Data)\nAction: Generate brand voice compliance scoring model\nProduces: Voice consistency algorithm\nStores/Sends To: NLP system (Model ID: BV_2024)\n\nStep 5:\nUses: Input 7 (Budget Constraints), Input 2 (Engagement Targets)\nAction: Calculate format/channel budget allocations\nProduces: Budget distribution plan\nStores/Sends To: Financial planning system (Project ID: CAMPAIGN_2024)\n\nStep 6:\nUses: Input 8 (Regulatory Requirements), Input 3.2 (Audience Insights)\nAction: Implement compliance filters for each format\nProduces: Legal compliance checklist\nStores/Sends To: Shared team drive (Folder: Campaign/Legal)\n\nStep 7:\nUses: Input 4 (Content Formats), Output from Step 1, Step 3, Step 5\nAction: Create multi-format educational content\nProduces: Campaign content assets\nStores/Sends To: Digital asset management system (Project: EDUCATION_2024)\n\nStep 8:\nUses: Output from Step 7, Input 1 (Brand Voice Guidelines)\nAction: Run automated brand voice consistency check\nProduces: Compliance audit report\nStores/Sends To: Quality assurance system (Report ID: QA_BV_2024)\n\nStep 9:\nUses: Output from Step 8, Input 2 (Engagement Targets)\nAction: Deploy content with conversion tracking parameters\nProduces: Active campaign with tracking\nStores/Sends To: All specified channels + analytics dashboard\n\nStep 10:\nUses: Input 6 (Historical Metrics), Output from Step 9\nAction: Monitor real-time engagement vs targets\nProduces: Dynamic optimization recommendations\nStores/Sends To: Campaign manager dashboard (Tab: Performance)"
  },
  "aeb_analysis": {
    "steps_count": 10,
    "aeb_analysis_raw": "### AEB Validation Analysis\n\n---\n\n#### **Step 1**  \n- **Step**: Develop brand-compliant content framework  \n- **Is AEB**: No  \n- **Reason**: Combines multiple subtasks (e.g., interpreting guidelines, synthesizing audience insights, documenting rules) and involves branching logic for decision-making.  \n- **Suggestion**: Break into:  \n  1. Extract key rules from Brand Voice Guidelines.  \n  2. Analyze Audience Insights for tone preferences.  \n  3. Generate Style Adaptation Guidelines document.  \n\n---\n\n#### **Step 2**  \n- **Step**: Perform audience-channel alignment analysis  \n- **Is AEB**: No  \n- **Reason**: Requires sequencing (e.g., data aggregation, statistical analysis, prioritization) and branching logic for channel scoring.  \n- **Suggestion**: Split into:  \n  1. Aggregate Target Audience Data and Historical Metrics.  \n  2. Calculate channel effectiveness scores.  \n  3. Generate Channel Effectiveness Matrix.  \n\n---\n\n#### **Step 3**  \n- **Step**: Map formats to channels with technical specifications  \n- **Is AEB**: No  \n- **Reason**: Involves looping through formats/channels and conditional logic for compatibility checks.  \n- **Suggestion**: Break into:  \n  1. Retrieve technical specs for each channel.  \n  2. Validate Content Formats against specs.  \n  3. Generate Format-Channel Specification Sheet.  \n\n---\n\n#### **Step 4**  \n- **Step**: Generate brand voice compliance scoring model  \n- **Is AEB**: No  \n- **Reason**: Requires model training, validation, and iteration (sequencing and error handling).  \n- **Suggestion**: Split into:  \n  1. Preprocess CRM Data for training.  \n  2. Train Voice Consistency Algorithm using Brand Guidelines.  \n  3. Deploy model to NLP system.  \n\n---\n\n#### **Step 5**  \n- **Step**: Calculate format/channel budget allocations  \n- **Is AEB**: No  \n- **Reason**: Involves branching logic for prioritization rules and multiple constraints.  \n- **Suggestion**: Break into:  \n  1. Apply Budget Constraints to Engagement Targets.  \n  2. Allocate funds per format/channel using optimization logic.  \n  3. Generate Budget Distribution Plan.  \n\n---\n\n#### **Step 6**  \n- **Step**: Implement compliance filters for each format  \n- **Is AEB**: No  \n- **Reason**: Requires looping through formats and applying format-specific rules (branching).  \n- **Suggestion**: Split into:  \n  1. Extract Regulatory Requirements per format.  \n  2. Generate Legal Compliance Checklist.  \n\n---\n\n#### **Step 7**  \n- **Step**: Create multi-format educational content  \n- **Is AEB**: No  \n- **Reason**: Involves multiple actions for different formats (e.g., video, text) and dependencies on prior steps.  \n- **Suggestion**: Break into:  \n  1. Generate text-based content using Style Adaptation Guidelines.  \n  2. Generate video/image content using Format-Channel specs.  \n  3. Upload Campaign Content Assets to DAM.  \n\n---\n\n#### **Step 8**  \n- **Step**: Run automated brand voice consistency check  \n- **Is AEB**: **Yes**  \n- **Reason**: Single intent (validate content), interacts with one system (QA system), and can be implemented as a single API call (e.g., `run_compliance_check(content, guidelines)`).  \n\n---\n\n#### **Step 9**  \n- **Step**: Deploy content with conversion tracking parameters  \n- **Is AEB**: **Yes**  \n- **Reason**: Single intent (deploy content), interacts with one system boundary (channels + analytics), and can be implemented as a single API call (e.g., `deploy_content_with_tracking(asset, tracking_params)`).  \n\n---\n\n#### **Step 10**  \n- **Step**: Monitor real-time engagement vs targets  \n- **Is AEB**: No  \n- **Reason**: Involves continuous polling/sequencing and dynamic decision-making for recommendations.  \n- **Suggestion**: Split into:  \n  1. Fetch real-time engagement data.  \n  2. Compare metrics to targets.  \n  3. Generate Dynamic Optimization Recommendations.  \n\n---\n\n### Summary of AEBs  \n**Valid AEBs**: Steps 8, 9  \n**Invalid AEBs**: Steps 1â€“7, 10 (require decomposition into smaller AEBs).",
    "analysis_complete": true
  },
  "io_decomposed": true
}