{
  "task_id": "27614dc7e3ea",
  "input": "Analyze a new market's entry potential by gathering data from multiple sources, synthesizing insights to address uncertainties, and producing a structured market entry strategy report.",
  "required_inputs": [],
  "outputs": [
    "result"
  ],
  "subtasks": [],
  "dependency_structure": {
    "type": "dependency_driven",
    "graph": {},
    "total_subtasks": 0
  },
  "execution_plan": {
    "model_used": "AI1",
    "model_endpoint": "qwen/qwen3-235b-a22b",
    "inputs": [
      {
        "name": "T",
        "source_type": "USER-CONTROLLED",
        "source_origin": "User specification",
        "input_data": "Geographic region/country name",
        "bound_reference": "Requires explicit user provision or linkage."
      },
      {
        "name": "I",
        "source_type": "USER-CONTROLLED",
        "source_origin": "User specification",
        "input_data": "NAICS/SIC code or textual description",
        "bound_reference": "Requires explicit user provision or linkage."
      },
      {
        "name": "H",
        "source_type": "SYSTEM-RETRIEVABLE",
        "source_origin": "Market research database (e.g., Statista API)",
        "input_data": "Annual revenue/value metrics for target industry (2018–2023)",
        "bound_reference": "[DEPTH STOP - Terminal input, do not further decompose]"
      },
      {
        "name": "C",
        "source_type": "SYSTEM-RETRIEVABLE",
        "source_origin": "Business intelligence platform (e.g., Crunchbase Pro)",
        "input_data": "Top 10 competitors’ revenue/share percentages",
        "bound_reference": "[DEPTH STOP - Terminal input, do not further decompose]"
      },
      {
        "name": "R",
        "source_type": "SYSTEM-RETRIEVABLE",
        "source_origin": "Government open-data API (e.g., regulations.gov)",
        "input_data": "Compliance mandates, tariffs, and restrictions",
        "bound_reference": "[DEPTH STOP - Terminal input, do not further decompose]"
      },
      {
        "name": "C",
        "source_type": "SYSTEM-RETRIEVABLE",
        "source_origin": "National census database (e.g., US Census Bureau)",
        "input_data": "Age distribution, income levels, urbanization rates",
        "bound_reference": "[DEPTH STOP - Terminal input, do not further decompose]"
      },
      {
        "name": "M",
        "source_type": "DERIVABLE",
        "source_origin": "Historical Market Size Data (Input 3)",
        "input_data": "Year-over-year percentage change in market size",
        "bound_reference": "Derived via [(Value_t+1 - Value_t)/Value_t] * 100"
      },
      {
        "name": "C",
        "source_type": "DERIVABLE",
        "source_origin": "Competitor Market Share Data (Input 4)",
        "input_data": "Herfindahl-Hirschman Index (HHI) calculation",
        "bound_reference": "Derived via Σ(share_i²) for top 10 competitors"
      },
      {
        "name": "C",
        "source_type": "DERIVABLE",
        "source_origin": "Customer Demographics (Input 6) + external survey data",
        "input_data": "Correlation between demographic shifts and demand patterns",
        "bound_reference": "Requires statistical modeling (not further decomposed)"
      },
      {
        "name": "E",
        "source_type": "DERIVABLE",
        "source_origin": "Regulatory Requirements (Input 5) + Competitive Landscape Score (Input 8)",
        "input_data": "Composite score (regulatory complexity × HHI)",
        "bound_reference": "Derived via multiplicative weighting"
      },
      {
        "name": "R",
        "source_type": "DERIVABLE",
        "source_origin": "Entry Barriers Assessment (Input 10) + Market Growth Rate (Input 7)",
        "input_data": "Risk matrix (high/medium/low) based on growth vs. barriers",
        "bound_reference": "Derived via threshold analysis"
      },
      {
        "name": "M",
        "source_type": "USER-CONTROLLED",
        "source_origin": "User-provided template/guidelines",
        "input_data": "Structured methodology (e.g., Ansoff Matrix)",
        "bound_reference": "Requires explicit user provision or linkage."
      },
      {
        "name": "R",
        "source_type": "USER-CONTROLLED",
        "source_origin": "User-defined budget/limitations",
        "input_data": "Capital limits, timeline, staffing caps",
        "bound_reference": "Requires explicit user provision or linkage."
      }
    ],
    "outputs": [
      "Market Growth Rate Calculation",
      "Competitive Landscape Score",
      "Customer Demand Trend Analysis",
      "Entry Barriers Assessment",
      "Risk Factor Matrix",
      "Final Market Entry Strategy Report"
    ],
    "steps": [
      "Uses: Target Market Region (1), Industry Sector (2)  \nAction: Validate region/sector compatibility with data source geographies/classifications  \nProduces: Scope Validation Report  \nStores/Sends To: Internal tracking system",
      "Uses: Historical Market Size Data (3)  \nAction: Retrieve 5-year market size history via Statista API  \nProduces: Raw Market Size Dataset  \nStores/Sends To: Local database",
      "Uses: Competitor Market Share Data (4)  \nAction: Fetch competitor rankings and revenue shares via Crunchbase API  \nProduces: Competitor Analysis Dataset  \nStores/Sends To: Local database",
      "Uses: Regulatory Requirements (5)  \nAction: Query government API for compliance mandates  \nProduces: Regulatory Compliance Document  \nStores/Sends To: Local database",
      "Uses: Historical Market Size Data (3)  \nAction: Calculate CAGR using [(Final/Initial)^(1/n)-1]*100  \nProduces: Market Growth Rate (7)  \nStores/Sends To: Analysis workbook",
      "Uses: Competitor Market Share Data (4)  \nAction: Compute HHI score for market concentration  \nProduces: Competitive Landscape Score (8)  \nStores/Sends To: Analysis workbook",
      "Uses: Customer Demographics (6)  \nAction: Cross-reference census data with external demand studies  \nProduces: Customer Demand Trends (9)  \nStores/Sends To: Analysis workbook",
      "Uses: Regulatory Requirements (5), Competitive Landscape Score (8)  \nAction: Multiply regulatory complexity score (1–10) by HHI  \nProduces: Entry Barriers Assessment (10)  \nStores/Sends To: Analysis workbook",
      "Uses: Market Growth Rate (7), Entry Barriers Assessment (10)  \nAction: Plot growth vs. barriers in 3x3 risk matrix  \nProduces: Risk Factors (11)  \nStores/Sends To: Analysis workbook",
      "Uses: Market Entry Strategy Framework (12), Resource Allocation Constraints (13), all prior outputs  \nAction: Synthesize insights into strategy template  \nProduces: Draft Strategy Report  \nStores/Sends To: Report generator",
      "Uses: Draft Strategy Report  \nAction: Validate report completeness against user-defined framework  \nProduces: Final Market Entry Strategy Report  \nStores/Sends To: User portal/email  \n\n--- \n\n[All DERIVABLE inputs have been decomposed to SYSTEM-RETRIEVABLE/USER-CONTROLLED sources. No implicit data sources remain.]"
    ],
    "raw_response": "Inputs:\n1. Target Market Region  \n   Source Type: USER-CONTROLLED  \n   Source Origin: User specification  \n   Input Data: Geographic region/country name  \n   Bound Reference: Requires explicit user provision or linkage.  \n\n2. Industry Sector  \n   Source Type: USER-CONTROLLED  \n   Source Origin: User specification  \n   Input Data: NAICS/SIC code or textual description  \n   Bound Reference: Requires explicit user provision or linkage.  \n\n3. Historical Market Size Data  \n   Source Type: SYSTEM-RETRIEVABLE  \n   Source Origin: Market research database (e.g., Statista API)  \n   Input Data: Annual revenue/value metrics for target industry (2018–2023)  \n   Bound Reference: [DEPTH STOP - Terminal input, do not further decompose]  \n\n4. Competitor Market Share Data  \n   Source Type: SYSTEM-RETRIEVABLE  \n   Source Origin: Business intelligence platform (e.g., Crunchbase Pro)  \n   Input Data: Top 10 competitors’ revenue/share percentages  \n   Bound Reference: [DEPTH STOP - Terminal input, do not further decompose]  \n\n5. Regulatory Requirements  \n   Source Type: SYSTEM-RETRIEVABLE  \n   Source Origin: Government open-data API (e.g., regulations.gov)  \n   Input Data: Compliance mandates, tariffs, and restrictions  \n   Bound Reference: [DEPTH STOP - Terminal input, do not further decompose]  \n\n6. Customer Demographics  \n   Source Type: SYSTEM-RETRIEVABLE  \n   Source Origin: National census database (e.g., US Census Bureau)  \n   Input Data: Age distribution, income levels, urbanization rates  \n   Bound Reference: [DEPTH STOP - Terminal input, do not further decompose]  \n\n7. Market Growth Rate  \n   Source Type: DERIVABLE  \n   Source Origin: Historical Market Size Data (Input 3)  \n   Input Data: Year-over-year percentage change in market size  \n   Bound Reference: Derived via [(Value_t+1 - Value_t)/Value_t] * 100  \n\n8. Competitive Landscape Score  \n   Source Type: DERIVABLE  \n   Source Origin: Competitor Market Share Data (Input 4)  \n   Input Data: Herfindahl-Hirschman Index (HHI) calculation  \n   Bound Reference: Derived via Σ(share_i²) for top 10 competitors  \n\n9. Customer Demand Trends  \n   Source Type: DERIVABLE  \n   Source Origin: Customer Demographics (Input 6) + external survey data  \n   Input Data: Correlation between demographic shifts and demand patterns  \n   Bound Reference: Requires statistical modeling (not further decomposed)  \n\n10. Entry Barriers Assessment  \n    Source Type: DERIVABLE  \n    Source Origin: Regulatory Requirements (Input 5) + Competitive Landscape Score (Input 8)  \n    Input Data: Composite score (regulatory complexity × HHI)  \n    Bound Reference: Derived via multiplicative weighting  \n\n11. Risk Factors  \n    Source Type: DERIVABLE  \n    Source Origin: Entry Barriers Assessment (Input 10) + Market Growth Rate (Input 7)  \n    Input Data: Risk matrix (high/medium/low) based on growth vs. barriers  \n    Bound Reference: Derived via threshold analysis  \n\n12. Market Entry Strategy Framework  \n    Source Type: USER-CONTROLLED  \n    Source Origin: User-provided template/guidelines  \n    Input Data: Structured methodology (e.g., Ansoff Matrix)  \n    Bound Reference: Requires explicit user provision or linkage.  \n\n13. Resource Allocation Constraints  \n    Source Type: USER-CONTROLLED  \n    Source Origin: User-defined budget/limitations  \n    Input Data: Capital limits, timeline, staffing caps  \n    Bound Reference: Requires explicit user provision or linkage.  \n\n---\n\nOutputs:  \n1. Market Growth Rate Calculation  \n2. Competitive Landscape Score  \n3. Customer Demand Trend Analysis  \n4. Entry Barriers Assessment  \n5. Risk Factor Matrix  \n6. Final Market Entry Strategy Report (PDF/docx)  \n\n---\n\nSteps:  \nStep 1:  \nUses: Target Market Region (1), Industry Sector (2)  \nAction: Validate region/sector compatibility with data source geographies/classifications  \nProduces: Scope Validation Report  \nStores/Sends To: Internal tracking system  \n\nStep 2:  \nUses: Historical Market Size Data (3)  \nAction: Retrieve 5-year market size history via Statista API  \nProduces: Raw Market Size Dataset  \nStores/Sends To: Local database  \n\nStep 3:  \nUses: Competitor Market Share Data (4)  \nAction: Fetch competitor rankings and revenue shares via Crunchbase API  \nProduces: Competitor Analysis Dataset  \nStores/Sends To: Local database  \n\nStep 4:  \nUses: Regulatory Requirements (5)  \nAction: Query government API for compliance mandates  \nProduces: Regulatory Compliance Document  \nStores/Sends To: Local database  \n\nStep 5:  \nUses: Historical Market Size Data (3)  \nAction: Calculate CAGR using [(Final/Initial)^(1/n)-1]*100  \nProduces: Market Growth Rate (7)  \nStores/Sends To: Analysis workbook  \n\nStep 6:  \nUses: Competitor Market Share Data (4)  \nAction: Compute HHI score for market concentration  \nProduces: Competitive Landscape Score (8)  \nStores/Sends To: Analysis workbook  \n\nStep 7:  \nUses: Customer Demographics (6)  \nAction: Cross-reference census data with external demand studies  \nProduces: Customer Demand Trends (9)  \nStores/Sends To: Analysis workbook  \n\nStep 8:  \nUses: Regulatory Requirements (5), Competitive Landscape Score (8)  \nAction: Multiply regulatory complexity score (1–10) by HHI  \nProduces: Entry Barriers Assessment (10)  \nStores/Sends To: Analysis workbook  \n\nStep 9:  \nUses: Market Growth Rate (7), Entry Barriers Assessment (10)  \nAction: Plot growth vs. barriers in 3x3 risk matrix  \nProduces: Risk Factors (11)  \nStores/Sends To: Analysis workbook  \n\nStep 10:  \nUses: Market Entry Strategy Framework (12), Resource Allocation Constraints (13), all prior outputs  \nAction: Synthesize insights into strategy template  \nProduces: Draft Strategy Report  \nStores/Sends To: Report generator  \n\nStep 11:  \nUses: Draft Strategy Report  \nAction: Validate report completeness against user-defined framework  \nProduces: Final Market Entry Strategy Report  \nStores/Sends To: User portal/email  \n\n--- \n\n[All DERIVABLE inputs have been decomposed to SYSTEM-RETRIEVABLE/USER-CONTROLLED sources. No implicit data sources remain.]"
  },
  "aeb_analysis": {
    "steps_count": 11,
    "aeb_analysis_raw": "**Step-by-Step Analysis:**\n\n---\n\n**Step 1**  \n- **Is AEB:** No  \n- **Reason:** Involves validation logic (branching/conditional checks) and combines two inputs (region + sector) for compatibility.  \n- **Suggestion:** Split into two separate validations:  \n  - Validate region compatibility with data source geographies.  \n  - Validate sector compatibility with data source classifications.  \n\n---\n\n**Step 2**  \n- **Is AEB:** Yes  \n- **Reason:** Single API call to Statista, retrieves data with no branching, sequencing, or validation.  \n\n---\n\n**Step 3**  \n- **Is AEB:** Yes  \n- **Reason:** Single API call to Crunchbase, no logic beyond data retrieval.  \n\n---\n\n**Step 4**  \n- **Is AEB:** Yes  \n- **Reason:** Direct query to a government API for compliance mandates.  \n\n---\n\n**Step 5**  \n- **Is AEB:** Yes  \n- **Reason:** Pure mathematical calculation (CAGR) using pre-retrieved data, no branching.  \n\n---\n\n**Step 6**  \n- **Is AEB:** Yes  \n- **Reason:** Pure mathematical computation (HHI) using pre-retrieved data.  \n\n---\n\n**Step 7**  \n- **Is AEB:** No  \n- **Reason:** Combines two external data sources (census + demand studies), which may involve merging logic or transformations.  \n- **Suggestion:** Break into:  \n  - Retrieve census data.  \n  - Retrieve external demand studies.  \n  - Merge datasets (if implemented as a single function, this could be an AEB).  \n\n---\n\n**Step 8**  \n- **Is AEB:** Yes  \n- **Reason:** Simple arithmetic operation (multiplication) with pre-retrieved inputs.  \n\n---\n\n**Step 9**  \n- **Is AEB:** No  \n- **Reason:** Plotting a risk matrix likely involves visualization logic (e.g., axis mapping, quadrant assignment), which may include branching.  \n- **Suggestion:** Split into:  \n  - Generate risk matrix structure (3x3 grid).  \n  - Map growth vs. barriers to grid coordinates.  \n\n---\n\n**Step 10**  \n- **Is AEB:** No  \n- **Reason:** Synthesis involves combining multiple inputs into a template, which may require branching or prioritization logic.  \n- **Suggestion:** Break into discrete insertions:  \n  - Insert growth rate into strategy template.  \n  - Insert competitive landscape score into template.  \n  - Insert entry barriers assessment into template.  \n\n---\n\n**Step 11**  \n- **Is AEB:** No  \n- **Reason:** Validation against a framework implies conditional checks (e.g., \"is section X complete?\").  \n- **Suggestion:** Split into individual validation checks for each required report component.  \n\n---\n\n**Summary of Non-AEB Steps:**  \nSteps 1, 7, 9, 10, and 11 require decomposition to meet AEB criteria. All other steps comply with the AEB definition.",
    "analysis_complete": true
  },
  "io_decomposed": true
}