{
  "task_id": "33bad00bf805",
  "input": "Create an end-to-end content campaign for a manufacturing firm that requires market research, multi-format content like articles and videos, consistent messaging across all channels, and measurable goals for lead generation.",
  "required_inputs": [],
  "outputs": [
    "result"
  ],
  "subtasks": [],
  "dependency_structure": {
    "type": "dependency_driven",
    "graph": {},
    "total_subtasks": 0
  },
  "execution_plan": {
    "model_used": "AI1",
    "model_endpoint": "qwen/qwen3-235b-a22b",
    "inputs": [
      {
        "name": "Market Research Objectives",
        "source_type": "USER-CONTROLLED",
        "source_origin": "Client (manufacturing firm)",
        "input_data": "Specific goals for market research (e.g., competitor analysis scope, audience demographics)",
        "bound_reference": "N/A"
      },
      {
        "name": "Industry Reports",
        "source_type": "SYSTEM-RETRIEVABLE",
        "source_origin": "External databases (e.g., Statista, IBISWorld)",
        "input_data": "Market trends, growth rates, competitor benchmarks",
        "bound_reference": "API endpoint: `https://api.industrydata.com/reports/manufacturing`"
      },
      {
        "name": "Competitor Data",
        "source_type": "SYSTEM-RETRIEVABLE",
        "source_origin": "SEO tools (e.g., Ahrefs, SEMrush)",
        "input_data": "Competitor content strategies, keyword rankings, backlink profiles",
        "bound_reference": "API endpoint: `https://api.seoanalytics.com/competitor/manufacturing`"
      },
      {
        "name": "Customer Survey Responses",
        "source_type": "USER-CONTROLLED",
        "source_origin": "Internal CRM or user-uploaded files",
        "input_data": "Raw survey data from existing customers",
        "bound_reference": "N/A"
      },
      {
        "name": "Brand Guidelines",
        "source_type": "SYSTEM-RETRIEVABLE",
        "source_origin": "Internal company database or CMS",
        "input_data": "Logo usage rules, tone-of-voice directives, color palettes",
        "bound_reference": "File path: `\\\\company-server\\\\brand-assets\\\\guidelines.pdf`"
      },
      {
        "name": "Lead Generation Targets",
        "source_type": "USER-CONTROLLED",
        "source_origin": "Sales team or client stakeholders",
        "input_data": "Numeric goals (e.g., 500 leads/month, 10% conversion rate)",
        "bound_reference": "N/A"
      },
      {
        "name": "Content Distribution Channels",
        "source_type": "SYSTEM-RETRIEVABLE",
        "source_origin": "Marketing platforms (e.g., LinkedIn API, YouTube API, Mailchimp)",
        "input_data": "Channel-specific requirements (e.g., video resolution, email templates)",
        "bound_reference": "API endpoints: `https://api.linkedin.com/content`, `https://api.youtube.com/upload`"
      }
    ],
    "outputs": [
      "**Market Research Report**",
      "Aggregated insights from industry reports, competitor data, and surveys.",
      "**Target Audience Personas**",
      "Derived demographics, pain points, and preferences.",
      "**Content Calendar**",
      "Scheduled articles, videos, and cross-channel distribution plan.",
      "**Branded Content Assets**",
      "Published videos, blog posts, and social media graphics.",
      "**Lead Generation Dashboard**",
      "Real-time tracking of conversions, CTRs, and ROI."
    ],
    "steps": [],
    "raw_response": "Inputs:  \n1. **Market Research Objectives**  \n   Source Type: USER-CONTROLLED  \n   Source Origin: Client (manufacturing firm)  \n   Input Data: Specific goals for market research (e.g., competitor analysis scope, audience demographics)  \n   Bound Reference: N/A  \n   Note: Requires explicit user provision or linkage.  \n\n2. **Industry Reports**  \n   Source Type: SYSTEM-RETRIEVABLE  \n   Source Origin: External databases (e.g., Statista, IBISWorld)  \n   Input Data: Market trends, growth rates, competitor benchmarks  \n   Bound Reference: API endpoint: `https://api.industrydata.com/reports/manufacturing`  \n\n3. **Competitor Data**  \n   Source Type: SYSTEM-RETRIEVABLE  \n   Source Origin: SEO tools (e.g., Ahrefs, SEMrush)  \n   Input Data: Competitor content strategies, keyword rankings, backlink profiles  \n   Bound Reference: API endpoint: `https://api.seoanalytics.com/competitor/manufacturing`  \n\n4. **Customer Survey Responses**  \n   Source Type: USER-CONTROLLED  \n   Source Origin: Internal CRM or user-uploaded files  \n   Input Data: Raw survey data from existing customers  \n   Bound Reference: N/A  \n   Note: Requires explicit user provision or linkage.  \n\n5. **Brand Guidelines**  \n   Source Type: SYSTEM-RETRIEVABLE  \n   Source Origin: Internal company database or CMS  \n   Input Data: Logo usage rules, tone-of-voice directives, color palettes  \n   Bound Reference: File path: `\\\\company-server\\\\brand-assets\\\\guidelines.pdf`  \n\n6. **Lead Generation Targets**  \n   Source Type: USER-CONTROLLED  \n   Source Origin: Sales team or client stakeholders  \n   Input Data: Numeric goals (e.g., 500 leads/month, 10% conversion rate)  \n   Bound Reference: N/A  \n   Note: Requires explicit user provision or linkage.  \n\n7. **Content Distribution Channels**  \n   Source Type: SYSTEM-RETRIEVABLE  \n   Source Origin: Marketing platforms (e.g., LinkedIn API, YouTube API, Mailchimp)  \n   Input Data: Channel-specific requirements (e.g., video resolution, email templates)  \n   Bound Reference: API endpoints: `https://api.linkedin.com/content`, `https://api.youtube.com/upload`  \n\n---\n\nOutputs:  \n1. **Market Research Report** (PDF/DOCX)  \n   - Aggregated insights from industry reports, competitor data, and surveys.  \n2. **Target Audience Personas** (JSON/CSV)  \n   - Derived demographics, pain points, and preferences.  \n3. **Content Calendar** (XLSX/ICS)  \n   - Scheduled articles, videos, and cross-channel distribution plan.  \n4. **Branded Content Assets** (MP4/PDF/JPG)  \n   - Published videos, blog posts, and social media graphics.  \n5. **Lead Generation Dashboard** (Interactive BI Tool)  \n   - Real-time tracking of conversions, CTRs, and ROI.  \n\n---\n\nSteps:  \n**Step 1: Gather Market Research Inputs**  \nUses: Market Research Objectives (USER-CONTROLLED), Industry Reports (SYSTEM-RETRIEVABLE), Competitor Data (SYSTEM-RETRIEVABLE), Customer Survey Responses (USER-CONTROLLED)  \nAction: Aggregate and validate raw data from all sources.  \nProduces: Unified Market Dataset  \nStores/Sends To: Internal data warehouse (`\\\\data-warehouse\\\\campaigns\\\\manufacturing\\\\research`)  \n\n**Step 2: Generate Audience Personas**  \nUses: Unified Market Dataset (DERIVABLE from Step 1)  \nAction: Cluster analysis on demographics, behavior, and survey responses using segmentation tools.  \nProduces: Target Audience Personas  \nStores/Sends To: CRM system (`https://crm.example.com/personas/manufacturing`)  \n\n**Step 3: Define Content Strategy**  \nUses: Target Audience Personas (DERIVABLE), Brand Guidelines (SYSTEM-RETRIEVABLE), Lead Generation Targets (USER-CONTROLLED)  \nAction: Map content formats (videos/articles) to persona pain points and KPIs.  \nProduces: Content Strategy Document  \nStores/Sends To: Shared team drive (`\\\\team-drive\\\\campaigns\\\\content-strategy.pdf`)  \n\n**Step 4: Create Content Assets**  \nUses: Content Strategy Document (DERIVABLE), Brand Guidelines (SYSTEM-RETRIEVABLE)  \nAction: Produce videos/articles aligned with brand voice and distribution requirements.  \nProduces: Branded Content Assets  \nStores/Sends To: Asset management platform (`https://assets.example.com/campaigns/manufacturing`)  \n\n**Step 5: Launch Distribution Campaign**  \nUses: Content Assets (DERIVABLE), Content Distribution Channels (SYSTEM-RETRIEVABLE)  \nAction: Schedule and publish content across channels using automation tools.  \nProduces: Published Campaign Posts  \nStores/Sends To: Channel APIs (LinkedIn, YouTube, Email)  \n\n**Step 6: Monitor Lead Generation**  \nUses: Lead Generation Targets (USER-CONTROLLED), Distribution Campaign Data (SYSTEM-RETRIEVABLE via analytics APIs)  \nAction: Track clicks, form fills, and conversions in real-time.  \nProduces: Lead Generation Dashboard  \nStores/Sends To: BI tool (`https://bi.example.com/dashboards/leads`)  \n\n**Step 7: Optimize Campaign**  \nUses: Lead Generation Dashboard (DERIVABLE), Market Research Report (DERIVABLE)  \nAction: Adjust content mix and targeting based on performance metrics.  \nProduces: Revised Content Calendar  \nStores/Sends To: Shared team drive (`\\\\team-drive\\\\campaigns\\\\revised-calendar.xlsx`)  \n\n---\n\n[DEPTH STOP] All leaf inputs (e.g., Industry Reports, Brand Guidelines, Lead Targets) are classified as SYSTEM-RETRIEVABLE or USER-CONTROLLED. DERIVABLE inputs (e.g., Personas, Content Strategy) are fully decomposed into base sources."
  },
  "aeb_analysis": {
    "steps_count": 0,
    "aeb_analysis": []
  },
  "io_decomposed": true
}