{
  "task_id": "679119d7b3c3",
  "input": "Lead a forensic review using structured analysis to identify critical risks, propose revisions, and deliver both technical and executive summaries.",
  "required_inputs": [],
  "outputs": [
    "result"
  ],
  "subtasks": [],
  "dependency_structure": {
    "type": "dependency_driven",
    "graph": {},
    "total_subtasks": 0
  },
  "execution_plan": {
    "model_used": "AI1",
    "model_endpoint": "qwen/qwen3-235b-a22b",
    "inputs": [
      {
        "name": "F",
        "source_type": "USER-CONTROLLED",
        "source_origin": "User organization",
        "input_data": "Raw system logs, transaction records, or operational datasets requiring review",
        "bound_reference": "N/A"
      },
      {
        "name": "R",
        "source_type": "USER-CONTROLLED",
        "source_origin": "User-defined compliance standards, business objectives, or risk thresholds",
        "input_data": "Numeric thresholds (e.g., fraud detection rates), regulatory requirements, or operational benchmarks",
        "bound_reference": "N/A"
      },
      {
        "name": "A",
        "source_type": "USER-CONTROLLED",
        "source_origin": "User organization",
        "input_data": "API keys, database login credentials, or authentication tokens for external systems",
        "bound_reference": "N/A"
      },
      {
        "name": "E",
        "source_type": "SYSTEM-RETRIEVABLE",
        "source_origin": "Third-party database/API (e.g., CRM, ERP, or threat intelligence platforms)",
        "input_data": "Structured records from connected systems (e.g., user activity logs, transaction histories)",
        "bound_reference": "Input 3 (Access Credentials)"
      },
      {
        "name": "R",
        "source_type": "DERIVABLE",
        "source_origin": "Computed from Forensic Dataset and Review Criteria",
        "input_data": "Patterns, anomalies, or deviations identified via statistical analysis",
        "bound_reference": "Inputs 1 and 2"
      },
      {
        "name": "R",
        "source_type": "DERIVABLE",
        "source_origin": "Computed from Risk Indicators",
        "input_data": "Quantified risk levels (e.g., 0–100 scale) per asset, process, or user",
        "bound_reference": "Input 5"
      },
      {
        "name": "C",
        "source_type": "DERIVABLE",
        "source_origin": "Computed from Review Criteria and Risk Scores",
        "input_data": "Mismatches between current state and required standards",
        "bound_reference": "Inputs 2 and 6"
      }
    ],
    "outputs": [
      "Technical Summary",
      "Artifact: Detailed report with risk indicators, scores, and root-cause analysis",
      "Storage: Internal knowledge base or shared drive",
      "Executive Summary",
      "Artifact: High-level risk overview, strategic recommendations, and compliance status",
      "Storage: PDF/email to stakeholders",
      "Revision Proposals",
      "Artifact: Prioritized action plan with technical fixes and policy updates",
      "Storage: Project management tool (e.g., Jira, Trello)",
      "Triggered Alerts",
      "Action: Automated notifications for critical risks (e.g., fraud detection)",
      "Destination: Security team dashboard"
    ],
    "steps": [
      "Uses: Input 1 (Forensic Dataset), Input 3 (Access Credentials)  \nAction: Ingest and validate forensic dataset; authenticate external system access  \nProduces: Verified dataset and active system connection  \nStores/Sends To: Internal analysis environment",
      "Uses: Input 4 (External System Data)  \nAction: Retrieve supplementary data (e.g., user activity logs) from connected systems  \nProduces: Combined dataset with internal and external records  \nStores/Sends To: Analysis database",
      "Uses: Input 1 (Forensic Dataset), Input 2 (Review Criteria)  \nAction: Apply statistical models to identify risk indicators (e.g., outlier detection)  \nProduces: Risk indicator matrix  \nStores/Sends To: Analysis database",
      "Uses: Input 5 (Risk Indicators)  \nAction: Calculate weighted risk scores using predefined formulas  \nProduces: Risk scorecard  \nStores/Sends To: Analysis database",
      "Uses: Input 2 (Review Criteria), Input 6 (Risk Scores)  \nAction: Compare scores against thresholds to identify compliance gaps  \nProduces: Compliance gap report  \nStores/Sends To: Analysis database",
      "Uses: Inputs 5 (Risk Indicators), 6 (Risk Scores), 7 (Compliance Gaps)  \nAction: Compile technical summary with methodology, findings, and root causes  \nProduces: Technical summary draft  \nStores/Sends To: Report generation tool",
      "Uses: Input 6 (Risk Scores), Input 7 (Compliance Gaps)  \nAction: Synthesize executive summary with strategic recommendations  \nProduces: Executive summary draft  \nStores/Sends To: Report generation tool",
      "Uses: Inputs 6 (Risk Scores), 7 (Compliance Gaps)  \nAction: Generate revision proposals with prioritized remediation steps  \nProduces: Revision proposal document  \nStores/Sends To: Project management tool",
      "Uses: Input 6 (Risk Scores)  \nAction: Trigger alerts for risks exceeding critical thresholds  \nProduces: Alert notifications  \nStores/Sends To: Security dashboard/email system  \n\n--- \n\n**Dependency Consistency Check**:  \n- All inputs used in steps  \n- No implicit data sources  \n- USER/SYSTEM inputs explicitly classified  \n- DERIVABLE inputs fully decomposed  \n- [DEPTH STOP] applied only to terminal inputs"
    ],
    "raw_response": "Inputs:  \n1. Forensic Dataset  \n   Source Type: USER-CONTROLLED  \n   Source Origin: User organization  \n   Input Data: Raw system logs, transaction records, or operational datasets requiring review  \n   Bound Reference: N/A  \n   Note: Requires explicit user provision or linkage.  \n\n2. Review Criteria  \n   Source Type: USER-CONTROLLED  \n   Source Origin: User-defined compliance standards, business objectives, or risk thresholds  \n   Input Data: Numeric thresholds (e.g., fraud detection rates), regulatory requirements, or operational benchmarks  \n   Bound Reference: N/A  \n   Note: Requires explicit user provision or linkage.  \n\n3. Access Credentials  \n   Source Type: USER-CONTROLLED  \n   Source Origin: User organization  \n   Input Data: API keys, database login credentials, or authentication tokens for external systems  \n   Bound Reference: N/A  \n   Note: Requires explicit user provision or linkage.  \n\n4. External System Data  \n   Source Type: SYSTEM-RETRIEVABLE  \n   Source Origin: Third-party database/API (e.g., CRM, ERP, or threat intelligence platforms)  \n   Input Data: Structured records from connected systems (e.g., user activity logs, transaction histories)  \n   Bound Reference: Input 3 (Access Credentials)  \n   Note: [DEPTH STOP - Terminal input, do not further decompose]  \n\n5. Risk Indicators  \n   Source Type: DERIVABLE  \n   Source Origin: Computed from Forensic Dataset and Review Criteria  \n   Input Data: Patterns, anomalies, or deviations identified via statistical analysis  \n   Bound Reference: Inputs 1 and 2  \n   Note: [DEPTH STOP - Terminal input, do not further decompose]  \n\n6. Risk Scores  \n   Source Type: DERIVABLE  \n   Source Origin: Computed from Risk Indicators  \n   Input Data: Quantified risk levels (e.g., 0–100 scale) per asset, process, or user  \n   Bound Reference: Input 5  \n   Note: [DEPTH STOP - Terminal input, do not further decompose]  \n\n7. Compliance Gaps  \n   Source Type: DERIVABLE  \n   Source Origin: Computed from Review Criteria and Risk Scores  \n   Input Data: Mismatches between current state and required standards  \n   Bound Reference: Inputs 2 and 6  \n   Note: [DEPTH STOP - Terminal input, do not further decompose]  \n\n---\n\nOutputs:  \n1. Technical Summary  \n   - Artifact: Detailed report with risk indicators, scores, and root-cause analysis  \n   - Storage: Internal knowledge base or shared drive  \n\n2. Executive Summary  \n   - Artifact: High-level risk overview, strategic recommendations, and compliance status  \n   - Storage: PDF/email to stakeholders  \n\n3. Revision Proposals  \n   - Artifact: Prioritized action plan with technical fixes and policy updates  \n   - Storage: Project management tool (e.g., Jira, Trello)  \n\n4. Triggered Alerts  \n   - Action: Automated notifications for critical risks (e.g., fraud detection)  \n   - Destination: Security team dashboard  \n\n---\n\nSteps:  \nStep 1:  \nUses: Input 1 (Forensic Dataset), Input 3 (Access Credentials)  \nAction: Ingest and validate forensic dataset; authenticate external system access  \nProduces: Verified dataset and active system connection  \nStores/Sends To: Internal analysis environment  \n\nStep 2:  \nUses: Input 4 (External System Data)  \nAction: Retrieve supplementary data (e.g., user activity logs) from connected systems  \nProduces: Combined dataset with internal and external records  \nStores/Sends To: Analysis database  \n\nStep 3:  \nUses: Input 1 (Forensic Dataset), Input 2 (Review Criteria)  \nAction: Apply statistical models to identify risk indicators (e.g., outlier detection)  \nProduces: Risk indicator matrix  \nStores/Sends To: Analysis database  \n\nStep 4:  \nUses: Input 5 (Risk Indicators)  \nAction: Calculate weighted risk scores using predefined formulas  \nProduces: Risk scorecard  \nStores/Sends To: Analysis database  \n\nStep 5:  \nUses: Input 2 (Review Criteria), Input 6 (Risk Scores)  \nAction: Compare scores against thresholds to identify compliance gaps  \nProduces: Compliance gap report  \nStores/Sends To: Analysis database  \n\nStep 6:  \nUses: Inputs 5 (Risk Indicators), 6 (Risk Scores), 7 (Compliance Gaps)  \nAction: Compile technical summary with methodology, findings, and root causes  \nProduces: Technical summary draft  \nStores/Sends To: Report generation tool  \n\nStep 7:  \nUses: Input 6 (Risk Scores), Input 7 (Compliance Gaps)  \nAction: Synthesize executive summary with strategic recommendations  \nProduces: Executive summary draft  \nStores/Sends To: Report generation tool  \n\nStep 8:  \nUses: Inputs 6 (Risk Scores), 7 (Compliance Gaps)  \nAction: Generate revision proposals with prioritized remediation steps  \nProduces: Revision proposal document  \nStores/Sends To: Project management tool  \n\nStep 9:  \nUses: Input 6 (Risk Scores)  \nAction: Trigger alerts for risks exceeding critical thresholds  \nProduces: Alert notifications  \nStores/Sends To: Security dashboard/email system  \n\n--- \n\n**Dependency Consistency Check**:  \n- All inputs used in steps  \n- No implicit data sources  \n- USER/SYSTEM inputs explicitly classified  \n- DERIVABLE inputs fully decomposed  \n- [DEPTH STOP] applied only to terminal inputs"
  },
  "aeb_analysis": {
    "steps_count": 9,
    "aeb_analysis_raw": null,
    "analysis_complete": true
  },
  "io_decomposed": true
}