{
  "task_id": "b0f7ce17aab9",
  "input": "Design a comprehensive fintech content campaign that includes research, produces various content formats, ensures cross-channel consistency, and targets specific measurable outcomes.",
  "required_inputs": [],
  "outputs": [
    "result"
  ],
  "subtasks": [],
  "dependency_structure": {
    "type": "dependency_driven",
    "graph": {},
    "total_subtasks": 0
  },
  "execution_plan": {
    "model_used": "AI1",
    "model_endpoint": "qwen/qwen3-235b-a22b",
    "inputs": [
      {
        "name": "Target Audience Profile",
        "source_type": "USER-CONTROLLED",
        "source_origin": "Marketing Team",
        "input_data": "Demographics, financial behavior patterns, pain points, preferred channels",
        "bound_reference": "None"
      },
      {
        "name": "Historical Customer Data",
        "source_type": "SYSTEM-RETRIEVABLE",
        "source_origin": "CRM Database (e.g., Salesforce)",
        "input_data": "Transaction records, user engagement logs, segmentation tags",
        "bound_reference": "None"
      },
      {
        "name": "Competitor Content Analysis",
        "source_type": "SYSTEM-RETRIEVABLE",
        "source_origin": "SEMrush/Ahrefs API",
        "input_data": "Competitor blog posts, social media activity, SEO keywords",
        "bound_reference": "None"
      },
      {
        "name": "Brand Guidelines",
        "source_type": "USER-CONTROLLED",
        "source_origin": "Internal Design Team",
        "input_data": "Tone of voice, visual assets, compliance requirements",
        "bound_reference": "None"
      },
      {
        "name": "KPI Definitions",
        "source_type": "USER-CONTROLLED",
        "source_origin": "Executive Stakeholders",
        "input_data": "Conversion rate targets, engagement benchmarks, ROI thresholds",
        "bound_reference": "None"
      },
      {
        "name": "Channel-Specific Requirements",
        "source_type": "USER-CONTROLLED",
        "source_origin": "Marketing Team",
        "input_data": "Platform style guides (e.g., LinkedIn vs. TikTok), ad specs",
        "bound_reference": "None"
      },
      {
        "name": "Budget Allocation",
        "source_type": "USER-CONTROLLED",
        "source_origin": "Finance Department",
        "input_data": "Spend limits for ads, influencer partnerships, production",
        "bound_reference": "None"
      },
      {
        "name": "Campaign Timeline",
        "source_type": "USER-CONTROLLED",
        "source_origin": "Project Manager",
        "input_data": "Launch dates, content refresh cycles, reporting deadlines",
        "bound_reference": "None"
      },
      {
        "name": "Website Analytics",
        "source_type": "SYSTEM-RETRIEVABLE",
        "source_origin": "Google Analytics 4",
        "input_data": "Traffic sources, bounce rates, funnel drop-offs",
        "bound_reference": "None"
      },
      {
        "name": "Regulatory Compliance Rules",
        "source_type": "SYSTEM-RETRIEVABLE",
        "source_origin": "Legal Database (e.g., GDPR, FINRA)",
        "input_data": "Disclosure requirements, restricted terminology",
        "bound_reference": "None"
      },
      {
        "name": "Audience Personas",
        "source_type": "DERIVABLE",
        "source_origin": "Derived from Target Audience Profile (1) and Historical Customer Data (2)",
        "input_data": "Synthesized behavioral archetypes",
        "bound_reference": "Inputs 1, 2"
      },
      {
        "name": "Content Calendar",
        "source_type": "DERIVABLE",
        "source_origin": "Derived from Campaign Timeline (8) and Channel-Specific Requirements (6)",
        "input_data": "Scheduled posts, format-channel mappings",
        "bound_reference": "Inputs 6, 8"
      },
      {
        "name": "Engagement Metrics Baseline",
        "source_type": "DERIVABLE",
        "source_origin": "Derived from Website Analytics (9) and Competitor Content Analysis (3)",
        "input_data": "Average CTR, time-on-page benchmarks",
        "bound_reference": "Inputs 3, 9"
      }
    ],
    "outputs": [
      "**Campaign Strategy Document**",
      "**Content Asset Repository**",
      "**Cross-Channel Analytics Dashboard**",
      "**CMS Update Log**",
      "**Social Media Posting Schedule**",
      "**Compliance Audit Report**"
    ],
    "steps": [],
    "raw_response": "Inputs:  \n1. **Target Audience Profile**  \n   Source Type: USER-CONTROLLED  \n   Source Origin: Marketing Team  \n   Input Data: Demographics, financial behavior patterns, pain points, preferred channels  \n   Bound Reference: None  \n   Note: Requires explicit user provision or linkage.  \n\n2. **Historical Customer Data**  \n   Source Type: SYSTEM-RETRIEVABLE  \n   Source Origin: CRM Database (e.g., Salesforce)  \n   Input Data: Transaction records, user engagement logs, segmentation tags  \n   Bound Reference: None  \n\n3. **Competitor Content Analysis**  \n   Source Type: SYSTEM-RETRIEVABLE  \n   Source Origin: SEMrush/Ahrefs API  \n   Input Data: Competitor blog posts, social media activity, SEO keywords  \n   Bound Reference: None  \n\n4. **Brand Guidelines**  \n   Source Type: USER-CONTROLLED  \n   Source Origin: Internal Design Team  \n   Input Data: Tone of voice, visual assets, compliance requirements  \n   Bound Reference: None  \n   Note: Requires explicit user provision or linkage.  \n\n5. **KPI Definitions**  \n   Source Type: USER-CONTROLLED  \n   Source Origin: Executive Stakeholders  \n   Input Data: Conversion rate targets, engagement benchmarks, ROI thresholds  \n   Bound Reference: None  \n   Note: Requires explicit user provision or linkage.  \n\n6. **Channel-Specific Requirements**  \n   Source Type: USER-CONTROLLED  \n   Source Origin: Marketing Team  \n   Input Data: Platform style guides (e.g., LinkedIn vs. TikTok), ad specs  \n   Bound Reference: None  \n   Note: Requires explicit user provision or linkage.  \n\n7. **Budget Allocation**  \n   Source Type: USER-CONTROLLED  \n   Source Origin: Finance Department  \n   Input Data: Spend limits for ads, influencer partnerships, production  \n   Bound Reference: None  \n   Note: Requires explicit user provision or linkage.  \n\n8. **Campaign Timeline**  \n   Source Type: USER-CONTROLLED  \n   Source Origin: Project Manager  \n   Input Data: Launch dates, content refresh cycles, reporting deadlines  \n   Bound Reference: None  \n   Note: Requires explicit user provision or linkage.  \n\n9. **Website Analytics**  \n   Source Type: SYSTEM-RETRIEVABLE  \n   Source Origin: Google Analytics 4  \n   Input Data: Traffic sources, bounce rates, funnel drop-offs  \n   Bound Reference: None  \n\n10. **Regulatory Compliance Rules**  \n    Source Type: SYSTEM-RETRIEVABLE  \n    Source Origin: Legal Database (e.g., GDPR, FINRA)  \n    Input Data: Disclosure requirements, restricted terminology  \n    Bound Reference: None  \n\n11. **Audience Personas**  \n    Source Type: DERIVABLE  \n    Source Origin: Derived from Target Audience Profile (1) and Historical Customer Data (2)  \n    Input Data: Synthesized behavioral archetypes  \n    Bound Reference: Inputs 1, 2  \n    Note: [DEPTH STOP - Terminal input, do not further decompose]  \n\n12. **Content Calendar**  \n    Source Type: DERIVABLE  \n    Source Origin: Derived from Campaign Timeline (8) and Channel-Specific Requirements (6)  \n    Input Data: Scheduled posts, format-channel mappings  \n    Bound Reference: Inputs 6, 8  \n    Note: [DEPTH STOP - Terminal input, do not further decompose]  \n\n13. **Engagement Metrics Baseline**  \n    Source Type: DERIVABLE  \n    Source Origin: Derived from Website Analytics (9) and Competitor Content Analysis (3)  \n    Input Data: Average CTR, time-on-page benchmarks  \n    Bound Reference: Inputs 3, 9  \n    Note: [DEPTH STOP - Terminal input, do not further decompose]  \n\n---\n\nOutputs:  \n1. **Campaign Strategy Document** (PDF)  \n2. **Content Asset Repository** (Blog Posts, Infographics, Video Scripts)  \n3. **Cross-Channel Analytics Dashboard** (Google Data Studio)  \n4. **CMS Update Log** (Content Management System)  \n5. **Social Media Posting Schedule** (CSV/ICS)  \n6. **Compliance Audit Report** (PDF)  \n\n---\n\nSteps:  \n**Step 1**: Audience Research Synthesis  \nUses: Target Audience Profile (1), Historical Customer Data (2)  \nAction: Cluster demographics and behavior data to refine segmentation  \nProduces: Audience Personas (11)  \nStores/Sends To: Internal Wiki  \n\n**Step 2**: Competitive Benchmarking  \nUses: Competitor Content Analysis (3), Engagement Metrics Baseline (13)  \nAction: Identify content gaps and high-performing formats  \nProduces: Competitor Benchmarking Report  \nStores/Sends To: Google Drive  \n\n**Step 3**: KPI Alignment Workshop  \nUses: KPI Definitions (5), Engagement Metrics Baseline (13)  \nAction: Map campaign goals to measurable metrics  \nProduces: KPI Alignment Matrix  \nStores/Sends To: Stakeholder Portal  \n\n**Step 4**: Content Calendar Development  \nUses: Campaign Timeline (8), Content Calendar (12)  \nAction: Map content formats to channels and deadlines  \nProduces: Finalized Content Calendar (5)  \nStores/Sends To: Asana/Trello  \n\n**Step 5**: Content Creation  \nUses: Brand Guidelines (4), Channel-Specific Requirements (6)  \nAction: Produce blog posts, videos, and social assets with compliance checks  \nProduces: Content Asset Repository (2)  \nStores/Sends To: Digital Asset Management (DAM) System  \n\n**Step 6**: Pre-Launch Compliance Audit  \nUses: Regulatory Compliance Rules (10), Content Asset Repository (2)  \nAction: Validate disclosures and terminology  \nProduces: Compliance Audit Report (6)  \nStores/Sends To: Legal Team Portal  \n\n**Step 7**: Multi-Channel Distribution  \nUses: Content Calendar (12), Budget Allocation (7)  \nAction: Schedule posts and activate paid campaigns  \nProduces: CMS Update Log (4)  \nStores/Sends To: WordPress Admin / Meta Ads Manager  \n\n**Step 8**: Performance Monitoring  \nUses: Website Analytics (9), KPI Alignment Matrix (3)  \nAction: Track metrics against benchmarks daily  \nProduces: Cross-Channel Analytics Dashboard (3)  \nStores/Sends To: Google Data Studio  \n\n**Step 9**: Iterative Optimization  \nUses: Engagement Metrics Baseline (13), Performance Monitoring (8)  \nAction: A/B test headlines, reallocate budget to top channels  \nProduces: Updated Content Strategy (PDF)  \nStores/Sends To: Marketing Team Inbox  \n\n--- \n\n[DEPTH STOP CONDITIONS MET: All DERIVABLE inputs (11, 12, 13) decomposed into USER/SYSTEM sources]  \n[DEPENDENCY CONSISTENCY CHECK: All inputs used in steps; no implicit sources]"
  },
  "aeb_analysis": {
    "steps_count": 0,
    "aeb_analysis": []
  },
  "io_decomposed": true
}