{
  "task_id": "4477ca1bf9a3",
  "input": "Design a customer support workflow that routes inquiries, resolves simple ones automatically, escalates complex cases, and tracks performance metrics.",
  "required_inputs": [],
  "outputs": [
    "result"
  ],
  "subtasks": [],
  "dependency_structure": {
    "type": "dependency_driven",
    "graph": {},
    "total_subtasks": 0
  },
  "execution_plan": {
    "model_used": "AI1",
    "model_endpoint": "qwen/qwen3-235b-a22b",
    "inputs": [
      {
        "name": "R",
        "source_type": "USER-CONTROLLED",
        "source_origin": "Customer support team",
        "input_data": "Inquiry categorization rules (e.g., keywords, priority levels)",
        "bound_reference": "None"
      },
      {
        "name": "K",
        "source_type": "SYSTEM-RETRIEVABLE",
        "source_origin": "Internal knowledge management API",
        "input_data": "Pre-approved resolution templates and FAQs",
        "bound_reference": "None"
      },
      {
        "name": "A",
        "source_type": "USER-CONTROLLED",
        "source_origin": "Support operations manager",
        "input_data": "Decision trees for automated resolution",
        "bound_reference": "None"
      },
      {
        "name": "E",
        "source_type": "USER-CONTROLLED",
        "source_origin": "Customer service director",
        "input_data": "Complexity thresholds and escalation pathways",
        "bound_reference": "None"
      },
      {
        "name": "T",
        "source_type": "SYSTEM-RETRIEVABLE",
        "source_origin": "Zendesk/ServiceNow API endpoint",
        "input_data": "Real-time case tracking and assignment capabilities",
        "bound_reference": "None"
      },
      {
        "name": "P",
        "source_type": "USER-CONTROLLED",
        "source_origin": "Business intelligence team",
        "input_data": "KPIs to track (e.g., resolution time, satisfaction scores)",
        "bound_reference": "None"
      }
    ],
    "outputs": [
      "Workflow Architecture Diagram",
      "Automated Response Templates",
      "Escalated Case Queue",
      "Performance Metrics Dashboard",
      "System Integration Configuration"
    ],
    "steps": [
      "Uses: Routing Criteria\nAction: Define inquiry routing logic based on user-provided categorization rules\nProduces: Routing logic specification\nStores/Sends To: Workflow engine configuration",
      "Uses: Knowledge Base Dataset\nAction: Establish API connection to knowledge management system for resolution lookup\nProduces: Knowledge base integration module\nStores/Sends To: Workflow engine knowledge layer",
      "Uses: Automated Resolution Ruleset\nAction: Implement decision trees for automated resolution pathways\nProduces: Automated resolution configuration\nStores/Sends To: Workflow engine automation layer",
      "Uses: Escalation Criteria\nAction: Configure escalation thresholds and assignment rules\nProduces: Escalation protocol configuration\nStores/Sends To: Workflow engine escalation module",
      "Uses: Ticketing System Integration\nAction: Connect to ticketing system API for case tracking and assignment\nProduces: Ticketing system integration layer\nStores/Sends To: Workflow engine integration layer",
      "Uses: Performance Metrics Definitions\nAction: Configure metrics tracking based on user-defined KPIs\nProduces: Metrics tracking configuration\nStores/Sends To: Analytics dashboard configuration",
      "Uses: Routing Criteria, Automated Resolution Ruleset, Escalation Criteria\nAction: Validate workflow logic consistency across all components\nProduces: Workflow validation report\nStores/Sends To: Quality assurance system",
      "Uses: All configured components\nAction: Deploy integrated workflow to production environment\nProduces: Deployed customer support workflow\nStores/Sends To: Production workflow engine",
      "Uses: Ticketing System Integration\nAction: Continuously monitor case resolution status from ticketing system\nProduces: Real-time case status data\nStores/Sends To: Workflow monitoring dashboard",
      "Uses: Performance Metrics Definitions, Ticketing System Integration\nAction: Generate performance reports by querying resolved case data\nProduces: Performance metrics dashboard\nStores/Sends To: Business intelligence platform"
    ],
    "raw_response": "Inputs:\n1. Routing Criteria\n   Source Type: USER-CONTROLLED\n   Source Origin: Customer support team\n   Input Data: Inquiry categorization rules (e.g., keywords, priority levels)\n   Bound Reference: None\n   Note: Requires explicit user provision or linkage.\n\n2. Knowledge Base Dataset\n   Source Type: SYSTEM-RETRIEVABLE\n   Source Origin: Internal knowledge management API\n   Input Data: Pre-approved resolution templates and FAQs\n   Bound Reference: None\n   Note: [DEPTH STOP - Terminal input, do not further decompose]\n\n3. Automated Resolution Ruleset\n   Source Type: USER-CONTROLLED\n   Source Origin: Support operations manager\n   Input Data: Decision trees for automated resolution\n   Bound Reference: None\n   Note: Requires explicit user provision or linkage.\n\n4. Escalation Criteria\n   Source Type: USER-CONTROLLED\n   Source Origin: Customer service director\n   Input Data: Complexity thresholds and escalation pathways\n   Bound Reference: None\n   Note: Requires explicit user provision or linkage.\n\n5. Ticketing System Integration\n   Source Type: SYSTEM-RETRIEVABLE\n   Source Origin: Zendesk/ServiceNow API endpoint\n   Input Data: Real-time case tracking and assignment capabilities\n   Bound Reference: None\n   Note: [DEPTH STOP - Terminal input, do not further decompose]\n\n6. Performance Metrics Definitions\n   Source Type: USER-CONTROLLED\n   Source Origin: Business intelligence team\n   Input Data: KPIs to track (e.g., resolution time, satisfaction scores)\n   Bound Reference: None\n   Note: Requires explicit user provision or linkage.\n\nOutputs:\n1. Workflow Architecture Diagram\n2. Automated Response Templates\n3. Escalated Case Queue\n4. Performance Metrics Dashboard\n5. System Integration Configuration\n\nSteps:\nStep 1:\nUses: Routing Criteria\nAction: Define inquiry routing logic based on user-provided categorization rules\nProduces: Routing logic specification\nStores/Sends To: Workflow engine configuration\n\nStep 2:\nUses: Knowledge Base Dataset\nAction: Establish API connection to knowledge management system for resolution lookup\nProduces: Knowledge base integration module\nStores/Sends To: Workflow engine knowledge layer\n\nStep 3:\nUses: Automated Resolution Ruleset\nAction: Implement decision trees for automated resolution pathways\nProduces: Automated resolution configuration\nStores/Sends To: Workflow engine automation layer\n\nStep 4:\nUses: Escalation Criteria\nAction: Configure escalation thresholds and assignment rules\nProduces: Escalation protocol configuration\nStores/Sends To: Workflow engine escalation module\n\nStep 5:\nUses: Ticketing System Integration\nAction: Connect to ticketing system API for case tracking and assignment\nProduces: Ticketing system integration layer\nStores/Sends To: Workflow engine integration layer\n\nStep 6:\nUses: Performance Metrics Definitions\nAction: Configure metrics tracking based on user-defined KPIs\nProduces: Metrics tracking configuration\nStores/Sends To: Analytics dashboard configuration\n\nStep 7:\nUses: Routing Criteria, Automated Resolution Ruleset, Escalation Criteria\nAction: Validate workflow logic consistency across all components\nProduces: Workflow validation report\nStores/Sends To: Quality assurance system\n\nStep 8:\nUses: All configured components\nAction: Deploy integrated workflow to production environment\nProduces: Deployed customer support workflow\nStores/Sends To: Production workflow engine\n\nStep 9:\nUses: Ticketing System Integration\nAction: Continuously monitor case resolution status from ticketing system\nProduces: Real-time case status data\nStores/Sends To: Workflow monitoring dashboard\n\nStep 10:\nUses: Performance Metrics Definitions, Ticketing System Integration\nAction: Generate performance reports by querying resolved case data\nProduces: Performance metrics dashboard\nStores/Sends To: Business intelligence platform"
  },
  "aeb_analysis": {
    "steps_count": 10,
    "aeb_analysis_raw": "### Step-by-Step Analysis\n\n---\n\n**Step 1**  \n**Step:** Define inquiry routing logic based on user-provided categorization rules  \n**Is AEB:** No  \n**Reason:** The action involves defining logic, which typically requires branching, sequencing, and validation to ensure correctness. It is not a single executable action.  \n**Suggest:** Break into individual API calls for each routing rule (e.g., `create_routing_rule(category, destination)`).\n\n---\n\n**Step 2**  \n**Step:** Establish API connection to knowledge management system for resolution lookup  \n**Is AEB:** Yes  \n**Reason:** Establishing a connection can be implemented as a single API call (e.g., `connect_knowledge_base(url, auth)`), assuming no branching or validation.  \n**Suggest:** N/A.\n\n---\n\n**Step 3**  \n**Step:** Implement decision trees for automated resolution pathways  \n**Is AEB:** No  \n**Reason:** Decision trees inherently involve branching and sequencing logic. This is not atomic.  \n**Suggest:** Break into individual decision nodes (e.g., `add_resolution_rule(condition, action)`).\n\n---\n\n**Step 4**  \n**Step:** Configure escalation thresholds and assignment rules  \n**Is AEB:** Yes  \n**Reason:** Configuration of thresholds and rules can be done via a single API call (e.g., `set_escalation_config(thresholds, assignments)`), assuming no validation.  \n**Suggest:** N/A.\n\n---\n\n**Step 5**  \n**Step:** Connect to ticketing system API for case tracking and assignment  \n**Is AEB:** Yes  \n**Reason:** Connecting to an API can be a single executable action (e.g., `connect_ticketing_system(api_key, endpoint)`).  \n**Suggest:** N/A.\n\n---\n\n**Step 6**  \n**Step:** Configure metrics tracking based on user-defined KPIs  \n**Is AEB:** Yes  \n**Reason:** Configuration can be implemented as a single API call (e.g., `configure_metrics(kpis)`), assuming no validation.  \n**Suggest:** N/A.\n\n---\n\n**Step 7**  \n**Step:** Validate workflow logic consistency across all components  \n**Is AEB:** No  \n**Reason:** Validation inherently involves branching (e.g., checking for errors) and error handling, which violates the AEB definition.  \n**Suggest:** Remove validation entirely or break into individual checks (e.g., `validate_routing_rules()`, `validate_escalation_rules()`), but these would still require branching.\n\n---\n\n**Step 8**  \n**Step:** Deploy integrated workflow to production environment  \n**Is AEB:** Yes  \n**Reason:** Deployment can be a single API call (e.g., `deploy_workflow(config)`), assuming the system abstracts the complexity.  \n**Suggest:** N/A.\n\n---\n\n**Step 9**  \n**Step:** Continuously monitor case resolution status from ticketing system  \n**Is AEB:** No  \n**Reason:** \"Continuously monitor\" implies looping or polling, which involves sequencing and potential error handling (e.g., retries).  \n**Suggest:** Break into discrete status checks (e.g., `get_case_status(case_id)`).\n\n---\n\n**Step 10**  \n**Step:** Generate performance reports by querying resolved case data  \n**Is AEB:** No  \n**Reason:** Generating reports involves querying data, aggregating results, and formatting outputsâ€”sequencing and branching (e.g., handling missing data).  \n**Suggest:** Break into individual queries (e.g., `query_case_data(start_date, end_date)`, `generate_kpi_chart(kpi)`).\n\n---\n\n### Summary of AEBs  \n**Yes:** Steps 2, 4, 5, 6, 8  \n**No:** Steps 1, 3, 7, 9, 10",
    "analysis_complete": true
  },
  "io_decomposed": true
}