{
  "task_id": "845b615e1233",
  "input": " Analyze live turbine data, adjust parameters within safety constraints, monitor the results, and report performance improvements.",
  "required_inputs": [],
  "outputs": [
    "result"
  ],
  "subtasks": [],
  "dependency_structure": {
    "type": "dependency_driven",
    "graph": {},
    "total_subtasks": 0
  },
  "execution_plan": {
    "model_used": "AI1",
    "model_endpoint": "qwen/qwen3-235b-a22b",
    "inputs": [
      {
        "name": "L",
        "source_type": "SYSTEM-RETRIEVABLE",
        "source_origin": "SCADA system API endpoint `/api/scada/v2/turbine-data`",
        "input_data": "Real-time sensor readings (RPM, temperature, vibration, power output) at 1-second intervals",
        "bound_reference": "Direct connection to turbine control system"
      },
      {
        "name": "S",
        "source_type": "USER-CONTROLLED",
        "source_origin": "Engineering team's safety specification document",
        "input_data": "Maximum/minimum allowable values for RPM (±5%), temperature (≤85°C), vibration (≤4.5mm/s)",
        "bound_reference": null
      },
      {
        "name": "I",
        "source_type": "SYSTEM-RETRIEVABLE",
        "source_origin": "Turbine control system database `TURBINE_CONFIG_TABLE`",
        "input_data": "Current blade pitch angle, generator torque settings, yaw position",
        "bound_reference": "Database connection credentials stored in secure vault"
      },
      {
        "name": "A",
        "source_type": "DERIVABLE",
        "source_origin": "Computed from Inputs 1 and 2",
        "input_data": "Optimized blade pitch angle, generator torque settings",
        "bound_reference": "Inputs 1, 2"
      },
      {
        "name": "B",
        "source_type": "DERIVABLE",
        "source_origin": "Computed from Input 1",
        "input_data": "Average power output (kW), mechanical efficiency (%) over 24-hour period",
        "bound_reference": "Input 1"
      },
      {
        "name": "P",
        "source_type": "DERIVABLE",
        "source_origin": "Computed from Input 4 and new Input 1'",
        "input_data": "Average power output (kW), mechanical efficiency (%) after parameter changes",
        "bound_reference": "Input 4, new Input 1'"
      }
    ],
    "outputs": [
      "Adjusted turbine configuration file",
      "Performance improvement report",
      "Safety constraint violation alerts",
      "Updated live turbine data archive"
    ],
    "steps": [
      "Uses: Input 1  \nAction: Establish real-time data stream connection to SCADA system  \nProduces: Raw sensor data buffer  \nStores/Sends To: In-memory processing queue `SCADA_STREAM_BUFFER`",
      "Uses: Input 2  \nAction: Validate user-provided safety constraints against regulatory standards  \nProduces: Verified constraint checklist  \nStores/Sends To: Audit log system",
      "Uses: Input 3  \nAction: Retrieve current turbine configuration parameters  \nProduces: Configuration snapshot JSON  \nStores/Sends To: Version-controlled parameter store",
      "Uses: Input 1, Input 2  \nAction: Apply gradient ascent optimization algorithm to calculate parameter adjustments within safety bounds  \nProduces: Adjusted turbine parameters (Input 4)  \nStores/Sends To: Pending configuration queue",
      "Uses: Input 4  \nAction: Deploy validated parameter changes to turbine control system  \nProduces: Configuration update confirmation  \nStores/Sends To: Turbine control system database",
      "Uses: Input 1 (new data stream post-adjustment)  \nAction: Collect 24-hour post-adjustment operational data  \nProduces: Post-adjustment dataset (Input 6)  \nStores/Sends To: Data lake partition",
      "Uses: Input 5, Input 6  \nAction: Calculate performance deltas using paired t-test statistical analysis  \nProduces: Improvement metrics CSV  \nStores/Sends To: Report generation service",
      "Uses: Input 1 (stream), Input 2  \nAction: Continuously validate live metrics against safety thresholds  \nProduces: Real-time violation alerts  \nStores/Sends To: Alerting system API endpoint `/"
    ],
    "raw_response": "Inputs:\n1. Live turbine operational data stream  \n   Source Type: SYSTEM-RETRIEVABLE  \n   Source Origin: SCADA system API endpoint `/api/scada/v2/turbine-data`  \n   Input Data: Real-time sensor readings (RPM, temperature, vibration, power output) at 1-second intervals  \n   Bound Reference: Direct connection to turbine control system  \n\n2. Safety constraint thresholds  \n   Source Type: USER-CONTROLLED  \n   Source Origin: Engineering team's safety specification document  \n   Input Data: Maximum/minimum allowable values for RPM (±5%), temperature (≤85°C), vibration (≤4.5mm/s)  \n   Note: Requires explicit user provision or linkage.  \n\n3. Initial turbine configuration parameters  \n   Source Type: SYSTEM-RETRIEVABLE  \n   Source Origin: Turbine control system database `TURBINE_CONFIG_TABLE`  \n   Input Data: Current blade pitch angle, generator torque settings, yaw position  \n   Bound Reference: Database connection credentials stored in secure vault  \n\n4. Adjusted turbine parameters  \n   Source Type: DERIVABLE  \n   Source Origin: Computed from Inputs 1 and 2  \n   Input Data: Optimized blade pitch angle, generator torque settings  \n   Bound Reference: Inputs 1, 2  \n   Note: [DEPTH STOP - Terminal input, do not further decompose]  \n\n5. Baseline performance metrics  \n   Source Type: DERIVABLE  \n   Source Origin: Computed from Input 1  \n   Input Data: Average power output (kW), mechanical efficiency (%) over 24-hour period  \n   Bound Reference: Input 1  \n   Note: [DEPTH STOP - Terminal input, do not further decompose]  \n\n6. Post-adjustment performance metrics  \n   Source Type: DERIVABLE  \n   Source Origin: Computed from Input 4 and new Input 1'  \n   Input Data: Average power output (kW), mechanical efficiency (%) after parameter changes  \n   Bound Reference: Input 4, new Input 1'  \n   Note: [DEPTH STOP - Terminal input, do not further decompose]  \n\nOutputs:\n1. Adjusted turbine configuration file  \n   Type: Persisted state change  \n   Destination: Turbine control system database  \n\n2. Performance improvement report  \n   Type: Measurable report  \n   Destination: Cloud storage bucket `gs://analytics-reports/turbine_perf/`  \n\n3. Safety constraint violation alerts  \n   Type: Triggered action  \n   Destination: SMS/email gateway API  \n\n4. Updated live turbine data archive  \n   Type: Observable artifact  \n   Destination: Data lake partition `data_lake/turbine_history/2023-10-05/`  \n\nSteps:\nStep 1:  \nUses: Input 1  \nAction: Establish real-time data stream connection to SCADA system  \nProduces: Raw sensor data buffer  \nStores/Sends To: In-memory processing queue `SCADA_STREAM_BUFFER`  \n\nStep 2:  \nUses: Input 2  \nAction: Validate user-provided safety constraints against regulatory standards  \nProduces: Verified constraint checklist  \nStores/Sends To: Audit log system  \n\nStep 3:  \nUses: Input 3  \nAction: Retrieve current turbine configuration parameters  \nProduces: Configuration snapshot JSON  \nStores/Sends To: Version-controlled parameter store  \n\nStep 4:  \nUses: Input 1, Input 2  \nAction: Apply gradient ascent optimization algorithm to calculate parameter adjustments within safety bounds  \nProduces: Adjusted turbine parameters (Input 4)  \nStores/Sends To: Pending configuration queue  \n\nStep 5:  \nUses: Input 4  \nAction: Deploy validated parameter changes to turbine control system  \nProduces: Configuration update confirmation  \nStores/Sends To: Turbine control system database  \n\nStep 6:  \nUses: Input 1 (new data stream post-adjustment)  \nAction: Collect 24-hour post-adjustment operational data  \nProduces: Post-adjustment dataset (Input 6)  \nStores/Sends To: Data lake partition  \n\nStep 7:  \nUses: Input 5, Input 6  \nAction: Calculate performance deltas using paired t-test statistical analysis  \nProduces: Improvement metrics CSV  \nStores/Sends To: Report generation service  \n\nStep 8:  \nUses: Input 1 (stream), Input 2  \nAction: Continuously validate live metrics against safety thresholds  \nProduces: Real-time violation alerts  \nStores/Sends To: Alerting system API endpoint `/"
  },
  "aeb_analysis": {
    "steps_count": 8,
    "aeb_analysis_raw": "### AEB Analysis Results\n\n---\n\n**Step 1**  \n- **Step:** Establish real-time data stream connection to SCADA system  \n- **Is AEB:** No  \n- **Reason:** Establishing a connection inherently involves sequencing (e.g., handshake, retries) and potential error handling (e.g., timeout logic). While the intent is singular, the implementation typically requires branching and sequencing.  \n- **Suggestion:** Break into:  \n  1. Initiate connection handshake (AEB).  \n  2. Monitor connection health (separate AEB for ongoing checks).  \n\n---\n\n**Step 2**  \n- **Step:** Validate user-provided safety constraints against regulatory standards  \n- **Is AEB:** No  \n- **Reason:** Explicitly involves validation, which requires branching (e.g., pass/fail checks) and error handling (e.g., reporting violations).  \n- **Suggestion:** Decompose into atomic checks (e.g., \"Check constraint X against standard Y\" as individual AEBs).  \n\n---\n\n**Step 3**  \n- **Step:** Retrieve current turbine configuration parameters  \n- **Is AEB:** Yes  \n- **Reason:** Single intent (read data), interacts with one system (parameter store), no branching/sequencing. Implemented as a single API call (e.g., `GET /config`).  \n\n---\n\n**Step 4**  \n- **Step:** Apply gradient ascent optimization algorithm to calculate parameter adjustments within safety bounds  \n- **Is AEB:** No  \n- **Reason:** \"Within safety bounds\" implies embedded validation/branching logic (e.g., clamping values). Optimization algorithms often involve iterative steps (sequencing).  \n- **Suggestion:** Split into:  \n  1. Execute gradient ascent (pure computation, no constraints).  \n  2. Apply safety bounds as a post-processing step (separate AEB).  \n\n---\n\n**Step 5**  \n- **Step:** Deploy validated parameter changes to turbine control system  \n- **Is AEB:** Yes  \n- **Reason:** Single intent (deploy), interacts with one system (turbine control), no branching/sequencing. Assumes validation occurred earlier. Implemented as `POST /deploy`.  \n\n---\n\n**Step 6**  \n- **Step:** Collect 24-hour post-adjustment operational data  \n- **Is AEB:** No  \n- **Reason:** \"24-hour\" duration implies sequencing (e.g., polling or streaming over time). Cannot be implemented as a single function call without temporal logic.  \n- **Suggestion:** Split into:  \n  1. Start data collection session (AEB).  \n  2. Stream data in batches (repeated AEB calls).  \n\n---\n\n**Step 7**  \n- **Step:** Calculate performance deltas using paired t-test statistical analysis  \n- **Is AEB:** Yes  \n- **Reason:** Single intent (compute deltas), no branching/sequencing. Implemented as a single statistical function (e.g., `calculate_t_test(input5, input6)`).  \n\n---\n\n**Step 8**  \n- **Step:** Continuously validate live metrics against safety thresholds  \n- **Is AEB:** No  \n- **Reason:** \"Continuously\" implies looping (sequencing), and validation involves branching (e.g., alert thresholds).  \n- **Suggestion:** Split into:  \n  1. Evaluate current metric against threshold (AEB).  \n  2. Trigger alert if violated (AEB).  \n\n---\n\n### Summary of AEB Compliance  \n- **Yes:** Steps 3, 5, 7  \n- **No:** Steps 1, 2, 4, 6, 8  \n\nEach non-AEB step requires decomposition to isolate atomic actions without validation, branching, or sequencing.",
    "analysis_complete": true
  },
  "io_decomposed": true
}