{
  "task_id": "9839e246d8fa",
  "input": "Research our audience and create blog posts, videos, and social media content that maintains a consistent brand voice, then set and track KPIs to measure campaign success.",
  "required_inputs": [],
  "outputs": [
    "result"
  ],
  "subtasks": [],
  "dependency_structure": {
    "type": "dependency_driven",
    "graph": {},
    "total_subtasks": 0
  },
  "execution_plan": {
    "model_used": "AI1",
    "model_endpoint": "qwen/qwen3-235b-a22b",
    "inputs": [
      {
        "name": "Customer Relationship Management (CRM) Data",
        "source_type": "SYSTEM-RETRIEVABLE",
        "source_origin": "Internal CRM database (e.g., Salesforce, HubSpot)",
        "input_data": "Customer demographics, purchase history, engagement metrics",
        "bound_reference": "N/A"
      },
      {
        "name": "Market Research Reports",
        "source_type": "SYSTEM-RETRIEVABLE",
        "source_origin": "Third-party API (e.g., Statista, Nielsen)",
        "input_data": "Industry trends, competitor audience analysis",
        "bound_reference": "N/A"
      },
      {
        "name": "Audience Survey Responses",
        "source_type": "USER-CONTROLLED",
        "source_origin": "User-created surveys distributed via email/social platforms",
        "input_data": "Qualitative feedback, preferences, pain points",
        "bound_reference": "N/A"
      },
      {
        "name": "Brand Voice Guidelines",
        "source_type": "SYSTEM-RETRIEVABLE",
        "source_origin": "Internal document repository (e.g., Google Drive, SharePoint)",
        "input_data": "Tone, style, messaging rules",
        "bound_reference": "N/A"
      },
      {
        "name": "Content Creation Tools Access",
        "source_type": "USER-CONTROLLED",
        "source_origin": "User-provided licenses/subscriptions",
        "input_data": "Access to tools like Canva, Adobe Creative Suite, video editors",
        "bound_reference": "N/A"
      },
      {
        "name": "KPI Targets",
        "source_type": "USER-CONTROLLED",
        "source_origin": "Marketing team strategy document",
        "input_data": "Specific metrics (e.g., engagement rate ≥15%, 10% monthly traffic growth)",
        "bound_reference": "N/A"
      },
      {
        "name": "Social Media Analytics API Access",
        "source_type": "SYSTEM-RETRIEVABLE",
        "source_origin": "Platform APIs (e.g., Facebook Insights, Twitter API)",
        "input_data": "Engagement metrics, follower growth, click-through rates",
        "bound_reference": "N/A"
      },
      {
        "name": "Website Analytics Data",
        "source_type": "SYSTEM-RETRIEVABLE",
        "source_origin": "Google Analytics or equivalent tracking tool",
        "input_data": "Traffic sources, bounce rate, session duration",
        "bound_reference": "N/A"
      }
    ],
    "outputs": [
      "**Audience Personas Document**",
      "**Content Calendar with Drafts**",
      "**Published Content**",
      "**KPI Performance Dashboard**",
      "**Campaign Optimization Recommendations**"
    ],
    "steps": [],
    "raw_response": "Inputs:  \n1. **Customer Relationship Management (CRM) Data**  \n   Source Type: SYSTEM-RETRIEVABLE  \n   Source Origin: Internal CRM database (e.g., Salesforce, HubSpot)  \n   Input Data: Customer demographics, purchase history, engagement metrics  \n   Bound Reference: N/A  \n   Note: [DEPTH STOP - Terminal input]  \n\n2. **Market Research Reports**  \n   Source Type: SYSTEM-RETRIEVABLE  \n   Source Origin: Third-party API (e.g., Statista, Nielsen)  \n   Input Data: Industry trends, competitor audience analysis  \n   Bound Reference: N/A  \n   Note: [DEPTH STOP - Terminal input]  \n\n3. **Audience Survey Responses**  \n   Source Type: USER-CONTROLLED  \n   Source Origin: User-created surveys distributed via email/social platforms  \n   Input Data: Qualitative feedback, preferences, pain points  \n   Bound Reference: N/A  \n   Note: Requires explicit user provision or linkage.  \n\n4. **Brand Voice Guidelines**  \n   Source Type: SYSTEM-RETRIEVABLE  \n   Source Origin: Internal document repository (e.g., Google Drive, SharePoint)  \n   Input Data: Tone, style, messaging rules  \n   Bound Reference: N/A  \n   Note: [DEPTH STOP - Terminal input]  \n\n5. **Content Creation Tools Access**  \n   Source Type: USER-CONTROLLED  \n   Source Origin: User-provided licenses/subscriptions  \n   Input Data: Access to tools like Canva, Adobe Creative Suite, video editors  \n   Bound Reference: N/A  \n   Note: Requires explicit user provision or linkage.  \n\n6. **KPI Targets**  \n   Source Type: USER-CONTROLLED  \n   Source Origin: Marketing team strategy document  \n   Input Data: Specific metrics (e.g., engagement rate ≥15%, 10% monthly traffic growth)  \n   Bound Reference: N/A  \n   Note: Requires explicit user provision or linkage.  \n\n7. **Social Media Analytics API Access**  \n   Source Type: SYSTEM-RETRIEVABLE  \n   Source Origin: Platform APIs (e.g., Facebook Insights, Twitter API)  \n   Input Data: Engagement metrics, follower growth, click-through rates  \n   Bound Reference: N/A  \n   Note: [DEPTH STOP - Terminal input]  \n\n8. **Website Analytics Data**  \n   Source Type: SYSTEM-RETRIEVABLE  \n   Source Origin: Google Analytics or equivalent tracking tool  \n   Input Data: Traffic sources, bounce rate, session duration  \n   Bound Reference: N/A  \n   Note: [DEPTH STOP - Terminal input]  \n\n---\n\nOutputs:  \n1. **Audience Personas Document**  \n   Type: Observable artifact  \n   Description: Segmented audience profiles with preferences and behaviors  \n\n2. **Content Calendar with Drafts**  \n   Type: Observable artifact  \n   Description: Scheduled blog posts, videos, and social media content aligned to brand voice  \n\n3. **Published Content**  \n   Type: Persisted state change  \n   Description: Live content on websites/social platforms  \n\n4. **KPI Performance Dashboard**  \n   Type: Measurable report  \n   Description: Visualized metrics tracking progress against targets  \n\n5. **Campaign Optimization Recommendations**  \n   Type: Triggered action  \n   Description: Adjustments to content strategy based on KPI insights  \n\n---\n\nSteps:  \n**Step 1: Audience Research**  \nUses: CRM Data, Market Research Reports, Audience Survey Responses  \nAction: Aggregate and analyze customer data to identify patterns and segments  \nProduces: Audience Personas Document  \nStores/Sends To: Internal document repository  \n\n**Step 2: Content Strategy Development**  \nUses: Audience Personas Document, Brand Voice Guidelines  \nAction: Define content themes, formats, and tone alignment  \nProduces: Content Calendar with Drafts  \nStores/Sends To: Project management tool (e.g., Trello, Asana)  \n\n**Step 3: Content Creation**  \nUses: Content Calendar with Drafts, Content Creation Tools Access  \nAction: Design and produce blog posts, videos, and social media assets  \nProduces: Published Content  \nStores/Sends To: Website CMS, social media platforms  \n\n**Step 4: KPI Setup**  \nUses: KPI Targets, Social Media Analytics API Access, Website Analytics Data  \nAction: Configure tracking tools and set baseline metrics  \nProduces: KPI Performance Dashboard  \nStores/Sends To: Analytics dashboard (e.g., Google Data Studio)  \n\n**Step 5: Campaign Monitoring**  \nUses: KPI Performance Dashboard  \nAction: Continuously track engagement, traffic, and conversions  \nProduces: Campaign Optimization Recommendations  \nStores/Sends To: Internal strategy document  \n\n**Step 6: Iterative Refinement**  \nUses: Campaign Optimization Recommendations  \nAction: Adjust content mix, posting frequency, or targeting based on insights  \nProduces: Updated Published Content  \nStores/Sends To: Website CMS, social media platforms  \n\n---\n\nDependency Consistency Check:  \n- All inputs used in steps are declared  \n- All USER-CONTROLLED inputs (3, 5, 6) require explicit user action  \n- All SYSTEM-RETRIEVABLE inputs (1, 2, 4, 7, 8) specify endpoints  \n- DERIVABLE inputs (Audience Personas, Content Calendar, KPI Dashboard) are fully decomposed into terminal sources  \n- No implicit data sources or tools included"
  },
  "aeb_analysis": {
    "steps_count": 0,
    "aeb_analysis": []
  },
  "io_decomposed": true
}