{
  "task_id": "2165a2a5f291",
  "input": "Reconcile a patient's medications by checking their history in the EHR, using a clinical support tool to resolve a potential drug interaction, updating the active prescription list, and delivering a finalized regimen to the patient.",
  "required_inputs": [],
  "outputs": [
    "result"
  ],
  "subtasks": [],
  "dependency_structure": {
    "type": "dependency_driven",
    "graph": {},
    "total_subtasks": 0
  },
  "execution_plan": {
    "model_used": "AI1",
    "model_endpoint": "qwen/qwen3-235b-a22b",
    "inputs": [
      {
        "name": "P",
        "source_type": "USER-CONTROLLED",
        "source_origin": "User provides patient ID",
        "input_data": "Unique patient identifier (e.g., MRN)",
        "bound_reference": "N/A"
      },
      {
        "name": "E",
        "source_type": "SYSTEM-RETRIEVABLE",
        "source_origin": "EHR System API (e.g., Epic/MyChart)",
        "input_data": "Complete medication history including active prescriptions, discontinued meds, dosages, and administration routes",
        "bound_reference": "N/A"
      },
      {
        "name": "C",
        "source_type": "SYSTEM-RETRIEVABLE",
        "source_origin": "CDS API (e.g., Lexicomp Integration)",
        "input_data": "Drug interaction rules database, severity classifications, and resolution protocols",
        "bound_reference": "N/A"
      },
      {
        "name": "U",
        "source_type": "USER-CONTROLLED",
        "source_origin": "Clinician approval interface",
        "input_data": "Finalized medication adjustments validated by healthcare provider",
        "bound_reference": "N/A"
      },
      {
        "name": "A",
        "source_type": "DERIVABLE",
        "source_origin": "Input 2 (EHR Medication History Dataset)",
        "input_data": "Subset of current active medications extracted from full medication history",
        "bound_reference": "Derived from Input 2"
      },
      {
        "name": "P",
        "source_type": "DERIVABLE",
        "source_origin": "Inputs 2 + 3 (EHR Data + CDS Rules)",
        "input_data": "Computed interaction risks between medications in active prescription list",
        "bound_reference": "Derived from Inputs 2 and 3"
      }
    ],
    "outputs": [
      "Reconciled Medication List",
      "Updated EHR Medication Record",
      "Patient Regimen Summary",
      "Reconciliation Audit Log"
    ],
    "steps": [
      "Uses: Patient Identifier\nAction: Query EHR system for medication history using patient identifier\nProduces: EHR Medication History Dataset\nStores/Sends To: Local processing buffer",
      "Uses: EHR Medication History Dataset\nAction: Extract active prescription records from full medication history\nProduces: Active Prescription List\nStores/Sends To: Medication review interface",
      "Uses: Active Prescription List, Clinical Decision Support (CDS) Rule Engine\nAction: Execute drug interaction check using CDS rules\nProduces: Potential Drug Interaction Results\nStores/Sends To: Clinical alert system",
      "Uses: Potential Drug Interaction Results\nAction: Generate interaction severity report and resolution options\nProduces: Interaction Resolution Recommendations\nStores/Sends To: Clinician decision interface",
      "Uses: Interaction Resolution Recommendations, User Confirmed Interaction Resolution\nAction: Apply user-validated changes to active prescription list\nProduces: Reconciled Medication List\nStores/Sends To: EHR update queue",
      "Uses: Reconciled Medication List\nAction: Commit updated medication list to EHR system\nProduces: Updated EHR Medication Record\nStores/Sends To: EHR Database",
      "Uses: Reconciled Medication List\nAction: Generate patient-friendly medication instructions\nProduces: Patient Regimen Summary\nStores/Sends To: Patient Portal / Print Queue",
      "Uses: Original Active Prescription List, Reconciled Medication List\nAction: Create change documentation with rationale for each modification\nProduces: Reconciliation Audit Log\nStores/Sends To: Compliance Tracking System"
    ],
    "raw_response": "Inputs:\n1. Patient Identifier\n   Source Type: USER-CONTROLLED\n   Source Origin: User provides patient ID\n   Input Data: Unique patient identifier (e.g., MRN)\n   Bound Reference: N/A\n   Note: Requires explicit user provision or linkage.\n\n2. EHR Medication History Dataset\n   Source Type: SYSTEM-RETRIEVABLE\n   Source Origin: EHR System API (e.g., Epic/MyChart)\n   Input Data: Complete medication history including active prescriptions, discontinued meds, dosages, and administration routes\n   Bound Reference: N/A\n   Note: [DEPTH STOP - Terminal input, do not further decompose]\n\n3. Clinical Decision Support (CDS) Rule Engine\n   Source Type: SYSTEM-RETRIEVABLE\n   Source Origin: CDS API (e.g., Lexicomp Integration)\n   Input Data: Drug interaction rules database, severity classifications, and resolution protocols\n   Bound Reference: N/A\n   Note: [DEPTH STOP - Terminal input, do not further decompose]\n\n4. User Confirmed Interaction Resolution\n   Source Type: USER-CONTROLLED\n   Source Origin: Clinician approval interface\n   Input Data: Finalized medication adjustments validated by healthcare provider\n   Bound Reference: N/A\n   Note: Requires explicit user provision or linkage.\n\n5. Active Prescription List\n   Source Type: DERIVABLE\n   Source Origin: Input 2 (EHR Medication History Dataset)\n   Input Data: Subset of current active medications extracted from full medication history\n   Bound Reference: Derived from Input 2\n   Note: [DEPTH STOP - Terminal input, do not further decompose]\n\n6. Potential Drug Interaction Results\n   Source Type: DERIVABLE\n   Source Origin: Inputs 2 + 3 (EHR Data + CDS Rules)\n   Input Data: Computed interaction risks between medications in active prescription list\n   Bound Reference: Derived from Inputs 2 and 3\n   Note: [DEPTH STOP - Terminal input, do not further decompose]\n\nOutputs:\n1. Reconciled Medication List\n   Type: Persisted state change\n   Description: Finalized medication regimen with resolved interactions\n   Destination: EHR Medication List\n\n2. Updated EHR Medication Record\n   Type: System update\n   Description: Active prescription list updated in EHR system\n   Destination: EHR Database\n\n3. Patient Regimen Summary\n   Type: Observable artifact\n   Description: Printable medication instructions for patient\n   Destination: Patient Portal / Print Queue\n\n4. Reconciliation Audit Log\n   Type: Measurable report\n   Description: Documentation of changes made during reconciliation process\n   Destination: Compliance Tracking System\n\nSteps:\nStep 1:\nUses: Patient Identifier\nAction: Query EHR system for medication history using patient identifier\nProduces: EHR Medication History Dataset\nStores/Sends To: Local processing buffer\n\nStep 2:\nUses: EHR Medication History Dataset\nAction: Extract active prescription records from full medication history\nProduces: Active Prescription List\nStores/Sends To: Medication review interface\n\nStep 3:\nUses: Active Prescription List, Clinical Decision Support (CDS) Rule Engine\nAction: Execute drug interaction check using CDS rules\nProduces: Potential Drug Interaction Results\nStores/Sends To: Clinical alert system\n\nStep 4:\nUses: Potential Drug Interaction Results\nAction: Generate interaction severity report and resolution options\nProduces: Interaction Resolution Recommendations\nStores/Sends To: Clinician decision interface\n\nStep 5:\nUses: Interaction Resolution Recommendations, User Confirmed Interaction Resolution\nAction: Apply user-validated changes to active prescription list\nProduces: Reconciled Medication List\nStores/Sends To: EHR update queue\n\nStep 6:\nUses: Reconciled Medication List\nAction: Commit updated medication list to EHR system\nProduces: Updated EHR Medication Record\nStores/Sends To: EHR Database\n\nStep 7:\nUses: Reconciled Medication List\nAction: Generate patient-friendly medication instructions\nProduces: Patient Regimen Summary\nStores/Sends To: Patient Portal / Print Queue\n\nStep 8:\nUses: Original Active Prescription List, Reconciled Medication List\nAction: Create change documentation with rationale for each modification\nProduces: Reconciliation Audit Log\nStores/Sends To: Compliance Tracking System\n\nDependency Consistency Check:\n- All inputs accounted for in steps\n- All DERIVABLE inputs fully decomposed to terminal sources\n- USER-CONTROLLED inputs explicitly identified\n- SYSTEM-RETRIEVABLE endpoints documented\n- Output provenance clearly mapped to steps\n- No implicit data sources present\n- [DEPTH STOP] markers correctly placed on terminal inputs"
  },
  "aeb_analysis": {
    "steps_count": 8,
    "aeb_analysis_raw": "### Step-by-Step Analysis\n\n---\n\n**Step 1**  \n- **Step**: Query EHR system for medication history using patient identifier  \n- **Is AEB**: Yes  \n- **Reason**: Direct API call to EHR system with single intent (retrieve data), no branching/sequencing, and interacts with one system boundary (EHR).  \n- **If No**: N/A  \n\n---\n\n**Step 2**  \n- **Step**: Extract active prescription records from full medication history  \n- **Is AEB**: No  \n- **Reason**: Filtering active prescriptions likely involves branching (e.g., checking if a prescription is active/inactive). This violates the \"no branching\" rule.  \n- **Suggestion**: Split into two steps:  \n  1. Filter prescriptions by status (active/inactive).  \n  2. Aggregate active prescriptions.  \n\n---\n\n**Step 3**  \n- **Step**: Execute drug interaction check using CDS rules  \n- **Is AEB**: Yes  \n- **Reason**: Invokes a CDS rule engine as a single API call with no branching/sequencing. Interacts with one system boundary (CDS engine).  \n- **If No**: N/A  \n\n---\n\n**Step 4**  \n- **Step**: Generate interaction severity report and resolution options  \n- **Is AEB**: No  \n- **Reason**: Generating resolution options may involve branching (e.g., different options based on severity levels). This violates the \"no branching\" rule.  \n- **Suggestion**: Split into two steps:  \n  1. Generate severity report.  \n  2. Generate resolution options based on severity.  \n\n---\n\n**Step 5**  \n- **Step**: Apply user-validated changes to active prescription list  \n- **Is AEB**: No  \n- **Reason**: Requires validation (checking user confirmation) and potential branching (e.g., applying changes conditionally). Validation is prohibited in AEBs.  \n- **Suggestion**: Split into two steps:  \n  1. Validate user input (outside AEB scope).  \n  2. Apply changes to the prescription list.  \n\n---\n\n**Step 6**  \n- **Step**: Commit updated medication list to EHR system  \n- **Is AEB**: Yes  \n- **Reason**: Direct API call to EHR system with single intent (update data), no branching/sequencing, and interacts with one system boundary (EHR).  \n- **If No**: N/A  \n\n---\n\n**Step 7**  \n- **Step**: Generate patient-friendly medication instructions  \n- **Is AEB**: No  \n- **Reason**: May involve branching (e.g., formatting instructions differently for medications with special dosing rules).  \n- **Suggestion**: Split into two steps:  \n  1. Format medication data for readability.  \n  2. Generate final patient instructions.  \n\n---\n\n**Step 8**  \n- **Step**: Create change documentation with rationale for each modification  \n- **Is AEB**: No  \n- **Reason**: Requires branching to document rationales for individual changes (e.g., \"dose adjusted due to renal impairment\" vs. \"drug discontinued\").  \n- **Suggestion**: Break into individual steps for each modification:  \n  1. Document rationale for change A.  \n  2. Document rationale for change B.  \n  3. Aggregate rationales into an audit log.  \n\n---\n\n### Summary of AEB Compliance  \n- **AEBs**: Steps 1, 3, 6  \n- **Non-AEBs**: Steps 2, 4, 5, 7, 8 (require breakdown to meet AEB criteria).",
    "analysis_complete": true
  },
  "io_decomposed": true
}