{
  "task_id": "a18f2e21da64",
  "input": "Design, build, unit test, fix issues, and deploy a secure AWS infrastructure with a VPC, three subnets, a web server firewall, and a Linux VM for a production application.",
  "required_inputs": [],
  "outputs": [
    "result"
  ],
  "subtasks": [],
  "dependency_structure": {
    "type": "dependency_driven",
    "graph": {},
    "total_subtasks": 0
  },
  "execution_plan": {
    "model_used": "AI1",
    "model_endpoint": "qwen/qwen3-235b-a22b",
    "inputs": [
      {
        "name": "A",
        "source_type": "SYSTEM-RETRIEVABLE",
        "source_origin": "AWS IAM Service",
        "input_data": "Access Key ID, Secret Access Key, Region",
        "bound_reference": "Required for all AWS API interactions"
      },
      {
        "name": "V",
        "source_type": "USER-CONTROLLED",
        "source_origin": "User Specification",
        "input_data": "CIDR Block (e.g., 10.0.0.0/16), Region, DNS Hostnames Enabled Flag",
        "bound_reference": null
      },
      {
        "name": "S",
        "source_type": "USER-CONTROLLED",
        "source_origin": "User Specification",
        "input_data": "Three Subnet CIDR Blocks (e.g., 10.0.1.0/24, 10.0.2.0/24, 10.0.3.0/24), Availability Zones",
        "bound_reference": null
      },
      {
        "name": "W",
        "source_type": "USER-CONTROLLED",
        "source_origin": "User Specification",
        "input_data": "Security Group Rules (Inbound/Outbound Port/Protocol), WAF Rule Sets",
        "bound_reference": null
      },
      {
        "name": "L",
        "source_type": "USER-CONTROLLED",
        "source_origin": "User Specification",
        "input_data": "Instance Type (e.g., t2.medium), AMI ID (e.g., ubuntu-20.04), Key Pair Name",
        "bound_reference": null
      },
      {
        "name": "S",
        "source_type": "USER-CONTROLLED",
        "source_origin": "User Specification",
        "input_data": "Compliance Standards (e.g., CIS Benchmarks, GDPR)",
        "bound_reference": null
      },
      {
        "name": "U",
        "source_type": "USER-CONTROLLED",
        "source_origin": "User Specification",
        "input_data": "Test Cases (e.g., Connectivity Checks, Firewall Rule Validation)",
        "bound_reference": null
      },
      {
        "name": "D",
        "source_type": "USER-CONTROLLED",
        "source_origin": "User Specification",
        "input_data": "Environment Name (e.g., \"prod\"), Resource Tags (e.g., \"Owner: DevOps\")",
        "bound_reference": null
      },
      {
        "name": "A",
        "source_type": "SYSTEM-RETRIEVABLE",
        "source_origin": "AWS EC2 API",
        "input_data": "AMI ID, OS Type, Architecture",
        "bound_reference": "Derived from Linux VM Specifications (Input 5)"
      },
      {
        "name": "V",
        "source_type": "DERIVABLE",
        "source_origin": "[DEPTH STOP - Terminal input, do not further decompose]",
        "input_data": "Auto-generated by AWS after VPC Creation",
        "bound_reference": "Produced by Step 2"
      },
      {
        "name": "S",
        "source_type": "DERIVABLE",
        "source_origin": "[DEPTH STOP - Terminal input, do not further decompose]",
        "input_data": "Auto-generated by AWS after Subnet Creation",
        "bound_reference": "Produced by Step 3"
      },
      {
        "name": "S",
        "source_type": "DERIVABLE",
        "source_origin": "[DEPTH STOP - Terminal input, do not further decompose]",
        "input_data": "Auto-generated by AWS after Firewall Configuration",
        "bound_reference": "Produced by Step 4"
      },
      {
        "name": "E",
        "source_type": "DERIVABLE",
        "source_origin": "[DEPTH STOP - Terminal input, do not further decompose]",
        "input_data": "Auto-generated by AWS after VM Launch",
        "bound_reference": "Produced by Step 5"
      }
    ],
    "outputs": [
      "Deployed VPC with specified CIDR and DNS settings",
      "Three configured subnets within the VPC",
      "Web server firewall with applied security rules",
      "Running Linux VM instance with specified configuration",
      "Unit test execution report",
      "Deployment logs and resource metadata"
    ],
    "steps": [
      "Uses: VPC Configuration Parameters, Subnet Configuration Parameters, Web Server Firewall Rules, Linux VM Specifications  \nAction: Validate CIDR block compatibility, plan subnet AZ distribution, draft security rules  \nProduces: Infrastructure Design Document  \nStores/Sends To: User-specified documentation repository",
      "Uses: VPC Configuration Parameters, AWS Account Credentials  \nAction: Call AWS EC2 API to create VPC with specified CIDR  \nProduces: VPC ID (Input 10)  \nStores/Sends To: AWS Console / CLI Output",
      "Uses: Subnet Configuration Parameters, VPC ID, AWS Account Credentials  \nAction: Create three subnets within the VPC using provided CIDRs and AZs  \nProduces: Subnet IDs (Input 11)  \nStores/Sends To: AWS Console / CLI Output",
      "Uses: Web Server Firewall Rules, VPC ID, AWS Account Credentials  \nAction: Create security group with specified rules, associate with WAF if required  \nProduces: Security Group ID (Input 12)  \nStores/Sends To: AWS Console / CLI Output",
      "Uses: Linux VM Specifications, Subnet ID, Security Group ID, AWS AMI Metadata  \nAction: Launch EC2 instance with specified AMI, instance type, and network configuration  \nProduces: EC2 Instance ID (Input 13)  \nStores/Sends To: AWS Console / CLI Output",
      "Uses: Unit Test Scenarios, EC2 Instance ID, Security Group ID  \nAction: Run automated tests (e.g., SSH connectivity, HTTP port accessibility)  \nProduces: Unit Test Report  \nStores/Sends To: User-specified reporting system",
      "Uses: Unit Test Report, Security Compliance Requirements  \nAction: Adjust security rules, subnet configurations, or VM settings to meet compliance and test requirements  \nProduces: Updated Infrastructure Configuration  \nStores/Sends To: AWS Console / CLI Output",
      "Uses: Deployment Environment Variables, All Previous Outputs  \nAction: Apply tags, finalize resource configurations, and mark environment as \"prod\"  \nProduces: Deployed Production Environment  \nStores/Sends To: AWS Resource Tags / Monitoring System  \n\n[DEPTH STOP CONDITIONS MET: All DERIVABLE inputs trace back to USER-CONTROLLED or SYSTEM-RETRIEVABLE sources]"
    ],
    "raw_response": "Inputs:  \n1. AWS Account Credentials  \n   Source Type: SYSTEM-RETRIEVABLE  \n   Source Origin: AWS IAM Service  \n   Input Data: Access Key ID, Secret Access Key, Region  \n   Bound Reference: Required for all AWS API interactions  \n\n2. VPC Configuration Parameters  \n   Source Type: USER-CONTROLLED  \n   Source Origin: User Specification  \n   Input Data: CIDR Block (e.g., 10.0.0.0/16), Region, DNS Hostnames Enabled Flag  \n   Note: Requires explicit user provision or linkage.  \n\n3. Subnet Configuration Parameters  \n   Source Type: USER-CONTROLLED  \n   Source Origin: User Specification  \n   Input Data: Three Subnet CIDR Blocks (e.g., 10.0.1.0/24, 10.0.2.0/24, 10.0.3.0/24), Availability Zones  \n   Note: Requires explicit user provision or linkage.  \n\n4. Web Server Firewall Rules  \n   Source Type: USER-CONTROLLED  \n   Source Origin: User Specification  \n   Input Data: Security Group Rules (Inbound/Outbound Port/Protocol), WAF Rule Sets  \n   Note: Requires explicit user provision or linkage.  \n\n5. Linux VM Specifications  \n   Source Type: USER-CONTROLLED  \n   Source Origin: User Specification  \n   Input Data: Instance Type (e.g., t2.medium), AMI ID (e.g., ubuntu-20.04), Key Pair Name  \n   Note: Requires explicit user provision or linkage.  \n\n6. Security Compliance Requirements  \n   Source Type: USER-CONTROLLED  \n   Source Origin: User Specification  \n   Input Data: Compliance Standards (e.g., CIS Benchmarks, GDPR)  \n   Note: Requires explicit user provision or linkage.  \n\n7. Unit Test Scenarios  \n   Source Type: USER-CONTROLLED  \n   Source Origin: User Specification  \n   Input Data: Test Cases (e.g., Connectivity Checks, Firewall Rule Validation)  \n   Note: Requires explicit user provision or linkage.  \n\n8. Deployment Environment Variables  \n   Source Type: USER-CONTROLLED  \n   Source Origin: User Specification  \n   Input Data: Environment Name (e.g., \"prod\"), Resource Tags (e.g., \"Owner: DevOps\")  \n   Note: Requires explicit user provision or linkage.  \n\n9. AWS AMI Metadata  \n   Source Type: SYSTEM-RETRIEVABLE  \n   Source Origin: AWS EC2 API  \n   Input Data: AMI ID, OS Type, Architecture  \n   Bound Reference: Derived from Linux VM Specifications (Input 5)  \n\n10. VPC ID  \n    Source Type: DERIVABLE  \n    Source Origin: [DEPTH STOP - Terminal input, do not further decompose]  \n    Input Data: Auto-generated by AWS after VPC Creation  \n    Bound Reference: Produced by Step 2  \n\n11. Subnet IDs  \n    Source Type: DERIVABLE  \n    Source Origin: [DEPTH STOP - Terminal input, do not further decompose]  \n    Input Data: Auto-generated by AWS after Subnet Creation  \n    Bound Reference: Produced by Step 3  \n\n12. Security Group ID  \n    Source Type: DERIVABLE  \n    Source Origin: [DEPTH STOP - Terminal input, do not further decompose]  \n    Input Data: Auto-generated by AWS after Firewall Configuration  \n    Bound Reference: Produced by Step 4  \n\n13. EC2 Instance ID  \n    Source Type: DERIVABLE  \n    Source Origin: [DEPTH STOP - Terminal input, do not further decompose]  \n    Input Data: Auto-generated by AWS after VM Launch  \n    Bound Reference: Produced by Step 5  \n\nOutputs:  \n1. Deployed VPC with specified CIDR and DNS settings  \n2. Three configured subnets within the VPC  \n3. Web server firewall with applied security rules  \n4. Running Linux VM instance with specified configuration  \n5. Unit test execution report (pass/fail status)  \n6. Deployment logs and resource metadata (e.g., VPC ID, Subnet IDs)  \n\nSteps:  \nStep 1: Design Infrastructure  \nUses: VPC Configuration Parameters, Subnet Configuration Parameters, Web Server Firewall Rules, Linux VM Specifications  \nAction: Validate CIDR block compatibility, plan subnet AZ distribution, draft security rules  \nProduces: Infrastructure Design Document  \nStores/Sends To: User-specified documentation repository  \n\nStep 2: Create VPC  \nUses: VPC Configuration Parameters, AWS Account Credentials  \nAction: Call AWS EC2 API to create VPC with specified CIDR  \nProduces: VPC ID (Input 10)  \nStores/Sends To: AWS Console / CLI Output  \n\nStep 3: Configure Subnets  \nUses: Subnet Configuration Parameters, VPC ID, AWS Account Credentials  \nAction: Create three subnets within the VPC using provided CIDRs and AZs  \nProduces: Subnet IDs (Input 11)  \nStores/Sends To: AWS Console / CLI Output  \n\nStep 4: Configure Web Server Firewall  \nUses: Web Server Firewall Rules, VPC ID, AWS Account Credentials  \nAction: Create security group with specified rules, associate with WAF if required  \nProduces: Security Group ID (Input 12)  \nStores/Sends To: AWS Console / CLI Output  \n\nStep 5: Launch Linux VM  \nUses: Linux VM Specifications, Subnet ID, Security Group ID, AWS AMI Metadata  \nAction: Launch EC2 instance with specified AMI, instance type, and network configuration  \nProduces: EC2 Instance ID (Input 13)  \nStores/Sends To: AWS Console / CLI Output  \n\nStep 6: Execute Unit Tests  \nUses: Unit Test Scenarios, EC2 Instance ID, Security Group ID  \nAction: Run automated tests (e.g., SSH connectivity, HTTP port accessibility)  \nProduces: Unit Test Report  \nStores/Sends To: User-specified reporting system  \n\nStep 7: Fix Infrastructure Issues  \nUses: Unit Test Report, Security Compliance Requirements  \nAction: Adjust security rules, subnet configurations, or VM settings to meet compliance and test requirements  \nProduces: Updated Infrastructure Configuration  \nStores/Sends To: AWS Console / CLI Output  \n\nStep 8: Final Deployment  \nUses: Deployment Environment Variables, All Previous Outputs  \nAction: Apply tags, finalize resource configurations, and mark environment as \"prod\"  \nProduces: Deployed Production Environment  \nStores/Sends To: AWS Resource Tags / Monitoring System  \n\n[DEPTH STOP CONDITIONS MET: All DERIVABLE inputs trace back to USER-CONTROLLED or SYSTEM-RETRIEVABLE sources]"
  },
  "aeb_analysis": {
    "steps_count": 8,
    "aeb_analysis_raw": "### Step-by-Step Analysis\n\n---\n\n**Step 1**  \n**Step:** Validate CIDR block compatibility, plan subnet AZ distribution, draft security rules  \n**Is AEB:** No  \n**Reason:** This step includes **validation** (explicitly disallowed in AEBs), **planning**, and **drafting**—three distinct intents. It also implies **sequencing** (validate → plan → draft).  \n**Suggest:** Break into:  \n1. Validate CIDR block compatibility (remove from AEB, as validation is not allowed)  \n2. Plan subnet AZ distribution (AEB candidate)  \n3. Draft security rules (AEB candidate)\n\n---\n\n**Step 2**  \n**Step:** Call AWS EC2 API to create VPC with specified CIDR  \n**Is AEB:** Yes  \n**Reason:** Single intent (create VPC), interacts with AWS EC2 API (one system boundary), no branching/sequencing/validation, and can be implemented as a single API call (`CreateVpc`).  \n**Suggest:** N/A\n\n---\n\n**Step 3**  \n**Step:** Create three subnets within the VPC using provided CIDRs and AZs  \n**Is AEB:** No  \n**Reason:** This step involves **sequencing** (creating three subnets in sequence) and **multiple intents** (three subnet creations). Each subnet creation is a separate API call in AWS (`CreateSubnet`).  \n**Suggest:** Break into three individual AEBs:  \n1. Create subnet 1 in AZ A  \n2. Create subnet 2 in AZ B  \n3. Create subnet 3 in AZ C\n\n---\n\n**Step 4**  \n**Step:** Create security group with specified rules, associate with WAF if required  \n**Is AEB:** No  \n**Reason:** The phrase **\"if required\"** introduces **branching logic**, which is disallowed in AEBs. Creating a security group and associating with WAF are two separate actions (two system boundaries).  \n**Suggest:** Split into:  \n1. Create security group with specified rules (AEB)  \n2. Associate security group with WAF (AEB, if WAF is enabled)\n\n---\n\n**Step 5**  \n**Step:** Launch EC2 instance with specified AMI, instance type, and network configuration  \n**Is AEB:** Yes  \n**Reason:** Single intent (launch instance), interacts with AWS EC2 API (`RunInstances`), no branching/sequencing/validation, and can be implemented as a single API call.  \n**Suggest:** N/A\n\n---\n\n**Step 6**  \n**Step:** Run automated tests (e.g., SSH connectivity, HTTP port accessibility)  \n**Is AEB:** No  \n**Reason:** This step involves **sequencing** (running multiple tests in sequence) and potentially **branching** (if one test fails, stop or continue). Each test (SSH, HTTP) is a distinct intent.  \n**Suggest:** Break into:  \n1. Run SSH connectivity test  \n2. Run HTTP port accessibility test  \n3. Run any additional unit tests\n\n---\n\n**Step 7**  \n**Step:** Adjust security rules, subnet configurations, or VM settings to meet compliance and test requirements  \n**Is AEB:** No  \n**Reason:** This step involves **branching** (\"or\" logic), **multiple intents** (adjusting security rules, subnets, or VMs), and **validation** (checking compliance/test results).  \n**Suggest:** Break into:  \n1. Adjust security rules  \n2. Adjust subnet configurations  \n3. Adjust VM settings  \nEach of these can be individual AEBs if implemented as single API calls.\n\n---\n\n**Step 8**  \n**Step:** Apply tags, finalize resource configurations, and mark environment as \"prod\"  \n**Is AEB:** No  \n**Reason:** This step includes **multiple intents** (apply tags, finalize configurations, mark environment) and potentially **sequencing** (finalize → tag → mark).  \n**Suggest:** Break into:  \n1. Apply tags to resources  \n2. Finalize resource configurations  \n3. Mark environment as \"prod\" (e.g., via tag or monitoring system)\n\n---\n\n### Summary Table\n\n| Step | Is AEB | Reason |\n|------|--------|--------|\n| 1 | No",
    "analysis_complete": true
  },
  "io_decomposed": true
}