{
  "task_id": "a2115457fde6",
  "input": "Continuously optimize the warehouse conveyor network by analyzing live data, safely adjusting parameters, monitoring the impact, and reporting performance gains.",
  "required_inputs": [],
  "outputs": [
    "result"
  ],
  "subtasks": [],
  "dependency_structure": {
    "type": "dependency_driven",
    "graph": {},
    "total_subtasks": 0
  },
  "execution_plan": {
    "model_used": "AI1",
    "model_endpoint": "qwen/qwen3-235b-a22b",
    "inputs": [
      {
        "name": "Live Sensor Data",
        "source_type": "SYSTEM-RETRIEVABLE",
        "source_origin": "IoT monitoring system (e.g., conveyor belt sensors)",
        "input_data": "Real-time metrics (speed, load, temperature, throughput)",
        "bound_reference": "N/A"
      },
      {
        "name": "Historical Performance Data",
        "source_type": "SYSTEM-RETRIEVABLE",
        "source_origin": "Data warehouse (e.g., PostgreSQL, Hadoop)",
        "input_data": "Past operational metrics (e.g., hourly throughput logs, downtime records)",
        "bound_reference": "N/A"
      },
      {
        "name": "Optimization Parameters",
        "source_type": "USER-CONTROLLED",
        "source_origin": "Operations team",
        "input_data": "Target thresholds (e.g., max speed = 2.5 m/s, load limit = 500 kg)",
        "bound_reference": "N/A"
      },
      {
        "name": "Safety Protocols",
        "source_type": "USER-CONTROLLED",
        "source_origin": "Engineering team",
        "input_data": "Constraints (e.g., emergency stop conditions, vibration limits)",
        "bound_reference": "N/A"
      },
      {
        "name": "Current Conveyor Parameters",
        "source_type": "SYSTEM-RETRIEVABLE",
        "source_origin": "Conveyor control system (e.g., PLC or SCADA)",
        "input_data": "Active settings (e.g., current speed, motor RPM)",
        "bound_reference": "N/A"
      },
      {
        "name": "Reporting Template",
        "source_type": "USER-CONTROLLED",
        "source_origin": "Analytics team",
        "input_data": "Report structure (e.g., KPIs to highlight, visualization formats)",
        "bound_reference": "N/A"
      },
      {
        "name": "Optimization Rules",
        "source_type": "DERIVABLE",
        "source_origin": "Derived from Optimization Parameters and Safety Protocols",
        "input_data": "Logic for parameter adjustments (e.g., \"if load > 450 kg, reduce speed by 10%\")",
        "bound_reference": "Inputs 3, 4"
      }
    ],
    "outputs": [
      "Adjusted Conveyor Parameters",
      "Performance Gain Report",
      "System Alerts",
      "Updated Historical Performance Data"
    ],
    "steps": [
      "Uses: Live Sensor Data, Current Conveyor Parameters  \nAction: Aggregate and validate real-time sensor metrics against current settings.  \nProduces: Validated Live Data Snapshot  \nStores/Sends To: In-memory processing buffer",
      "Uses: Historical Performance Data  \nAction: Compute baseline metrics (e.g., average throughput, downtime frequency).  \nProduces: Baseline Performance Model  \nStores/Sends To: Analytics database",
      "Uses: Validated Live Data Snapshot, Baseline Performance Model  \nAction: Identify inefficiencies via statistical comparison (e.g., ANOVA, regression).  \nProduces: Inefficiency Analysis Report  \nStores/Sends To: Analytics database",
      "Uses: Optimization Rules, Inefficiency Analysis Report  \nAction: Generate candidate parameter adjustments using rule-based logic.  \nProduces: Proposed Parameter Set  \nStores/Sends To: Optimization engine",
      "Uses: Proposed Parameter Set, Safety Protocols  \nAction: Validate adjustments against safety constraints (e.g., vibration limits).  \nProduces: Safety-Compliant Parameter Set  \nStores/Sends To: Control system queue",
      "Uses: Safety-Compliant Parameter Set  \nAction: Deploy updated parameters to conveyor control system.  \nProduces: Updated Conveyor Configuration  \nStores/Sends To: PLC/SCADA system",
      "Uses: Live Sensor Data (post-adjustment), Baseline Performance Model  \nAction: Measure impact via A/B testing (before/after performance).  \nProduces: Impact Assessment Report  \nStores/Sends To: Analytics database",
      "Uses: Impact Assessment Report, Reporting Template  \nAction: Generate formatted performance gain report.  \nProduces: Final Performance Report  \nStores/Sends To: Report server (e.g., internal dashboard, email distribution list)",
      "Uses: Final Performance Report  \nAction: Archive results in historical performance data store.  \nProduces: Updated Historical Performance Data  \nStores/Sends To: Data warehouse",
      "Uses: Live Sensor Data, Safety Protocols  \nAction: Continuously monitor for violations (e.g., overload alerts).  \nProduces: System Alerts  \nStores/Sends To: Alerting system (e.g., PagerDuty, SMS gateway)  \n\n---"
    ],
    "raw_response": "Inputs:  \n1. **Live Sensor Data**  \n   Source Type: SYSTEM-RETRIEVABLE  \n   Source Origin: IoT monitoring system (e.g., conveyor belt sensors)  \n   Input Data: Real-time metrics (speed, load, temperature, throughput)  \n   Bound Reference: N/A  \n\n2. **Historical Performance Data**  \n   Source Type: SYSTEM-RETRIEVABLE  \n   Source Origin: Data warehouse (e.g., PostgreSQL, Hadoop)  \n   Input Data: Past operational metrics (e.g., hourly throughput logs, downtime records)  \n   Bound Reference: N/A  \n\n3. **Optimization Parameters**  \n   Source Type: USER-CONTROLLED  \n   Source Origin: Operations team  \n   Input Data: Target thresholds (e.g., max speed = 2.5 m/s, load limit = 500 kg)  \n   Bound Reference: N/A  \n   Note: Requires explicit user provision or linkage.  \n\n4. **Safety Protocols**  \n   Source Type: USER-CONTROLLED  \n   Source Origin: Engineering team  \n   Input Data: Constraints (e.g., emergency stop conditions, vibration limits)  \n   Bound Reference: N/A  \n   Note: Requires explicit user provision or linkage.  \n\n5. **Current Conveyor Parameters**  \n   Source Type: SYSTEM-RETRIEVABLE  \n   Source Origin: Conveyor control system (e.g., PLC or SCADA)  \n   Input Data: Active settings (e.g., current speed, motor RPM)  \n   Bound Reference: N/A  \n\n6. **Reporting Template**  \n   Source Type: USER-CONTROLLED  \n   Source Origin: Analytics team  \n   Input Data: Report structure (e.g., KPIs to highlight, visualization formats)  \n   Bound Reference: N/A  \n   Note: Requires explicit user provision or linkage.  \n\n7. **Optimization Rules**  \n   Source Type: DERIVABLE  \n   Source Origin: Derived from Optimization Parameters and Safety Protocols  \n   Input Data: Logic for parameter adjustments (e.g., \"if load > 450 kg, reduce speed by 10%\")  \n   Bound Reference: Inputs 3, 4  \n   Note: [DEPTH STOP - Terminal input, do not further decompose]  \n\n---\n\nOutputs:  \n1. Adjusted Conveyor Parameters (e.g., updated speed settings, load distribution rules)  \n2. Performance Gain Report (e.g., PDF/HTML document with throughput improvements)  \n3. System Alerts (e.g., \"Overload detected at Zone C\")  \n4. Updated Historical Performance Data (e.g., new throughput records in data warehouse)  \n\n---\n\nSteps:  \nStep 1:  \nUses: Live Sensor Data, Current Conveyor Parameters  \nAction: Aggregate and validate real-time sensor metrics against current settings.  \nProduces: Validated Live Data Snapshot  \nStores/Sends To: In-memory processing buffer  \n\nStep 2:  \nUses: Historical Performance Data  \nAction: Compute baseline metrics (e.g., average throughput, downtime frequency).  \nProduces: Baseline Performance Model  \nStores/Sends To: Analytics database  \n\nStep 3:  \nUses: Validated Live Data Snapshot, Baseline Performance Model  \nAction: Identify inefficiencies via statistical comparison (e.g., ANOVA, regression).  \nProduces: Inefficiency Analysis Report  \nStores/Sends To: Analytics database  \n\nStep 4:  \nUses: Optimization Rules, Inefficiency Analysis Report  \nAction: Generate candidate parameter adjustments using rule-based logic.  \nProduces: Proposed Parameter Set  \nStores/Sends To: Optimization engine  \n\nStep 5:  \nUses: Proposed Parameter Set, Safety Protocols  \nAction: Validate adjustments against safety constraints (e.g., vibration limits).  \nProduces: Safety-Compliant Parameter Set  \nStores/Sends To: Control system queue  \n\nStep 6:  \nUses: Safety-Compliant Parameter Set  \nAction: Deploy updated parameters to conveyor control system.  \nProduces: Updated Conveyor Configuration  \nStores/Sends To: PLC/SCADA system  \n\nStep 7:  \nUses: Live Sensor Data (post-adjustment), Baseline Performance Model  \nAction: Measure impact via A/B testing (before/after performance).  \nProduces: Impact Assessment Report  \nStores/Sends To: Analytics database  \n\nStep 8:  \nUses: Impact Assessment Report, Reporting Template  \nAction: Generate formatted performance gain report.  \nProduces: Final Performance Report  \nStores/Sends To: Report server (e.g., internal dashboard, email distribution list)  \n\nStep 9:  \nUses: Final Performance Report  \nAction: Archive results in historical performance data store.  \nProduces: Updated Historical Performance Data  \nStores/Sends To: Data warehouse  \n\nStep 10:  \nUses: Live Sensor Data, Safety Protocols  \nAction: Continuously monitor for violations (e.g., overload alerts).  \nProduces: System Alerts  \nStores/Sends To: Alerting system (e.g., PagerDuty, SMS gateway)  \n\n---\n\nDependency Consistency Check:  \n- All inputs used in steps are explicitly declared.  \n- USER-CONTROLLED inputs (3, 4, 6) require explicit provision.  \n- SYSTEM-RETRIEVABLE inputs (1, 2, 5) have defined endpoints.  \n- DERIVABLE input (7) fully decomposed into USER/SYSTEM sources.  \n- All steps produce verifiable outputs."
  },
  "aeb_analysis": {
    "steps_count": 10,
    "aeb_analysis_raw": "Step: 1  \nIs AEB: No  \nReason: Combines aggregation (valid) with validation (explicitly prohibited in AEB definition).  \nSuggest: Split into two steps:  \n- Aggregate real-time sensor metrics (AEB)  \n- Validate metrics against settings (separate AEB if validation logic is atomic, but likely requires branching/error handling).  \n\nStep: 2  \nIs AEB: Yes  \nReason: Single intent (compute baseline metrics), no branching/sequencing, interacts with analytics database.  \n\nStep: 3  \nIs AEB: Yes  \nReason: Single intent (statistical comparison), no branching/sequencing, writes to analytics database.  \n\nStep: 4  \nIs AEB: No  \nReason: Rule-based logic may involve branching (e.g., conditional adjustments).  \nSuggest: Break into individual rule-application steps (e.g., \"Apply throughput-optimization rule\" as an AEB).  \n\nStep: 5  \nIs AEB: No  \nReason: Explicit validation against safety constraints (prohibited in AEB definition).  \nSuggest: Split into atomic checks (e.g., \"Verify vibration limits compliance\" as an AEB).  \n\nStep: 6  \nIs AEB: Yes  \nReason: Single intent (deploy parameters), interacts with PLC/SCADA system, no branching/sequencing.  \n\nStep: 7  \nIs AEB: Yes  \nReason: Single intent (A/B testing analysis), uses statistical methods as a direct comparison function.  \n\nStep: 8  \nIs AEB: Yes  \nReason: Single intent (formatting report), combines data with template, writes to report server.  \n\nStep: 9  \nIs AEB: Yes  \nReason: Single intent (archiving), writes to data warehouse.  \n\nStep: 10  \nIs AEB: No  \nReason: \"Continuously monitor\" implies looping/sequencing (prohibited in AEB definition).  \nSuggest: Break into atomic checks (e.g., \"Check live sensor data against overload thresholds\" as an AEB).",
    "analysis_complete": true
  },
  "io_decomposed": true
}