{
  "task_id": "9f886aedba8f",
  "input": "Triage incoming tickets, auto-fix common issues, escalate complex cases to engineers, and track resolution metrics.",
  "required_inputs": [],
  "outputs": [
    "result"
  ],
  "subtasks": [],
  "dependency_structure": {
    "type": "dependency_driven",
    "graph": {},
    "total_subtasks": 0
  },
  "execution_plan": {
    "model_used": "AI1",
    "model_endpoint": "qwen/qwen3-235b-a22b",
    "inputs": [
      {
        "name": "I",
        "source_type": "SYSTEM-RETRIEVABLE",
        "source_origin": "Ticketing system API (e.g., Zendesk/Jira)",
        "input_data": "Raw ticket records with content, timestamps, priority",
        "bound_reference": "None"
      },
      {
        "name": "K",
        "source_type": "SYSTEM-RETRIEVABLE",
        "source_origin": "Internal solutions database (e.g., Confluence/MySQL)",
        "input_data": "Structured records mapping issue patterns to fixes",
        "bound_reference": "None"
      },
      {
        "name": "E",
        "source_type": "USER-CONTROLLED",
        "source_origin": "Operations team",
        "input_data": "Numeric complexity score threshold (e.g., >7/10)",
        "bound_reference": null
      },
      {
        "name": "O",
        "source_type": "SYSTEM-RETRIEVABLE",
        "source_origin": "Scheduling tool API (e.g., PagerDuty)",
        "input_data": "Current engineer availability and escalation paths",
        "bound_reference": "None"
      },
      {
        "name": "T",
        "source_type": "DERIVABLE",
        "source_origin": "Derived from Incoming Tickets + Escalation Criteria",
        "input_data": "Classification results per ticket",
        "bound_reference": "Input 1 & 3"
      },
      {
        "name": "A",
        "source_type": "DERIVABLE",
        "source_origin": "Derived from Knowledge Base",
        "input_data": "Subset of knowledge base entries applicable to current tickets",
        "bound_reference": "Input 2"
      }
    ],
    "outputs": [
      "Auto-Fixed Tickets",
      "Escalated Tickets Queue",
      "Updated Metrics Dashboard",
      "System Logs"
    ],
    "steps": [
      "Uses: Incoming Tickets\nAction: Retrieve raw ticket records from ticketing system API\nProduces: Raw ticket dataset\nStores/Sends To: Processing queue",
      "Uses: Escalation Criteria Threshold, Incoming Tickets\nAction: Apply ML classifier to score ticket complexity against threshold\nProduces: Ticket Classification (Common/Complex)\nStores/Sends To: Classification cache",
      "Uses: Ticket Classification (Common/Complex), Auto-Fixable Issues List\nAction: Match common tickets to knowledge base solutions and execute fixes\nProduces: Auto-fixed tickets with resolution details\nStores/Sends To: Ticketing system API (status updates)",
      "Uses: Ticket Classification (Common/Complex), On-Call Engineer Schedule\nAction: Route complex tickets to appropriate engineers via escalation paths\nProduces: Escalated tickets queue\nStores/Sends To: Engineering team communication channel",
      "Uses: Auto-Fixed Tickets, Escalated Tickets Queue\nAction: Aggregate resolution timestamps and success metrics\nProduces: Metrics dataset\nStores/Sends To: Dashboard database",
      "Uses: Metrics Dataset\nAction: Update visualization components on metrics dashboard\nProduces: Updated metrics dashboard\nStores/Sends To: Internal analytics platform"
    ],
    "raw_response": "Inputs:\n1. Incoming Tickets\n   Source Type: SYSTEM-RETRIEVABLE\n   Source Origin: Ticketing system API (e.g., Zendesk/Jira)\n   Input Data: Raw ticket records with content, timestamps, priority\n   Bound Reference: None\n\n2. Knowledge Base of Common Solutions\n   Source Type: SYSTEM-RETRIEVABLE\n   Source Origin: Internal solutions database (e.g., Confluence/MySQL)\n   Input Data: Structured records mapping issue patterns to fixes\n   Bound Reference: None\n\n3. Escalation Criteria Threshold\n   Source Type: USER-CONTROLLED\n   Source Origin: Operations team\n   Input Data: Numeric complexity score threshold (e.g., >7/10)\n   Note: Requires explicit user provision or linkage.\n\n4. On-Call Engineer Schedule\n   Source Type: SYSTEM-RETRIEVABLE\n   Source Origin: Scheduling tool API (e.g., PagerDuty)\n   Input Data: Current engineer availability and escalation paths\n   Bound Reference: None\n\n5. Ticket Classification (Common/Complex)\n   Source Type: DERIVABLE\n   Source Origin: Derived from Incoming Tickets + Escalation Criteria\n   Input Data: Classification results per ticket\n   Bound Reference: Input 1 & 3\n   Note: [DEPTH STOP - Terminal input, do not further decompose]\n\n6. Auto-Fixable Issues List\n   Source Type: DERIVABLE\n   Source Origin: Derived from Knowledge Base\n   Input Data: Subset of knowledge base entries applicable to current tickets\n   Bound Reference: Input 2\n   Note: [DEPTH STOP - Terminal input, do not further decompose]\n\nOutputs:\n1. Auto-Fixed Tickets\n2. Escalated Tickets Queue\n3. Updated Metrics Dashboard\n4. System Logs\n\nSteps:\nStep 1:\nUses: Incoming Tickets\nAction: Retrieve raw ticket records from ticketing system API\nProduces: Raw ticket dataset\nStores/Sends To: Processing queue\n\nStep 2:\nUses: Escalation Criteria Threshold, Incoming Tickets\nAction: Apply ML classifier to score ticket complexity against threshold\nProduces: Ticket Classification (Common/Complex)\nStores/Sends To: Classification cache\n\nStep 3:\nUses: Ticket Classification (Common/Complex), Auto-Fixable Issues List\nAction: Match common tickets to knowledge base solutions and execute fixes\nProduces: Auto-fixed tickets with resolution details\nStores/Sends To: Ticketing system API (status updates)\n\nStep 4:\nUses: Ticket Classification (Common/Complex), On-Call Engineer Schedule\nAction: Route complex tickets to appropriate engineers via escalation paths\nProduces: Escalated tickets queue\nStores/Sends To: Engineering team communication channel\n\nStep 5:\nUses: Auto-Fixed Tickets, Escalated Tickets Queue\nAction: Aggregate resolution timestamps and success metrics\nProduces: Metrics dataset\nStores/Sends To: Dashboard database\n\nStep 6:\nUses: Metrics Dataset\nAction: Update visualization components on metrics dashboard\nProduces: Updated metrics dashboard\nStores/Sends To: Internal analytics platform"
  },
  "aeb_analysis": {
    "steps_count": 6,
    "aeb_analysis_raw": null,
    "analysis_complete": true
  },
  "io_decomposed": true
}