{
  "task_id": "6d6cdaf7872a",
  "input": "Handle retail customer queries by sorting them, auto-solving common ones, routing tough cases to staff, and tracking every step for performance.",
  "required_inputs": [],
  "outputs": [
    "result"
  ],
  "subtasks": [],
  "dependency_structure": {
    "type": "dependency_driven",
    "graph": {},
    "total_subtasks": 0
  },
  "execution_plan": {
    "model_used": "AI1",
    "model_endpoint": "qwen/qwen3-235b-a22b",
    "inputs": [
      {
        "name": "C",
        "source_type": "SYSTEM-RETRIEVABLE",
        "source_origin": "Customer communication channels (email server, chat API, phone transcription service)",
        "input_data": "Raw text/audio of customer messages",
        "bound_reference": "<Input 2>"
      },
      {
        "name": "Q",
        "source_type": "SYSTEM-RETRIEVABLE",
        "source_origin": "Communication platform APIs",
        "input_data": "Timestamp, channel type (email/chat/phone), customer ID",
        "bound_reference": "<Input 1>"
      },
      {
        "name": "Q",
        "source_type": "SYSTEM-RETRIEVABLE",
        "source_origin": "Machine learning model repository",
        "input_data": "Pre-trained text classification model",
        "bound_reference": "<Input 4>"
      },
      {
        "name": "C",
        "source_type": "USER-CONTROLLED",
        "source_origin": "Customer support team",
        "input_data": "Labeled examples of frequent query types",
        "bound_reference": "Requires explicit user provision or linkage."
      },
      {
        "name": "A",
        "source_type": "USER-CONTROLLED",
        "source_origin": "Customer service department",
        "input_data": "Pre-written response templates for common issues",
        "bound_reference": "Requires explicit user provision or linkage."
      },
      {
        "name": "S",
        "source_type": "USER-CONTROLLED",
        "source_origin": "Operations management",
        "input_data": "Escalation criteria and staff assignment rules",
        "bound_reference": "Requires explicit user provision or linkage."
      },
      {
        "name": "S",
        "source_type": "SYSTEM-RETRIEVABLE",
        "source_origin": "Internal HR system/calendar API",
        "input_data": "Real-time staff presence/status",
        "bound_reference": "<Input 6>"
      },
      {
        "name": "T",
        "source_type": "USER-CONTROLLED",
        "source_origin": "Analytics team",
        "input_data": "Metrics to track (resolution time, escalation rate, etc.)",
        "bound_reference": "Requires explicit user provision or linkage."
      },
      {
        "name": "P",
        "source_type": "SYSTEM-RETRIEVABLE",
        "source_origin": "Analytics platform",
        "input_data": "Pre-configured dashboard template",
        "bound_reference": "<Input 8>"
      }
    ],
    "outputs": [
      "Categorized Query Queue",
      "Auto-Response Messages",
      "Staff Escalation Tickets",
      "Tracking Database Records",
      "Performance Metrics Dashboard"
    ],
    "steps": [
      "Uses: Input 1, Input 2\nAction: Retrieve and validate incoming customer queries with metadata\nProduces: Raw query records\nStores/Sends To: Input validation buffer",
      "Uses: Input 3, Input 4, Input 1\nAction: Apply classification model to determine query category\nProduces: Query category labels\nStores/Sends To: Processing queue manager",
      "Uses: Input 5, Input 2, Input 4\nAction: Generate auto-response for common issues using template matching\nProduces: Automated response drafts\nStores/Sends To: Response queue",
      "Uses: Input 6, Input 7, Input 2\nAction: Route complex queries to staff based on availability and expertise\nProduces: Escalation tickets\nStores/Sends To: Staff inbox system",
      "Uses: Input 8, All previous inputs\nAction: Record handling steps and timing in tracking database\nProduces: Query handling logs\nStores/Sends To: Analytics database",
      "Uses: Input 9, Output 4\nAction: Update performance dashboard with new metrics\nProduces: Dashboard visualizations\nStores/Sends To: Analytics platform\n\n[DEPTH STOP CONDITIONS MET]"
    ],
    "raw_response": "Inputs:\n1. Customer Query Content\n   Source Type: SYSTEM-RETRIEVABLE\n   Source Origin: Customer communication channels (email server, chat API, phone transcription service)\n   Input Data: Raw text/audio of customer messages\n   Bound Reference: <Input 2>\n\n2. Query Channel Metadata\n   Source Type: SYSTEM-RETRIEVABLE\n   Source Origin: Communication platform APIs\n   Input Data: Timestamp, channel type (email/chat/phone), customer ID\n   Bound Reference: <Input 1>\n\n3. Query Classification Model\n   Source Type: SYSTEM-RETRIEVABLE\n   Source Origin: Machine learning model repository\n   Input Data: Pre-trained text classification model\n   Bound Reference: <Input 4>\n\n4. Common Issue Patterns\n   Source Type: USER-CONTROLLED\n   Source Origin: Customer support team\n   Input Data: Labeled examples of frequent query types\n   Bound Reference: Requires explicit user provision or linkage.\n   Note: Used to train/update classification model\n\n5. Auto-Response Templates\n   Source Type: USER-CONTROLLED\n   Source Origin: Customer service department\n   Input Data: Pre-written response templates for common issues\n   Bound Reference: Requires explicit user provision or linkage.\n\n6. Staff Routing Rules\n   Source Type: USER-CONTROLLED\n   Source Origin: Operations management\n   Input Data: Escalation criteria and staff assignment rules\n   Bound Reference: Requires explicit user provision or linkage.\n\n7. Staff Availability Data\n   Source Type: SYSTEM-RETRIEVABLE\n   Source Origin: Internal HR system/calendar API\n   Input Data: Real-time staff presence/status\n   Bound Reference: <Input 6>\n\n8. Tracking Configuration\n   Source Type: USER-CONTROLLED\n   Source Origin: Analytics team\n   Input Data: Metrics to track (resolution time, escalation rate, etc.)\n   Bound Reference: Requires explicit user provision or linkage.\n\n9. Performance Dashboard\n   Source Type: SYSTEM-RETRIEVABLE\n   Source Origin: Analytics platform\n   Input Data: Pre-configured dashboard template\n   Bound Reference: <Input 8>\n\nOutputs:\n1. Categorized Query Queue\n   Type: Persisted state change\n   Description: Queries sorted into processing queues by complexity/category\n\n2. Auto-Response Messages\n   Type: Triggered action\n   Description: Automated replies sent to customers for resolved issues\n\n3. Staff Escalation Tickets\n   Type: Observable artifact\n   Description: Structured tickets routed to appropriate support staff\n\n4. Tracking Database Records\n   Type: Persisted state change\n   Description: Detailed logs of query handling steps and timing\n\n5. Performance Metrics Dashboard\n   Type: Measurable report\n   Description: Updated visualizations showing system effectiveness\n\nSteps:\nStep 1:\nUses: Input 1, Input 2\nAction: Retrieve and validate incoming customer queries with metadata\nProduces: Raw query records\nStores/Sends To: Input validation buffer\n\nStep 2:\nUses: Input 3, Input 4, Input 1\nAction: Apply classification model to determine query category\nProduces: Query category labels\nStores/Sends To: Processing queue manager\n\nStep 3:\nUses: Input 5, Input 2, Input 4\nAction: Generate auto-response for common issues using template matching\nProduces: Automated response drafts\nStores/Sends To: Response queue\n\nStep 4:\nUses: Input 6, Input 7, Input 2\nAction: Route complex queries to staff based on availability and expertise\nProduces: Escalation tickets\nStores/Sends To: Staff inbox system\n\nStep 5:\nUses: Input 8, All previous inputs\nAction: Record handling steps and timing in tracking database\nProduces: Query handling logs\nStores/Sends To: Analytics database\n\nStep 6:\nUses: Input 9, Output 4\nAction: Update performance dashboard with new metrics\nProduces: Dashboard visualizations\nStores/Sends To: Analytics platform\n\n[DEPTH STOP CONDITIONS MET]\nAll DERIVABLE inputs have been decomposed into terminal USER-CONTROLLED or SYSTEM-RETRIEVABLE sources. No undecomposed derivation chains remain."
  },
  "aeb_analysis": {
    "steps_count": 6,
    "aeb_analysis_raw": null,
    "analysis_complete": true
  },
  "io_decomposed": true
}