{
  "task_id": "fe08322c1e7d",
  "input": "Design an automated support workflow that triages retail customer inquiries, resolves simple issues instantly, escalates complex cases, and tracks resolution performance.",
  "required_inputs": [],
  "outputs": [
    "result"
  ],
  "subtasks": [],
  "dependency_structure": {
    "type": "dependency_driven",
    "graph": {},
    "total_subtasks": 0
  },
  "execution_plan": {
    "model_used": "AI1",
    "model_endpoint": "qwen/qwen3-235b-a22b",
    "inputs": [
      {
        "name": "C",
        "source_type": "SYSTEM-RETRIEVABLE",
        "source_origin": "Support system API (e.g., Zendesk/Zendesk API)",
        "input_data": "Raw text of customer inquiries with timestamps, user IDs, and channel metadata",
        "bound_reference": "None"
      },
      {
        "name": "C",
        "source_type": "SYSTEM-RETRIEVABLE",
        "source_origin": "Machine learning model repository (e.g., AWS SageMaker endpoint)",
        "input_data": "Pre-trained NLP model for issue categorization (e.g., JSON schema for intent classification)",
        "bound_reference": "None"
      },
      {
        "name": "R",
        "source_type": "USER-CONTROLLED",
        "source_origin": "Customer service team",
        "input_data": "Structured rules mapping issue categories to automated responses (e.g., YAML file)",
        "bound_reference": "Requires explicit user provision or linkage."
      },
      {
        "name": "E",
        "source_type": "USER-CONTROLLED",
        "source_origin": "Operations manager",
        "input_data": "Thresholds for complexity (e.g., SQL query for unresolved issue patterns)",
        "bound_reference": "Requires explicit user provision or linkage."
      },
      {
        "name": "C",
        "source_type": "SYSTEM-RETRIEVABLE",
        "source_origin": "CRM database (e.g., Salesforce API)",
        "input_data": "Customer purchase history, loyalty status, and past support interactions",
        "bound_reference": "None"
      },
      {
        "name": "E",
        "source_type": "USER-CONTROLLED",
        "source_origin": "IT department",
        "input_data": "Endpoint configurations for escalation (e.g., Jira webhook URLs, email distribution lists)",
        "bound_reference": "Requires explicit user provision or linkage."
      },
      {
        "name": "P",
        "source_type": "USER-CONTROLLED",
        "source_origin": "Business intelligence team",
        "input_data": "KPIs like resolution SLA (e.g., JSON object with time thresholds)",
        "bound_reference": "Requires explicit user provision or linkage."
      }
    ],
    "outputs": [
      "Triage Results",
      "Automated Responses",
      "Escalation Tickets",
      "Performance Dashboard"
    ],
    "steps": [
      "Uses: Customer Inquiries Dataset, Customer Profile Data  \nAction: Correlate inquiries with customer profiles to enrich context  \nProduces: Enriched Inquiries Dataset  \nStores/Sends To: Temporary processing queue (e.g., Kafka topic)",
      "Uses: Enriched Inquiries Dataset, Classification Model  \nAction: Apply NLP model to classify inquiries into categories (e.g., billing, returns, technical)  \nProduces: Categorized Inquiries  \nStores/Sends To: In-memory processing layer",
      "Uses: Categorized Inquiries, Resolution Rules  \nAction: Match categories to predefined resolution rules to generate automated responses  \nProduces: Automated Response Candidates  \nStores/Sends To: Response validation module",
      "Uses: Automated Response Candidates, Escalation Criteria  \nAction: Filter unresolved inquiries using complexity thresholds to identify escalation candidates  \nProduces: Escalation Queue  \nStores/Sends To: Escalation system API (e.g., Jira REST endpoint)",
      "Uses: Escalation Queue, Escalation Channels  \nAction: Trigger alerts via configured channels with priority based on SLA deadlines  \nProduces: Escalation Tickets  \nStores/Sends To: Ticketing system with audit trail",
      "Uses: Triage Results, Performance Metrics Definitions  \nAction: Calculate KPIs (e.g., % resolved instantly, average resolution time)  \nProduces: Metrics Dataset  \nStores/Sends To: BI tool data warehouse",
      "Uses: Metrics Dataset  \nAction: Generate visual dashboard with drill-down capabilities for root-cause analysis  \nProduces: Performance Dashboard  \nStores/Sends To: Executive reporting portal  \n\n[DEPTH STOP] All leaf inputs (SYSTEM-RETRIEVABLE endpoints and USER-CONTROLLED parameters) are explicitly declared. DERIVABLE inputs (e.g., Enriched Inquiries Dataset) are fully decomposed into source dependencies."
    ],
    "raw_response": "Inputs:\n1. Customer Inquiries Dataset  \n   Source Type: SYSTEM-RETRIEVABLE  \n   Source Origin: Support system API (e.g., Zendesk/Zendesk API)  \n   Input Data: Raw text of customer inquiries with timestamps, user IDs, and channel metadata  \n   Bound Reference: None  \n\n2. Classification Model  \n   Source Type: SYSTEM-RETRIEVABLE  \n   Source Origin: Machine learning model repository (e.g., AWS SageMaker endpoint)  \n   Input Data: Pre-trained NLP model for issue categorization (e.g., JSON schema for intent classification)  \n   Bound Reference: None  \n\n3. Resolution Rules  \n   Source Type: USER-CONTROLLED  \n   Source Origin: Customer service team  \n   Input Data: Structured rules mapping issue categories to automated responses (e.g., YAML file)  \n   Bound Reference: Requires explicit user provision or linkage.  \n\n4. Escalation Criteria  \n   Source Type: USER-CONTROLLED  \n   Source Origin: Operations manager  \n   Input Data: Thresholds for complexity (e.g., SQL query for unresolved issue patterns)  \n   Bound Reference: Requires explicit user provision or linkage.  \n\n5. Customer Profile Data  \n   Source Type: SYSTEM-RETRIEVABLE  \n   Source Origin: CRM database (e.g., Salesforce API)  \n   Input Data: Customer purchase history, loyalty status, and past support interactions  \n   Bound Reference: None  \n\n6. Escalation Channels  \n   Source Type: USER-CONTROLLED  \n   Source Origin: IT department  \n   Input Data: Endpoint configurations for escalation (e.g., Jira webhook URLs, email distribution lists)  \n   Bound Reference: Requires explicit user provision or linkage.  \n\n7. Performance Metrics Definitions  \n   Source Type: USER-CONTROLLED  \n   Source Origin: Business intelligence team  \n   Input Data: KPIs like resolution SLA (e.g., JSON object with time thresholds)  \n   Bound Reference: Requires explicit user provision or linkage.  \n\nOutputs:\n1. Triage Results  \n   Type: Persisted state change  \n   Description: Labeled dataset of inquiries with complexity scores and routing decisions  \n   Storage: Internal analytics database  \n\n2. Automated Responses  \n   Type: Observable artifact  \n   Description: Generated text replies sent to customers  \n   Storage: Email/SMS logs, support ticket system  \n\n3. Escalation Tickets  \n   Type: Triggered action  \n   Description: Tickets created in escalation systems with priority labels  \n   Storage: Jira/ServiceNow instances  \n\n4. Performance Dashboard  \n   Type: Measurable report  \n   Description: Daily metrics on resolution rates, SLA adherence, and backlog volume  \n   Storage: BI tool (e.g., Tableau)  \n\nSteps:\nStep 1:  \nUses: Customer Inquiries Dataset, Customer Profile Data  \nAction: Correlate inquiries with customer profiles to enrich context  \nProduces: Enriched Inquiries Dataset  \nStores/Sends To: Temporary processing queue (e.g., Kafka topic)  \n\nStep 2:  \nUses: Enriched Inquiries Dataset, Classification Model  \nAction: Apply NLP model to classify inquiries into categories (e.g., billing, returns, technical)  \nProduces: Categorized Inquiries  \nStores/Sends To: In-memory processing layer  \n\nStep 3:  \nUses: Categorized Inquiries, Resolution Rules  \nAction: Match categories to predefined resolution rules to generate automated responses  \nProduces: Automated Response Candidates  \nStores/Sends To: Response validation module  \n\nStep 4:  \nUses: Automated Response Candidates, Escalation Criteria  \nAction: Filter unresolved inquiries using complexity thresholds to identify escalation candidates  \nProduces: Escalation Queue  \nStores/Sends To: Escalation system API (e.g., Jira REST endpoint)  \n\nStep 5:  \nUses: Escalation Queue, Escalation Channels  \nAction: Trigger alerts via configured channels with priority based on SLA deadlines  \nProduces: Escalation Tickets  \nStores/Sends To: Ticketing system with audit trail  \n\nStep 6:  \nUses: Triage Results, Performance Metrics Definitions  \nAction: Calculate KPIs (e.g., % resolved instantly, average resolution time)  \nProduces: Metrics Dataset  \nStores/Sends To: BI tool data warehouse  \n\nStep 7:  \nUses: Metrics Dataset  \nAction: Generate visual dashboard with drill-down capabilities for root-cause analysis  \nProduces: Performance Dashboard  \nStores/Sends To: Executive reporting portal  \n\n[DEPTH STOP] All leaf inputs (SYSTEM-RETRIEVABLE endpoints and USER-CONTROLLED parameters) are explicitly declared. DERIVABLE inputs (e.g., Enriched Inquiries Dataset) are fully decomposed into source dependencies."
  },
  "aeb_analysis": {
    "steps_count": 7,
    "aeb_analysis_raw": "### AEB Validation Analysis\n\n---\n\n#### **Step 1**  \n- **Step**: Correlate inquiries with customer profiles to enrich context  \n- **Is AEB**: Yes  \n- **Reason**:  \n  - **Single intent**: Correlate datasets.  \n  - **One system boundary**: Kafka topic (output).  \n  - **No sequencing/branching**: Assumes a direct join/merge operation.  \n  - **Implementable as a single function**: E.g., `enrich_inquiries(customer_data, profile_data) -> kafka_produce(enriched_data)`.  \n- **Suggestion**: N/A  \n\n---\n\n#### **Step 2**  \n- **Step**: Apply NLP model to classify inquiries into categories  \n- **Is AEB**: Yes  \n- **Reason**:  \n  - **Single intent**: Classification via NLP.  \n  - **One system boundary**: In-memory layer (output).  \n  - **No sequencing/branching**: Model inference is atomic.  \n  - **Implementable as a single function**: E.g., `classify_inquiries(enriched_data, model) -> in_memory_store(categorized_data)`.  \n- **Suggestion**: N/A  \n\n---\n\n#### **Step 3**  \n- **Step**: Match categories to resolution rules to generate responses  \n- **Is AEB**: Yes  \n- **Reason**:  \n  - **Single intent**: Rule-based response generation.  \n  - **One system boundary**: Response validation module (output).  \n  - **No sequencing/branching**: Assumes a direct lookup/mapping.  \n  - **Implementable as a single function**: E.g., `generate_responses(categorized_data, rules) -> send_to_validation(response_candidates)`.  \n- **Suggestion**: N/A  \n\n---\n\n#### **Step 4**  \n- **Step**: Filter unresolved inquiries using complexity thresholds to identify escalation candidates  \n- **Is AEB**: Yes  \n- **Reason**:  \n  - **Single intent**: Escalation filtering.  \n  - **One system boundary**: Jira REST endpoint (output).  \n  - **No sequencing/branching**: Threshold check is atomic (e.g., `complexity_score > X`).  \n  - **Implementable as a single function**: E.g., `filter_escalations(response_candidates, criteria) -> jira_api.create_tickets(escalation_queue)`.  \n- **Suggestion**: N/A  \n\n---\n\n#### **Step 5**  \n- **Step**: Trigger alerts via configured channels with priority based on SLA deadlines  \n- **Is AEB**: No  \n- **Reason**:  \n  - **Multiple system boundaries**: Alerting channels (e.g., email, Slack, Jira) may involve separate APIs.  \n  - **Implicit branching**: Priority logic may require conditional checks (e.g., \"if SLA < 24h, set high priority\").  \n  - **Validation**: SLA deadline checks may involve error handling.  \n- **Suggestion**:  \n  1. **Calculate priority based on SLA deadlines** (AEB: single intent, one system boundary if SLA data is local).  \n  2. **Trigger alerts via individual channels** (Split into separate AEBs for each channel, e.g., `send_email_alert()`, `post_slack_alert()`).  \n\n---\n\n#### **Step 6**  \n- **Step**: Calculate KPIs (e.g., % resolved instantly, average resolution time)  \n- **Is AEB**: No  \n- **Reason**:  \n  - **Multiple intents**: Calculating multiple KPIs (e.g., percentage, average) may involve sequencing.  \n  - **Potential branching**: Conditional logic for KPI thresholds (e.g., \"if resolution_time < 1h, count as instant\").  \n- **Suggestion**:  \n  1. **Calculate % resolved instantly** (AEB).  \n  2. **Calculate average resolution time** (AEB).  \n  3. **Aggregate metrics into Metrics Dataset** (AEB).  \n\n---\n\n#### **Step 7**  \n- **Step**: Generate visual dashboard with drill-down capabilities for root-cause analysis  \n- **Is AEB**: No  \n- **Reason**:  \n  - **Multiple intents**: Visualization generation + drill-down logic.  \n  - **Complex system boundary**: BI tools often require multiple API calls (e.g., dashboard creation, widget configuration).  \n- **Suggestion**:  \n  1. **Generate base dashboard layout** (AEB).  \n  2. **Add drill-down widgets for root-cause analysis** (AEB).  \n\n---\n\n### Summary of Non-AEB Steps  \n| Step | Reason for Non-AEB | Suggested Break",
    "analysis_complete": true
  },
  "io_decomposed": true
}