{
  "task_id": "344998c19f57",
  "input": "Automate customer support for a SaaS startup by triaging requests, resolving simple issues automatically, escalating complex cases, and tracking performance.",
  "required_inputs": [],
  "outputs": [
    "result"
  ],
  "subtasks": [],
  "dependency_structure": {
    "type": "dependency_driven",
    "graph": {},
    "total_subtasks": 0
  },
  "execution_plan": {
    "model_used": "AI1",
    "model_endpoint": "qwen/qwen3-235b-a22b",
    "inputs": [
      {
        "name": "Customer Support Requests",
        "source_type": "USER-CONTROLLED",
        "source_origin": "End-users via email, chat, or ticketing interface",
        "input_data": "Raw customer inquiries, complaints, or issue reports",
        "bound_reference": "None"
      },
      {
        "name": "Triage Rules",
        "source_type": "USER-CONTROLLED",
        "source_origin": "Internal support team policies",
        "input_data": "Criteria for categorizing requests (e.g., urgency, topic, complexity)",
        "bound_reference": "None"
      },
      {
        "name": "Predefined Automated Workflows",
        "source_type": "USER-CONTROLLED",
        "source_origin": "Internal engineering or operations team",
        "input_data": "Logic for resolving simple issues (e.g., password reset scripts, FAQ responses)",
        "bound_reference": "None"
      },
      {
        "name": "Escalation Process Definition",
        "source_type": "USER-CONTROLLED",
        "source_origin": "Support team hierarchy and protocols",
        "input_data": "Rules for routing complex cases to human agents (e.g., team assignments, SLA thresholds)",
        "bound_reference": "None"
      },
      {
        "name": "Performance Metrics Definitions",
        "source_type": "USER-CONTROLLED",
        "source_origin": "Management or analytics team",
        "input_data": "KPIs to track (e.g., average response time, resolution rate, escalation rate)",
        "bound_reference": "None"
      },
      {
        "name": "Knowledge Base/FAQ Database",
        "source_type": "SYSTEM-RETRIEVABLE",
        "source_origin": "Internal documentation API or database",
        "input_data": "Structured information for resolving common issues",
        "bound_reference": "None"
      },
      {
        "name": "CRM/Ticketing System Access",
        "source_type": "SYSTEM-RETRIEVABLE",
        "source_origin": "External CRM (e.g., Zendesk, Salesforce)",
        "input_data": "API credentials and endpoints for ticket creation/updates",
        "bound_reference": "None"
      }
    ],
    "outputs": [
      "**Triage Results**",
      "**Automated Responses**",
      "**Escalated Tickets**",
      "**Performance Reports**"
    ],
    "steps": [],
    "raw_response": "Inputs:  \n1. **Customer Support Requests**  \n   Source Type: USER-CONTROLLED  \n   Source Origin: End-users via email, chat, or ticketing interface  \n   Input Data: Raw customer inquiries, complaints, or issue reports  \n   Bound Reference: None  \n   Note: Requires explicit user provision or linkage.  \n\n2. **Triage Rules**  \n   Source Type: USER-CONTROLLED  \n   Source Origin: Internal support team policies  \n   Input Data: Criteria for categorizing requests (e.g., urgency, topic, complexity)  \n   Bound Reference: None  \n   Note: Requires explicit user provision or linkage.  \n\n3. **Predefined Automated Workflows**  \n   Source Type: USER-CONTROLLED  \n   Source Origin: Internal engineering or operations team  \n   Input Data: Logic for resolving simple issues (e.g., password reset scripts, FAQ responses)  \n   Bound Reference: None  \n   Note: Requires explicit user provision or linkage.  \n\n4. **Escalation Process Definition**  \n   Source Type: USER-CONTROLLED  \n   Source Origin: Support team hierarchy and protocols  \n   Input Data: Rules for routing complex cases to human agents (e.g., team assignments, SLA thresholds)  \n   Bound Reference: None  \n   Note: Requires explicit user provision or linkage.  \n\n5. **Performance Metrics Definitions**  \n   Source Type: USER-CONTROLLED  \n   Source Origin: Management or analytics team  \n   Input Data: KPIs to track (e.g., average response time, resolution rate, escalation rate)  \n   Bound Reference: None  \n   Note: Requires explicit user provision or linkage.  \n\n6. **Knowledge Base/FAQ Database**  \n   Source Type: SYSTEM-RETRIEVABLE  \n   Source Origin: Internal documentation API or database  \n   Input Data: Structured information for resolving common issues  \n   Bound Reference: None  \n   Note: [DEPTH STOP - Terminal input, do not further decompose]  \n\n7. **CRM/Ticketing System Access**  \n   Source Type: SYSTEM-RETRIEVABLE  \n   Source Origin: External CRM (e.g., Zendesk, Salesforce)  \n   Input Data: API credentials and endpoints for ticket creation/updates  \n   Bound Reference: None  \n   Note: [DEPTH STOP - Terminal input, do not further decompose]  \n\n---\n\nOutputs:  \n1. **Triage Results** (categorized requests stored in a database)  \n2. **Automated Responses** (sent to users via chat/email)  \n3. **Escalated Tickets** (created in CRM with priority labels)  \n4. **Performance Reports** (dashboards or exported metrics)  \n\n---\n\nSteps:  \n**Step 1**:  \nUses: Customer Support Requests  \nAction: Ingest raw customer requests via API or interface  \nProduces: Unprocessed request records  \nStores/Sends To: Internal queue for triage processing  \n\n**Step 2**:  \nUses: Triage Rules, Unprocessed request records  \nAction: Apply categorization logic to classify requests by topic and urgency  \nProduces: Triage Results  \nStores/Sends To: Database (e.g., triaged_requests table)  \n\n**Step 3**:  \nUses: Predefined Automated Workflows, Knowledge Base/FAQ Database, Triage Results  \nAction: Execute automated resolution workflows for low-complexity requests  \nProduces: Automated Responses  \nStores/Sends To: User communication channels (email, chat)  \n\n**Step 4**:  \nUses: Escalation Process Definition, Triage Results  \nAction: Route unresolved requests to human agents via CRM/Ticketing System Access  \nProduces: Escalated Tickets  \nStores/Sends To: CRM (e.g., Zendesk ticket with \"high priority\" tag)  \n\n**Step 5**:  \nUses: Performance Metrics Definitions, Triage Results, Automated Responses, Escalated Tickets  \nAction: Aggregate and calculate KPIs (e.g., resolution time, automation success rate)  \nProduces: Performance Reports  \nStores/Sends To: Analytics dashboard (e.g., Tableau, internal BI tool)  \n\n---\n\nDependency Consistency Check:  \n- All inputs used in steps  \n- No implicit data sources  \n- USER-CONTROLLED inputs explicitly identified  \n- SYSTEM-RETRIEVABLE inputs linked to endpoints  \n- DERIVABLE inputs fully decomposed (none required here)  \n- All leaf inputs marked [DEPTH STOP]"
  },
  "aeb_analysis": {
    "steps_count": 0,
    "aeb_analysis": []
  },
  "io_decomposed": true
}