{
  "task_id": "a3680a3f7511",
  "input": "Create a user profile page for a mobile app, from defining requirements and building components to testing, fixing issues, and deploying to production.",
  "required_inputs": [],
  "outputs": [
    "result"
  ],
  "subtasks": [],
  "dependency_structure": {
    "type": "dependency_driven",
    "graph": {},
    "total_subtasks": 0
  },
  "execution_plan": {
    "model_used": "AI1",
    "model_endpoint": "qwen/qwen3-235b-a22b",
    "inputs": [
      {
        "name": "U",
        "source_type": "USER-CONTROLLED",
        "source_origin": "Project stakeholder",
        "input_data": "Functional and non-functional requirements for the profile page",
        "bound_reference": "None"
      },
      {
        "name": "D",
        "source_type": "USER-CONTROLLED",
        "source_origin": "UI/UX team",
        "input_data": "Visual layout, component hierarchy, and interaction specifications",
        "bound_reference": "None"
      },
      {
        "name": "E",
        "source_type": "SYSTEM-RETRIEVABLE",
        "source_origin": "Internal design system API",
        "input_data": "Brand colors, typography, reusable component styles",
        "bound_reference": "None"
      },
      {
        "name": "U",
        "source_type": "SYSTEM-RETRIEVABLE",
        "source_origin": "Backend REST API documentation",
        "input_data": "Endpoint URL, request/response schema for user data",
        "bound_reference": "None"
      },
      {
        "name": "A",
        "source_type": "SYSTEM-RETRIEVABLE",
        "source_origin": "OAuth 2.0 authorization server",
        "input_data": "Bearer token for API access",
        "bound_reference": "None"
      },
      {
        "name": "T",
        "source_type": "USER-CONTROLLED",
        "source_origin": "QA team",
        "input_data": "Predefined scenarios for validation (e.g., edge cases, workflows)",
        "bound_reference": "None"
      },
      {
        "name": "D",
        "source_type": "SYSTEM-RETRIEVABLE",
        "source_origin": "CI/CD pipeline (e.g., GitHub Actions, Jenkins)",
        "input_data": "Environment variables, build scripts, deployment targets",
        "bound_reference": null
      }
    ],
    "outputs": [
      "Requirements Specification Document",
      "UI Component Library",
      "Integrated Frontend-Backend Profile Module",
      "Test Execution Report with Bug Log",
      "Fixed Profile Page Build Artifact",
      "Production Deployment Confirmation",
      "Deployment Logs"
    ],
    "steps": [
      "Uses: User Requirements Document, Existing App Style Guide  \nAction: Analyze and document alignment between stakeholder needs and design constraints  \nProduces: Requirements Specification Document  \nStores/Sends To: Project repository",
      "Uses: Design Mockup, Existing App Style Guide  \nAction: Build reusable UI elements (e.g., profile cards, edit forms) adhering to style guide  \nProduces: UI Component Library  \nStores/Sends To: Version control system (e.g., Git)",
      "Uses: User Data API Endpoint, Authentication Token  \nAction: Implement API calls to fetch/update user data with token-based authentication  \nProduces: Integrated Frontend-Backend Profile Module  \nStores/Sends To: Development environment",
      "Uses: Test Cases, Integrated Frontend-Backend Profile Module  \nAction: Run automated/manual tests against scenarios; log defects  \nProduces: Test Execution Report with Bug Log  \nStores/Sends To: QA dashboard",
      "Uses: Test Execution Report with Bug Log  \nAction: Debug and resolve defects in UI or API integration  \nProduces: Fixed Profile Page Build Artifact  \nStores/Sends To: Staging environment",
      "Uses: Fixed Profile Page Build Artifact, Deployment Configuration  \nAction: Trigger CI/CD pipeline to deploy artifact using environment-specific settings  \nProduces: Production Deployment Confirmation  \nStores/Sends To: Production server",
      "Uses: Production Deployment Confirmation  \nAction: Verify functionality in production via smoke tests  \nProduces: Deployment Logs  \nStores/Sends To: Monitoring system  \n\n[DEPTH STOP CONDITIONS MET: All DERIVABLE inputs (e.g., Integrated Frontend-Backend Profile Module) are resolved via decomposition into USER/SYSTEM sources.]"
    ],
    "raw_response": "Inputs:  \n1. User Requirements Document  \n   Source Type: USER-CONTROLLED  \n   Source Origin: Project stakeholder  \n   Input Data: Functional and non-functional requirements for the profile page  \n   Bound Reference: None  \n   Note: Requires explicit user provision or linkage.  \n\n2. Design Mockup  \n   Source Type: USER-CONTROLLED  \n   Source Origin: UI/UX team  \n   Input Data: Visual layout, component hierarchy, and interaction specifications  \n   Bound Reference: None  \n   Note: Requires explicit user provision or linkage.  \n\n3. Existing App Style Guide  \n   Source Type: SYSTEM-RETRIEVABLE  \n   Source Origin: Internal design system API  \n   Input Data: Brand colors, typography, reusable component styles  \n   Bound Reference: None  \n\n4. User Data API Endpoint  \n   Source Type: SYSTEM-RETRIEVABLE  \n   Source Origin: Backend REST API documentation  \n   Input Data: Endpoint URL, request/response schema for user data  \n   Bound Reference: None  \n\n5. Authentication Token  \n   Source Type: SYSTEM-RETRIEVABLE  \n   Source Origin: OAuth 2.0 authorization server  \n   Input Data: Bearer token for API access  \n   Bound Reference: None  \n\n6. Test Cases  \n   Source Type: USER-CONTROLLED  \n   Source Origin: QA team  \n   Input Data: Predefined scenarios for validation (e.g., edge cases, workflows)  \n   Bound Reference: None  \n   Note: Requires explicit user provision or linkage.  \n\n7. Deployment Configuration  \n   Source Type: SYSTEM-RETRIEVABLE  \n   Source Origin: CI/CD pipeline (e.g., GitHub Actions, Jenkins)  \n   Input Data: Environment variables, build scripts, deployment targets  \n\nOutputs:  \n1. Requirements Specification Document  \n2. UI Component Library (e.g., React components, XML layouts)  \n3. Integrated Frontend-Backend Profile Module  \n4. Test Execution Report with Bug Log  \n5. Fixed Profile Page Build Artifact  \n6. Production Deployment Confirmation  \n7. Deployment Logs  \n\nSteps:  \nStep 1: Define Requirements  \nUses: User Requirements Document, Existing App Style Guide  \nAction: Analyze and document alignment between stakeholder needs and design constraints  \nProduces: Requirements Specification Document  \nStores/Sends To: Project repository  \n\nStep 2: Develop UI Components  \nUses: Design Mockup, Existing App Style Guide  \nAction: Build reusable UI elements (e.g., profile cards, edit forms) adhering to style guide  \nProduces: UI Component Library  \nStores/Sends To: Version control system (e.g., Git)  \n\nStep 3: Integrate with Backend  \nUses: User Data API Endpoint, Authentication Token  \nAction: Implement API calls to fetch/update user data with token-based authentication  \nProduces: Integrated Frontend-Backend Profile Module  \nStores/Sends To: Development environment  \n\nStep 4: Execute Test Cases  \nUses: Test Cases, Integrated Frontend-Backend Profile Module  \nAction: Run automated/manual tests against scenarios; log defects  \nProduces: Test Execution Report with Bug Log  \nStores/Sends To: QA dashboard  \n\nStep 5: Fix Issues  \nUses: Test Execution Report with Bug Log  \nAction: Debug and resolve defects in UI or API integration  \nProduces: Fixed Profile Page Build Artifact  \nStores/Sends To: Staging environment  \n\nStep 6: Deploy to Production  \nUses: Fixed Profile Page Build Artifact, Deployment Configuration  \nAction: Trigger CI/CD pipeline to deploy artifact using environment-specific settings  \nProduces: Production Deployment Confirmation  \nStores/Sends To: Production server  \n\nStep 7: Validate Deployment  \nUses: Production Deployment Confirmation  \nAction: Verify functionality in production via smoke tests  \nProduces: Deployment Logs  \nStores/Sends To: Monitoring system  \n\n[DEPTH STOP CONDITIONS MET: All DERIVABLE inputs (e.g., Integrated Frontend-Backend Profile Module) are resolved via decomposition into USER/SYSTEM sources.]"
  },
  "aeb_analysis": {
    "steps_count": 7,
    "aeb_analysis_raw": "### AEB Analysis Results\n\n---\n\n#### **Step 1**  \n**Step:** Uses: User Requirements Document, Existing App Style Guide  \nAction: Analyze and document alignment between stakeholder needs and design constraints  \nProduces: Requirements Specification Document  \nStores/Sends To: Project repository  \n**Is AEB:** No  \n**Reason:** The action involves **sequencing** (e.g., \"analyze\" followed by \"document\") and **branching** (e.g., resolving misalignments). It combines multiple tasks (comparison, documentation) that cannot be implemented as a single function.  \n**Suggestion:** Break into:  \n1. Compare stakeholder needs vs. design constraints (AEB).  \n2. Document discrepancies as a Requirements Specification Document (AEB).  \n\n---\n\n#### **Step 2**  \n**Step:** Uses: Design Mockup, Existing App Style Guide  \nAction: Build reusable UI elements (e.g., profile cards, edit forms) adhering to style guide  \nProduces: UI Component Library  \nStores/Sends To: Version control system (e.g., Git)  \n**Is AEB:** No  \n**Reason:** The action includes **multiple intents** (building profile cards, edit forms, etc.) and **sequencing** (e.g., building components in a specific order). A single function cannot encapsulate all these tasks.  \n**Suggestion:** Break into individual AEBs:  \n1. Build profile card UI component (single function).  \n2. Build edit form UI component (single function).  \n\n---\n\n#### **Step 3**  \n**Step:** Uses: User Data API Endpoint, Authentication Token  \nAction: Implement API calls to fetch/update user data with token-based authentication  \nProduces: Integrated Frontend-Backend Profile Module  \nStores/Sends To: Development environment  \n**Is AEB:** No  \n**Reason:** The action includes **multiple intents** (\"fetch\" and \"update\") and may involve **branching** (e.g., handling token expiration). Each API call should be a separate AEB.  \n**Suggestion:** Split into:  \n1. Implement fetch user data API call (single function).  \n2. Implement update user data API call (single function).  \n\n---\n\n#### **Step 4**  \n**Step:** Uses: Test Cases, Integrated Frontend-Backend Profile Module  \nAction: Run automated/manual tests against scenarios; log defects  \nProduces: Test Execution Report with Bug Log  \nStores/Sends To: QA dashboard  \n**Is AEB:** No  \n**Reason:** Combines **automated** and **manual** testing (branching) and involves **sequencing** (running multiple test scenarios). These cannot be implemented as a single function.  \n**Suggestion:** Split into:  \n1. Execute automated test suite (single function).  \n2. Execute manual test scenarios (single function).  \n\n---\n\n#### **Step 5**  \n**Step:** Uses: Test Execution Report with Bug Log  \nAction: Debug and resolve defects in UI or API integration  \nProduces: Fixed Profile Page Build Artifact  \nStores/Sends To: Staging environment  \n**Is AEB:** No  \n**Reason:** The action involves **branching** (e.g., \"if defect is UI, fix UI; if API, fix API\") and **sequencing** (debugging multiple defects).  \n**Suggestion:** Split into:  \n1. Fix UI defect: [specific defect] (single function).  \n2. Fix API defect: [specific defect] (single function).  \n\n---\n\n#### **Step 6**  \n**Step:** Uses: Fixed Profile Page Build Artifact, Deployment Configuration  \nAction: Trigger CI/CD pipeline to deploy artifact using environment-specific settings  \nProduces: Production Deployment Confirmation  \nStores/Sends To: Production server  \n**Is AEB:** Yes  \n**Reason:** Triggering a CI/CD pipeline is a single intent, interacts with one system boundary (CI/CD tool), and can be implemented as a single API call (e.g., `POST /pipeline-trigger`).  \n\n---\n\n#### **Step 7**  \n**Step:** Uses: Production Deployment Confirmation  \nAction: Verify functionality in production via smoke tests  \nProduces: Deployment Logs  \nStores/Sends To: Monitoring system  \n**Is AEB:** Yes  \n**Reason:** Smoke testing can be implemented as a single function (e.g., `run_smoke_tests()`), interacts with one system boundary (production environment), and has no branching or sequencing.  \n\n---\n\n### Summary of AEBs  \n- **Valid AEBs:** Steps 6 and 7.  \n- **Invalid AEBs:** Steps 1â€“5 (require decomposition).",
    "analysis_complete": true
  },
  "io_decomposed": true
}