{
  "task_id": "9aeef081bd5c",
  "input": "Build a system that sorts customer issues, solves simple ones automatically, escalates complex cases, and tracks performance metrics.",
  "required_inputs": [],
  "outputs": [
    "result"
  ],
  "subtasks": [],
  "dependency_structure": {
    "type": "dependency_driven",
    "graph": {},
    "total_subtasks": 0
  },
  "execution_plan": {
    "model_used": "AI1",
    "model_endpoint": "qwen/qwen3-235b-a22b",
    "inputs": [
      {
        "name": "C",
        "source_type": "SYSTEM-RETRIEVABLE",
        "source_origin": "Customer support ticketing system API (e.g., Zendesk, ServiceNow)",
        "input_data": "Structured records containing issue text, metadata (priority, timestamp, user ID), and status",
        "bound_reference": "None"
      },
      {
        "name": "H",
        "source_type": "SYSTEM-RETRIEVABLE",
        "source_origin": "Internal database of resolved tickets with labels (simple/complex, resolution time, resolution method)",
        "input_data": "Labeled dataset for training classification models",
        "bound_reference": "None"
      },
      {
        "name": "A",
        "source_type": "USER-CONTROLLED",
        "source_origin": "User-defined JSON/YAML configuration",
        "input_data": "Conditional logic (e.g., \"if keyword=payment_failure, apply template_response_1\")",
        "bound_reference": "None"
      },
      {
        "name": "E",
        "source_type": "USER-CONTROLLED",
        "source_origin": "User-defined escalation hierarchy (team/individual mappings for issue categories)",
        "input_data": "Structured rules (e.g., \"escalate_to: Tier2_Support if complexity_score > 0.8\")",
        "bound_reference": "None"
      },
      {
        "name": "P",
        "source_type": "USER-CONTROLLED",
        "source_origin": "User-specified KPIs (e.g., average resolution time, escalation rate)",
        "input_data": "Metric calculation rules and thresholds",
        "bound_reference": "None"
      },
      {
        "name": "I",
        "source_type": "DERIVABLE",
        "source_origin": "Trained on Historical Issue Resolution Data",
        "input_data": "Machine learning model for issue complexity prediction",
        "bound_reference": "Input 2 (Historical Issue Resolution Data)"
      }
    ],
    "outputs": [
      "Classified Issues Dataset",
      "Automated Resolution Responses",
      "Escalated Case Queue",
      "Performance Metrics Dashboard",
      "System Logs"
    ],
    "steps": [
      "Uses: Customer Issue Data (Input 1)  \nAction: Retrieve unprocessed customer issues from ticketing system API  \nProduces: Raw issue dataset  \nStores/Sends To: Internal processing queue (e.g., Kafka topic, database table)",
      "Uses: Historical Issue Resolution Data (Input 2)  \nAction: Train/publish issue classification model using supervised learning  \nProduces: Issue Classification Model (Input 6)  \nStores/Sends To: Model registry (e.g., MLflow, S3 bucket)",
      "Uses: Issue Classification Model (Input 6), Customer Issue Data (Input 1)  \nAction: Apply model to classify issues into simple/complex categories  \nProduces: Classified Issues Dataset  \nStores/Sends To: Database collection \"classified_issues\"",
      "Uses: Classified Issues Dataset (Output), Automation Ruleset (Input 3)  \nAction: Execute automated resolution workflows for simple issues  \nProduces: Automated Resolution Responses  \nStores/Sends To: Ticketing system API (update resolved tickets)",
      "Uses: Classified Issues Dataset (Output), Escalation Protocols (Input 4)  \nAction: Route complex issues to appropriate escalation channels  \nProduces: Escalated Case Queue  \nStores/Sends To: Escalation management system (e.g., Jira, email queue)",
      "Uses: Performance Metric Definitions (Input 5), Classified Issues Dataset (Output)  \nAction: Calculate KPIs using metric definitions  \nProduces: Performance Metrics Dashboard  \nStores/Sends To: BI tool (e.g., Tableau, Grafana)",
      "Uses: All outputs  \nAction: Generate system logs for audit and debugging  \nProduces: System Logs  \nStores/Sends To: Centralized logging system (e.g., ELK stack, Splunk)"
    ],
    "raw_response": "Inputs:  \n1. Customer Issue Data  \n   Source Type: SYSTEM-RETRIEVABLE  \n   Source Origin: Customer support ticketing system API (e.g., Zendesk, ServiceNow)  \n   Input Data: Structured records containing issue text, metadata (priority, timestamp, user ID), and status  \n   Bound Reference: None  \n   Note: [DEPTH STOP - Terminal input]  \n\n2. Historical Issue Resolution Data  \n   Source Type: SYSTEM-RETRIEVABLE  \n   Source Origin: Internal database of resolved tickets with labels (simple/complex, resolution time, resolution method)  \n   Input Data: Labeled dataset for training classification models  \n   Bound Reference: None  \n   Note: [DEPTH STOP - Terminal input]  \n\n3. Automation Ruleset  \n   Source Type: USER-CONTROLLED  \n   Source Origin: User-defined JSON/YAML configuration  \n   Input Data: Conditional logic (e.g., \"if keyword=payment_failure, apply template_response_1\")  \n   Bound Reference: None  \n   Note: Requires explicit user provision or linkage.  \n\n4. Escalation Protocols  \n   Source Type: USER-CONTROLLED  \n   Source Origin: User-defined escalation hierarchy (team/individual mappings for issue categories)  \n   Input Data: Structured rules (e.g., \"escalate_to: Tier2_Support if complexity_score > 0.8\")  \n   Bound Reference: None  \n   Note: Requires explicit user provision or linkage.  \n\n5. Performance Metric Definitions  \n   Source Type: USER-CONTROLLED  \n   Source Origin: User-specified KPIs (e.g., average resolution time, escalation rate)  \n   Input Data: Metric calculation rules and thresholds  \n   Bound Reference: None  \n   Note: Requires explicit user provision or linkage.  \n\n6. Issue Classification Model  \n   Source Type: DERIVABLE  \n   Source Origin: Trained on Historical Issue Resolution Data  \n   Input Data: Machine learning model for issue complexity prediction  \n   Bound Reference: Input 2 (Historical Issue Resolution Data)  \n   Note: [DEPTH STOP - Terminal input]  \n\nOutputs:  \n1. Classified Issues Dataset  \n   Type: Persisted state change  \n   Description: Customer issues tagged with complexity scores and categories  \n\n2. Automated Resolution Responses  \n   Type: Observable artifact  \n   Description: Generated text responses or actions applied to simple issues  \n\n3. Escalated Case Queue  \n   Type: Persisted state change  \n   Description: List of complex issues with assigned teams/individuals  \n\n4. Performance Metrics Dashboard  \n   Type: Measurable report  \n   Description: Visualizations and alerts for tracked KPIs  \n\n5. System Logs  \n   Type: Observable artifact  \n   Description: Audit trail of classification decisions and automation actions  \n\nSteps:  \nStep 1:  \nUses: Customer Issue Data (Input 1)  \nAction: Retrieve unprocessed customer issues from ticketing system API  \nProduces: Raw issue dataset  \nStores/Sends To: Internal processing queue (e.g., Kafka topic, database table)  \n\nStep 2:  \nUses: Historical Issue Resolution Data (Input 2)  \nAction: Train/publish issue classification model using supervised learning  \nProduces: Issue Classification Model (Input 6)  \nStores/Sends To: Model registry (e.g., MLflow, S3 bucket)  \n\nStep 3:  \nUses: Issue Classification Model (Input 6), Customer Issue Data (Input 1)  \nAction: Apply model to classify issues into simple/complex categories  \nProduces: Classified Issues Dataset  \nStores/Sends To: Database collection \"classified_issues\"  \n\nStep 4:  \nUses: Classified Issues Dataset (Output), Automation Ruleset (Input 3)  \nAction: Execute automated resolution workflows for simple issues  \nProduces: Automated Resolution Responses  \nStores/Sends To: Ticketing system API (update resolved tickets)  \n\nStep 5:  \nUses: Classified Issues Dataset (Output), Escalation Protocols (Input 4)  \nAction: Route complex issues to appropriate escalation channels  \nProduces: Escalated Case Queue  \nStores/Sends To: Escalation management system (e.g., Jira, email queue)  \n\nStep 6:  \nUses: Performance Metric Definitions (Input 5), Classified Issues Dataset (Output)  \nAction: Calculate KPIs using metric definitions  \nProduces: Performance Metrics Dashboard  \nStores/Sends To: BI tool (e.g., Tableau, Grafana)  \n\nStep 7:  \nUses: All outputs  \nAction: Generate system logs for audit and debugging  \nProduces: System Logs  \nStores/Sends To: Centralized logging system (e.g., ELK stack, Splunk)"
  },
  "aeb_analysis": {
    "steps_count": 7,
    "aeb_analysis_raw": null,
    "analysis_complete": true
  },
  "io_decomposed": true
}