{
  "task_id": "182b15ef5959",
  "input": "Create a secure microservice deployment on AWS using Terraform by defining its requirements, building configurations, testing for issues, fixing bugs, and deploying to a staging environment.",
  "required_inputs": [],
  "outputs": [
    "result"
  ],
  "subtasks": [],
  "dependency_structure": {
    "type": "dependency_driven",
    "graph": {},
    "total_subtasks": 0
  },
  "execution_plan": {
    "model_used": "AI1",
    "model_endpoint": "qwen/qwen3-235b-a22b",
    "inputs": [
      {
        "name": "M",
        "source_type": "USER-CONTROLLED",
        "source_origin": "Development team repository",
        "input_data": "Source code files, dependencies, build scripts",
        "bound_reference": null
      },
      {
        "name": "A",
        "source_type": "SYSTEM-RETRIEVABLE",
        "source_origin": "AWS Secrets Manager",
        "input_data": "Access key ID, secret access key, account ID",
        "bound_reference": "AWS API endpoint: https://sts.amazonaws.com/"
      },
      {
        "name": "S",
        "source_type": "USER-CONTROLLED",
        "source_origin": "Security team documentation",
        "input_data": "Encryption standards, IAM role policies, VPC requirements",
        "bound_reference": null
      },
      {
        "name": "T",
        "source_type": "DERIVABLE",
        "source_origin": "Input 2 (AWS Account Credentials)",
        "input_data": "AWS region, provider version constraints",
        "bound_reference": "terraform { required_providers { aws = {...} } }"
      },
      {
        "name": "C",
        "source_type": "SYSTEM-RETRIEVABLE",
        "source_origin": "AWS Artifact service",
        "input_data": "CIS benchmarks, SOC2 controls, ISO 27001 requirements",
        "bound_reference": "AWS Artifact API: https://artifact.aws.amazon.com/"
      },
      {
        "name": "I",
        "source_type": "DERIVABLE",
        "source_origin": "Inputs 1+3+5",
        "input_data": "Resource specifications, security controls matrix",
        "bound_reference": null
      }
    ],
    "outputs": [
      "Terraform Configuration Files",
      "Security Compliance Report",
      "Staging Environment Endpoint",
      "Deployment Logs"
    ],
    "steps": [
      "Uses: Microservice Codebase, Security Policy Requirements, Compliance Standards\nAction: Analyze codebase architecture and merge security/compliance requirements\nProduces: Infrastructure Requirements Document\nStores/Sends To: requirements/generated_spec.json",
      "Uses: AWS Account Credentials\nAction: Initialize AWS provider with account credentials and region\nProduces: Provider configuration block\nStores/Sends To: terraform/provider.tf",
      "Uses: Infrastructure Requirements Document\nAction: Scaffold VPC, subnets, and security groups using AWS provider\nProduces: Network configuration files\nStores/Sends To: terraform/networking.tf",
      "Uses: Security Policy Requirements, Compliance Standards\nAction: Create IAM roles and encryption policies matching requirements\nProduces: Security policy files\nStores/Sends To: terraform/security/*.tf",
      "Uses: Microservice Codebase, Terraform Provider Configuration\nAction: Configure CI/CD pipeline for Terraform apply operations\nProduces: Pipeline configuration\nStores/Sends To: .github/workflows/deploy.yml",
      "Uses: Terraform Configuration Files\nAction: Run terraform validate and tflint static analysis\nProduces: Validation report\nStores/Sends To: reports/validation_results.txt",
      "Uses: Security Policy Requirements, Compliance Standards\nAction: Run automated security scans (e.g., tfsec, checkov)\nProduces: Security assessment report\nStores/Sends To: reports/security_scan.json",
      "Uses: Terraform Configuration Files, AWS Account Credentials\nAction: Apply configuration to AWS staging environment\nProduces: Terraform state file\nStores/Sends To: s3://tf-state-bucket/staging/terraform.tfstate",
      "Uses: Staging Environment Endpoint\nAction: Execute health checks and endpoint testing\nProduces: Deployment verification report\nStores/Sends To: reports/deployment_health.html\n\n[DEPTH STOP CONDITIONS MET: All DERIVABLE inputs decomposed to USER/SYSTEM sources]"
    ],
    "raw_response": "Inputs:\n1. Microservice Codebase\n   Source Type: USER-CONTROLLED\n   Source Origin: Development team repository\n   Input Data: Source code files, dependencies, build scripts\n   Note: Requires explicit user provision or linkage.\n\n2. AWS Account Credentials\n   Source Type: SYSTEM-RETRIEVABLE\n   Source Origin: AWS Secrets Manager\n   Input Data: Access key ID, secret access key, account ID\n   Bound Reference: AWS API endpoint: https://sts.amazonaws.com/\n\n3. Security Policy Requirements\n   Source Type: USER-CONTROLLED\n   Source Origin: Security team documentation\n   Input Data: Encryption standards, IAM role policies, VPC requirements\n   Note: Requires explicit user provision or linkage.\n\n4. Terraform Provider Configuration\n   Source Type: DERIVABLE\n   Source Origin: Input 2 (AWS Account Credentials)\n   Input Data: AWS region, provider version constraints\n   Bound Reference: terraform { required_providers { aws = {...} } }\n\n5. Compliance Standards\n   Source Type: SYSTEM-RETRIEVABLE\n   Source Origin: AWS Artifact service\n   Input Data: CIS benchmarks, SOC2 controls, ISO 27001 requirements\n   Bound Reference: AWS Artifact API: https://artifact.aws.amazon.com/\n\n6. Infrastructure Requirements Document\n   Source Type: DERIVABLE\n   Source Origin: Inputs 1+3+5\n   Input Data: Resource specifications, security controls matrix\n   Note: [DEPTH STOP - Terminal input]\n\nOutputs:\n1. Terraform Configuration Files\n   Type: Persisted state change\n   Verification: File system checksum, git commit hash\n\n2. Security Compliance Report\n   Type: Measurable report\n   Verification: PDF/JSON artifact with signed compliance attestations\n\n3. Staging Environment Endpoint\n   Type: Triggered action\n   Verification: Public DNS URL with HTTPS certificate\n\n4. Deployment Logs\n   Type: Observable artifact\n   Verification: CloudWatch log group ARN\n\nSteps:\nStep 1: Define Infrastructure Requirements\nUses: Microservice Codebase, Security Policy Requirements, Compliance Standards\nAction: Analyze codebase architecture and merge security/compliance requirements\nProduces: Infrastructure Requirements Document\nStores/Sends To: requirements/generated_spec.json\n\nStep 2: Configure Terraform Provider\nUses: AWS Account Credentials\nAction: Initialize AWS provider with account credentials and region\nProduces: Provider configuration block\nStores/Sends To: terraform/provider.tf\n\nStep 3: Generate Base Infrastructure Code\nUses: Infrastructure Requirements Document\nAction: Scaffold VPC, subnets, and security groups using AWS provider\nProduces: Network configuration files\nStores/Sends To: terraform/networking.tf\n\nStep 4: Implement Security Controls\nUses: Security Policy Requirements, Compliance Standards\nAction: Create IAM roles and encryption policies matching requirements\nProduces: Security policy files\nStores/Sends To: terraform/security/*.tf\n\nStep 5: Create Deployment Pipeline\nUses: Microservice Codebase, Terraform Provider Configuration\nAction: Configure CI/CD pipeline for Terraform apply operations\nProduces: Pipeline configuration\nStores/Sends To: .github/workflows/deploy.yml\n\nStep 6: Validate Configuration\nUses: Terraform Configuration Files\nAction: Run terraform validate and tflint static analysis\nProduces: Validation report\nStores/Sends To: reports/validation_results.txt\n\nStep 7: Execute Security Testing\nUses: Security Policy Requirements, Compliance Standards\nAction: Run automated security scans (e.g., tfsec, checkov)\nProduces: Security assessment report\nStores/Sends To: reports/security_scan.json\n\nStep 8: Deploy to Staging\nUses: Terraform Configuration Files, AWS Account Credentials\nAction: Apply configuration to AWS staging environment\nProduces: Terraform state file\nStores/Sends To: s3://tf-state-bucket/staging/terraform.tfstate\n\nStep 9: Verify Deployment\nUses: Staging Environment Endpoint\nAction: Execute health checks and endpoint testing\nProduces: Deployment verification report\nStores/Sends To: reports/deployment_health.html\n\n[DEPTH STOP CONDITIONS MET: All DERIVABLE inputs decomposed to USER/SYSTEM sources]"
  },
  "aeb_analysis": {
    "steps_count": 9,
    "aeb_analysis_raw": "### Step-by-Step Analysis\n\n---\n\n**Step 1**  \n- **Step**: Analyze codebase architecture and merge security/compliance requirements  \n- **Is AEB**: No  \n- **Reason**: Combines multiple inputs (codebase, security policies, compliance standards) and involves merging logic that may require branching or sequencing. The intent is not atomic as it merges multiple sources into a single document.  \n- **Suggestion**: Break into separate AEBs:  \n  1. Analyze codebase architecture → `requirements/codebase_analysis.json`  \n  2. Merge security policies → `requirements/security_spec.json`  \n  3. Merge compliance standards → `requirements/compliance_spec.json`  \n  4. Combine outputs into Infrastructure Requirements Document  \n\n---\n\n**Step 2**  \n- **Step**: Initialize AWS provider with account credentials and region  \n- **Is AEB**: Yes  \n- **Reason**: Single intent (initialize provider), interacts with AWS API (system boundary), no branching/sequencing, and maps to a single Terraform provider configuration block.  \n- **N/A**  \n\n---\n\n**Step 3**  \n- **Step**: Scaffold VPC, subnets, and security groups using AWS provider  \n- **Is AEB**: No  \n- **Reason**: Combines multiple infrastructure components (VPC, subnets, security groups) that may require sequential creation or conditional logic (e.g., dependencies between resources).  \n- **Suggestion**: Break into separate AEBs:  \n  1. Create VPC → `terraform/networking/vpc.tf`  \n  2. Create subnets → `terraform/networking/subnets.tf`  \n  3. Create security groups → `terraform/networking/security_groups.tf`  \n\n---\n\n**Step 4**  \n- **Step**: Create IAM roles and encryption policies matching requirements  \n- **Is AEB**: No  \n- **Reason**: Combines two distinct actions (IAM roles and encryption policies) that may involve separate API calls or branching logic (e.g., policy type checks).  \n- **Suggestion**: Break into separate AEBs:  \n  1. Generate IAM roles → `terraform/security/iam_roles.tf`  \n  2. Generate encryption policies → `terraform/security/encryption.tf`  \n\n---\n\n**Step 5**  \n- **Step**: Configure CI/CD pipeline for Terraform apply operations  \n- **Is AEB**: Yes  \n- **Reason**: Single intent (generate pipeline config), interacts with GitHub Actions system boundary (`.github/workflows/deploy.yml`), and maps to a single YAML file.  \n- **N/A**  \n\n---\n\n**Step 6**  \n- **Step**: Run terraform validate and tflint static analysis  \n- **Is AEB**: No  \n- **Reason**: Combines two distinct validation tools (`terraform validate` and `tflint`) with separate execution steps.  \n- **Suggestion**: Break into separate AEBs:  \n  1. Run `terraform validate` → `reports/terraform_validation.txt`  \n  2. Run `tflint` → `reports/tflint_results.txt`  \n\n---\n\n**Step 7**  \n- **Step**: Run automated security scans (e.g.,",
    "analysis_complete": true
  },
  "io_decomposed": true
}