{
  "task_id": "5fb5d56a276a",
  "input": "Design and implement a model monitoring system that alerts on data drift, requiring you to write the detection logic, validate it with unit tests, debug false positives, and deploy it to the staging environment.",
  "required_inputs": [],
  "outputs": [
    "result"
  ],
  "subtasks": [],
  "dependency_structure": {
    "type": "dependency_driven",
    "graph": {},
    "total_subtasks": 0
  },
  "execution_plan": {
    "model_used": "AI1",
    "model_endpoint": "qwen/qwen3-235b-a22b",
    "inputs": [
      {
        "name": "D",
        "source_type": "USER-CONTROLLED",
        "source_origin": "Machine Learning Engineering Team",
        "input_data": "JSON/YAML schema file defining expected feature types, ranges, and formats",
        "bound_reference": "None"
      },
      {
        "name": "H",
        "source_type": "SYSTEM-RETRIEVABLE",
        "source_origin": "Production Data Warehouse (Snowflake/BigQuery)",
        "input_data": "Structured dataset of past model inputs (last 30 days)",
        "bound_reference": "None"
      },
      {
        "name": "C",
        "source_type": "SYSTEM-RETRIEVABLE",
        "source_origin": "Production Kafka Queue/Model API Endpoint",
        "input_data": "Streaming model input records in real-time",
        "bound_reference": "None"
      },
      {
        "name": "D",
        "source_type": "USER-CONTROLLED",
        "source_origin": "ML Governance Committee",
        "input_data": "Numeric threshold (e.g., 0.15 Jensen-Shannon divergence)",
        "bound_reference": "None"
      },
      {
        "name": "U",
        "source_type": "USER-CONTROLLED",
        "source_origin": "QA Engineering Team",
        "input_data": "Synthetic data samples with known drift patterns",
        "bound_reference": "None"
      },
      {
        "name": "E",
        "source_type": "DERIVABLE",
        "source_origin": "Unit Test Cases (Input 5)",
        "input_data": "Precomputed drift metrics for test cases",
        "bound_reference": "Input 5"
      },
      {
        "name": "S",
        "source_type": "SYSTEM-RETRIEVABLE",
        "source_origin": "Infrastructure-as-Code Repository (Terraform/CloudFormation)",
        "input_data": "Deployment manifests with endpoint URLs and resource specs",
        "bound_reference": "None"
      },
      {
        "name": "D",
        "source_type": "USER-CONTROLLED",
        "source_origin": "DevOps Team",
        "input_data": "Encrypted credentials for staging environment access",
        "bound_reference": "None"
      },
      {
        "name": "V",
        "source_type": "SYSTEM-RETRIEVABLE",
        "source_origin": "Model Monitoring Dashboard (Grafana/Prometheus)",
        "input_data": "Labeled false positive alerts with timestamps",
        "bound_reference": "None"
      }
    ],
    "outputs": [
      "Drift Detection Logic",
      "Unit Test Suite",
      "Test Execution Report",
      "Deployed Monitoring Service",
      "Alerting Configuration",
      "Debugged Detection Logic",
      "Deployment Validation Report"
    ],
    "steps": [
      "Uses: Input 1 (Data Schema), Input 2 (Historical Data), Input 4 (Threshold)\nAction: Implement statistical drift detection using schema-defined metrics (e.g., KS-test, PSI)\nProduces: DriftDetection class with detect() method\nStores/Sends To: Version control repository",
      "Uses: Input 5 (Test Cases), Input 6 (Expected Results)\nAction: Create parameterized unit tests for drift detection edge cases\nProduces: test_drift_detection.py test suite\nStores/Sends To: Testing framework",
      "Uses: Input 5 (Test Cases), Input 6 (Expected Results)\nAction: Execute unit tests and generate coverage report\nProduces: Test execution report with pass/fail status\nStores/Sends To: CI/CD pipeline artifacts",
      "Uses: Input 7 (Staging Config), Input 8 (Credentials)\nAction: Deploy monitoring service to staging environment using infrastructure manifests\nProduces: Running drift monitoring service container\nStores/Sends To: Kubernetes cluster/Organization cloud account",
      "Uses: Input 3 (Current Data), Input 4 (Threshold)\nAction: Configure alerting rules for drift magnitude exceeding threshold\nProduces: Prometheus alerting rules configuration\nStores/Sends To: Monitoring system configuration",
      "Uses: Input 9 (Feedback Data), Output 1 (Drift Detection Logic)\nAction: Analyze false positives and implement feature-specific threshold adjustments\nProduces: Updated drift detection logic with suppression rules\nStores/Sends To: Version control repository",
      "Uses: Input 7 (Staging Config), Input 8 (Credentials)\nAction: Redeploy refined monitoring service to staging environment\nProduces: Updated deployment validation report\nStores/Sends To: CI/CD pipeline artifacts\n\n[All inputs accounted for in steps]\n[All outputs generated by specific steps]\n[No implicit data sources present]\n[DEPTH STOP markers correctly placed on terminal inputs]"
    ],
    "raw_response": "Inputs:\n1. Data Schema Definition\n   Source Type: USER-CONTROLLED\n   Source Origin: Machine Learning Engineering Team\n   Input Data: JSON/YAML schema file defining expected feature types, ranges, and formats\n   Bound Reference: None\n   Note: Requires explicit user provision or linkage.\n\n2. Historical Production Data\n   Source Type: SYSTEM-RETRIEVABLE\n   Source Origin: Production Data Warehouse (Snowflake/BigQuery)\n   Input Data: Structured dataset of past model inputs (last 30 days)\n   Bound Reference: None\n\n3. Current Data Stream\n   Source Type: SYSTEM-RETRIEVABLE\n   Source Origin: Production Kafka Queue/Model API Endpoint\n   Input Data: Streaming model input records in real-time\n   Bound Reference: None\n\n4. Drift Detection Threshold\n   Source Type: USER-CONTROLLED\n   Source Origin: ML Governance Committee\n   Input Data: Numeric threshold (e.g., 0.15 Jensen-Shannon divergence)\n   Bound Reference: None\n   Note: Requires explicit user provision or linkage.\n\n5. Unit Test Cases\n   Source Type: USER-CONTROLLED\n   Source Origin: QA Engineering Team\n   Input Data: Synthetic data samples with known drift patterns\n   Bound Reference: None\n   Note: Requires explicit user provision or linkage.\n\n6. Expected Test Results\n   Source Type: DERIVABLE\n   Source Origin: Unit Test Cases (Input 5)\n   Input Data: Precomputed drift metrics for test cases\n   Bound Reference: Input 5\n   Note: [DEPTH STOP - Terminal input, do not further decompose]\n\n7. Staging Environment Configuration\n   Source Type: SYSTEM-RETRIEVABLE\n   Source Origin: Infrastructure-as-Code Repository (Terraform/CloudFormation)\n   Input Data: Deployment manifests with endpoint URLs and resource specs\n   Bound Reference: None\n\n8. Deployment Credentials\n   Source Type: USER-CONTROLLED\n   Source Origin: DevOps Team\n   Input Data: Encrypted credentials for staging environment access\n   Bound Reference: None\n   Note: Requires explicit user provision or linkage.\n\n9. Validation Feedback Data\n   Source Type: SYSTEM-RETRIEVABLE\n   Source Origin: Model Monitoring Dashboard (Grafana/Prometheus)\n   Input Data: Labeled false positive alerts with timestamps\n   Bound Reference: None\n\nOutputs:\n1. Drift Detection Logic (Python module)\n2. Unit Test Suite (pytest scripts)\n3. Test Execution Report (HTML/JSON)\n4. Deployed Monitoring Service (Docker container in staging)\n5. Alerting Configuration (Prometheus rules)\n6. Debugged Detection Logic (updated Python module)\n7. Deployment Validation Report (CI/CD pipeline output)\n\nSteps:\nStep 1:\nUses: Input 1 (Data Schema), Input 2 (Historical Data), Input 4 (Threshold)\nAction: Implement statistical drift detection using schema-defined metrics (e.g., KS-test, PSI)\nProduces: DriftDetection class with detect() method\nStores/Sends To: Version control repository\n\nStep 2:\nUses: Input 5 (Test Cases), Input 6 (Expected Results)\nAction: Create parameterized unit tests for drift detection edge cases\nProduces: test_drift_detection.py test suite\nStores/Sends To: Testing framework\n\nStep 3:\nUses: Input 5 (Test Cases), Input 6 (Expected Results)\nAction: Execute unit tests and generate coverage report\nProduces: Test execution report with pass/fail status\nStores/Sends To: CI/CD pipeline artifacts\n\nStep 4:\nUses: Input 7 (Staging Config), Input 8 (Credentials)\nAction: Deploy monitoring service to staging environment using infrastructure manifests\nProduces: Running drift monitoring service container\nStores/Sends To: Kubernetes cluster/Organization cloud account\n\nStep 5:\nUses: Input 3 (Current Data), Input 4 (Threshold)\nAction: Configure alerting rules for drift magnitude exceeding threshold\nProduces: Prometheus alerting rules configuration\nStores/Sends To: Monitoring system configuration\n\nStep 6:\nUses: Input 9 (Feedback Data), Output 1 (Drift Detection Logic)\nAction: Analyze false positives and implement feature-specific threshold adjustments\nProduces: Updated drift detection logic with suppression rules\nStores/Sends To: Version control repository\n\nStep 7:\nUses: Input 7 (Staging Config), Input 8 (Credentials)\nAction: Redeploy refined monitoring service to staging environment\nProduces: Updated deployment validation report\nStores/Sends To: CI/CD pipeline artifacts\n\n[All inputs accounted for in steps]\n[All outputs generated by specific steps]\n[No implicit data sources present]\n[DEPTH STOP markers correctly placed on terminal inputs]"
  },
  "aeb_analysis": {
    "steps_count": 7,
    "aeb_analysis_raw": "### AEB Validation Analysis\n\n---\n\n**Step 1**  \n- **Step**: Uses: Input 1 (Data Schema), Input 2 (Historical Data), Input 4 (Threshold)  \n  Action: Implement statistical drift detection using schema-defined metrics (e.g., KS-test, PSI)  \n  Produces: DriftDetection class with detect() method  \n  Stores/Sends To: Version control repository  \n- **Is AEB**: No  \n- **Reason**: The action involves multiple sub-steps (loading schema, processing data, applying statistical tests) and creates a class with a method, which inherently requires sequencing and branching logic.  \n- **Suggestion**: Break into:  \n  1. Load schema and historical data.  \n  2. Compute KS-test/PSI metrics.  \n  3. Save results to version control.  \n\n---\n\n**Step 2**  \n- **Step**: Uses: Input 5 (Test Cases), Input 6 (Expected Results)  \n  Action: Create parameterized unit tests for drift detection edge cases  \n  Produces: test_drift_detection.py test suite  \n  Stores/Sends To: Testing framework  \n- **Is AEB**: No  \n- **Reason**: Creating parameterized tests requires defining test templates, iterating over test cases, and mapping expected results, which involves sequencing and branching.  \n- **Suggestion**: Split into:  \n  1. Generate test templates.  \n  2. Populate tests with test cases and expected results.  \n\n---\n\n**Step 3**  \n- **Step**: Uses: Input 5 (Test Cases), Input 6 (Expected Results)  \n  Action: Execute unit tests and generate coverage report  \n  Produces: Test execution report with pass/fail status  \n  Stores/Sends To: CI/CD pipeline artifacts  \n- **Is AEB**: No  \n- **Reason**: Test execution inherently involves sequencing (running multiple tests) and branching (pass/fail logic). Coverage reporting adds post-processing.  \n- **Suggestion**: Split into:  \n  1. Run unit tests.  \n  2. Generate coverage report.  \n\n---\n\n**Step 4**  \n- **Step**: Uses: Input 7 (Staging Config), Input 8 (Credentials)  \n  Action: Deploy monitoring service to staging environment using infrastructure manifests  \n  Produces: Running drift monitoring service container  \n  Stores/Sends To: Kubernetes cluster/Organization cloud account  \n- **Is AEB**: Yes  \n- **Reason**: Deployment via manifests (e.g., `kubectl apply`) is a single API call with a unified intent (deploy service). Credentials are handled as a single boundary interaction.  \n\n---\n\n**Step 5**  \n- **Step**: Uses: Input 3 (Current Data), Input 4 (Threshold)  \n  Action: Configure alerting rules for drift magnitude exceeding threshold  \n  Produces: Prometheus alerting rules configuration  \n  Stores/Sends To: Monitoring system configuration  \n- **Is AEB**: Yes  \n- **Reason**: Generating and applying a Prometheus alerting rule can be done via a single API call (e.g., `prometheus_api_client.create_rule`) with no internal branching or sequencing.  \n\n---\n\n**Step 6**  \n- **Step**: Uses: Input 9 (Feedback Data), Output 1 (Drift Detection Logic)  \n  Action: Analyze false positives and implement feature-specific threshold adjustments  \n  Produces: Updated drift detection logic with suppression rules  \n  Stores/Sends To: Version control repository  \n- **Is AEB**: No  \n- **Reason**: Analysis and implementation involve branching (e.g., \"if false positive, adjust threshold\") and multiple steps (feedback parsing, logic modification).  \n- **Suggestion**: Split into:  \n  1. Analyze feedback data for false positives.  \n  2. Update drift detection logic with suppression rules.  \n\n---\n\n**Step 7**  \n- **Step**: Uses: Input 7 (Staging Config), Input 8 (Credentials)  \n  Action: Redeploy refined monitoring service to staging environment  \n  Produces: Updated deployment validation report  \n  Stores/Sends To: CI/CD pipeline artifacts  \n- **Is AEB**: No  \n- **Reason**: Redeployment may involve sequencing (e.g., terminating old pods, starting new ones) and validation reporting, which requires post-deployment checks.  \n- **Suggestion**:",
    "analysis_complete": true
  },
  "io_decomposed": true
}