{
  "task_id": "33bad00bf805",
  "input": "Create an end-to-end content campaign for a manufacturing firm that requires market research, multi-format content like articles and videos, consistent messaging across all channels, and measurable goals for lead generation.",
  "required_inputs": [],
  "outputs": [
    "result"
  ],
  "subtasks": [],
  "dependency_structure": {
    "type": "dependency_driven",
    "graph": {},
    "total_subtasks": 0
  },
  "execution_plan": {
    "model_used": "AI1",
    "model_endpoint": "qwen/qwen3-235b-a22b",
    "inputs": [
      {
        "name": "Market Research Data (Competitor Analysis)",
        "source_type": "SYSTEM-RETRIEVABLE",
        "source_origin": "SEMrush API / Ahrefs API",
        "input_data": "Competitor content performance metrics, keyword rankings, backlink profiles",
        "bound_reference": "Input 2 (Industry Trends Data), Input 3 (Historical Campaign Data)"
      },
      {
        "name": "Industry Trends Data",
        "source_type": "SYSTEM-RETRIEVABLE",
        "source_origin": "Statista API / IBISWorld Database",
        "input_data": "Manufacturing sector growth projections, emerging technology adoption rates",
        "bound_reference": "Input 1 (Market Research Data)"
      },
      {
        "name": "Historical Campaign Performance Data",
        "source_type": "SYSTEM-RETRIEVABLE",
        "source_origin": "HubSpot CRM / Google Analytics",
        "input_data": "Past campaign conversion rates, channel-specific engagement metrics",
        "bound_reference": "Input 1 (Market Research Data)"
      },
      {
        "name": "Brand Guidelines",
        "source_type": "USER-CONTROLLED",
        "source_origin": "Marketing Team",
        "input_data": "Logo assets, tone-of-voice directives, color palettes, messaging pillars",
        "bound_reference": null
      },
      {
        "name": "Product Specifications",
        "source_type": "USER-CONTROLLED",
        "source_origin": "Engineering Department",
        "input_data": "Technical drawings, material certifications, use-case scenarios",
        "bound_reference": null
      },
      {
        "name": "Target Audience Personas",
        "source_type": "DERIVABLE",
        "source_origin": "Derived from Inputs 1-3",
        "input_data": "Demographic clusters, pain point hierarchies, buyer journey stages",
        "bound_reference": "Input 1 (Market Research Data), Input 2 (Industry Trends Data)"
      },
      {
        "name": "Lead Generation Targets",
        "source_type": "USER-CONTROLLED",
        "source_origin": "Sales Leadership",
        "input_data": "Monthly qualified lead quota, conversion rate benchmarks",
        "bound_reference": null
      },
      {
        "name": "Distribution Channels List",
        "source_type": "USER-CONTROLLED",
        "source_origin": "CMO Office",
        "input_data": "Approved platforms (LinkedIn, YouTube, Industry Journals)",
        "bound_reference": null
      }
    ],
    "outputs": [
      "**Campaign Strategy Document**",
      "Audience personas, messaging framework, channel allocation matrix",
      "**Content Asset Repository**",
      "SEO-optimized articles (5,000+ words total), explainer videos (3x 2-minute scripts)",
      "**Cross-Channel Distribution Calendar**",
      "Scheduled posts, ad spend allocations, A/B test parameters",
      "**Lead Capture Infrastructure**",
      "Landing page templates, CRM integration workflows",
      "**Performance Dashboard**",
      "Real-time lead tracking, ROI per channel, content engagement heatmaps"
    ],
    "steps": [
      "Uses: Input 1 (Market Research Data), Input 2 (Industry Trends Data), Input 3 (Historical Campaign Data)  \nAction: Conduct gap analysis to identify content opportunities  \nProduces: Content Gap Report  \nStores/Sends To: Internal Strategy Drive",
      "Uses: Input 4 (Brand Guidelines), Input 5 (Product Specifications), Input 6 (Target Audience Personas)  \nAction: Develop messaging architecture with value proposition mapping  \nProduces: Messaging Framework Document  \nStores/Sends To: Creative Team Shared Folder",
      "Uses: Input 7 (Lead Generation Targets), Input 8 (Distribution Channels List)  \nAction: Configure CRM workflows and landing page CTAs  \nProduces: Lead Capture System Blueprint  \nStores/Sends To: Salesforce Admin Console",
      "Uses: Input 6 (Target Audience Personas), Input 2 (Industry Trends Data)  \nAction: Generate SEO keyword clusters for content targeting  \nProduces: Keyword Targeting Matrix  \nStores/Sends To: SEO Toolset (SEMrush Project)",
      "Uses: Input 4 (Brand Guidelines), Input 5 (Product Specifications), Output 4 (Keyword Targeting Matrix)  \nAction: Create content assets with embedded CTAs  \nProduces: Article Drafts, Video Storyboards  \nStores/Sends To: Content Approval Workflow",
      "Uses: Output 2 (Messaging Framework Document), Output 3 (Cross-Channel Distribution Calendar)  \nAction: Schedule content with channel-specific optimizations  \nProduces: Published Campaign Assets  \nStores/Sends To: LinkedIn, YouTube, Industry Journal Portals",
      "Uses: Output 5 (Performance Dashboard), Input 7 (Lead Generation Targets)  \nAction: Monitor lead velocity and content engagement KPIs  \nProduces: Weekly Optimization Recommendations  \nStores/Sends To: Stakeholder Email List"
    ],
    "raw_response": "Inputs:  \n1. **Market Research Data (Competitor Analysis)**  \n   Source Type: SYSTEM-RETRIEVABLE  \n   Source Origin: SEMrush API / Ahrefs API  \n   Input Data: Competitor content performance metrics, keyword rankings, backlink profiles  \n   Bound Reference: Input 2 (Industry Trends Data), Input 3 (Historical Campaign Data)  \n\n2. **Industry Trends Data**  \n   Source Type: SYSTEM-RETRIEVABLE  \n   Source Origin: Statista API / IBISWorld Database  \n   Input Data: Manufacturing sector growth projections, emerging technology adoption rates  \n   Bound Reference: Input 1 (Market Research Data)  \n\n3. **Historical Campaign Performance Data**  \n   Source Type: SYSTEM-RETRIEVABLE  \n   Source Origin: HubSpot CRM / Google Analytics  \n   Input Data: Past campaign conversion rates, channel-specific engagement metrics  \n   Bound Reference: Input 1 (Market Research Data)  \n\n4. **Brand Guidelines**  \n   Source Type: USER-CONTROLLED  \n   Source Origin: Marketing Team  \n   Input Data: Logo assets, tone-of-voice directives, color palettes, messaging pillars  \n   Note: Requires explicit user provision or linkage.  \n\n5. **Product Specifications**  \n   Source Type: USER-CONTROLLED  \n   Source Origin: Engineering Department  \n   Input Data: Technical drawings, material certifications, use-case scenarios  \n   Note: Requires explicit user provision or linkage.  \n\n6. **Target Audience Personas**  \n   Source Type: DERIVABLE  \n   Source Origin: Derived from Inputs 1-3  \n   Input Data: Demographic clusters, pain point hierarchies, buyer journey stages  \n   Bound Reference: Input 1 (Market Research Data), Input 2 (Industry Trends Data)  \n   Note: [DEPTH STOP - Terminal input, do not further decompose]  \n\n7. **Lead Generation Targets**  \n   Source Type: USER-CONTROLLED  \n   Source Origin: Sales Leadership  \n   Input Data: Monthly qualified lead quota, conversion rate benchmarks  \n   Note: Requires explicit user provision or linkage.  \n\n8. **Distribution Channels List**  \n   Source Type: USER-CONTROLLED  \n   Source Origin: CMO Office  \n   Input Data: Approved platforms (LinkedIn, YouTube, Industry Journals)  \n   Note: Requires explicit user provision or linkage.  \n\nOutputs:  \n1. **Campaign Strategy Document**  \n   - Audience personas, messaging framework, channel allocation matrix  \n2. **Content Asset Repository**  \n   - SEO-optimized articles (5,000+ words total), explainer videos (3x 2-minute scripts)  \n3. **Cross-Channel Distribution Calendar**  \n   - Scheduled posts, ad spend allocations, A/B test parameters  \n4. **Lead Capture Infrastructure**  \n   - Landing page templates, CRM integration workflows  \n5. **Performance Dashboard**  \n   - Real-time lead tracking, ROI per channel, content engagement heatmaps  \n\nSteps:  \nStep 1:  \nUses: Input 1 (Market Research Data), Input 2 (Industry Trends Data), Input 3 (Historical Campaign Data)  \nAction: Conduct gap analysis to identify content opportunities  \nProduces: Content Gap Report  \nStores/Sends To: Internal Strategy Drive  \n\nStep 2:  \nUses: Input 4 (Brand Guidelines), Input 5 (Product Specifications), Input 6 (Target Audience Personas)  \nAction: Develop messaging architecture with value proposition mapping  \nProduces: Messaging Framework Document  \nStores/Sends To: Creative Team Shared Folder  \n\nStep 3:  \nUses: Input 7 (Lead Generation Targets), Input 8 (Distribution Channels List)  \nAction: Configure CRM workflows and landing page CTAs  \nProduces: Lead Capture System Blueprint  \nStores/Sends To: Salesforce Admin Console  \n\nStep 4:  \nUses: Input 6 (Target Audience Personas), Input 2 (Industry Trends Data)  \nAction: Generate SEO keyword clusters for content targeting  \nProduces: Keyword Targeting Matrix  \nStores/Sends To: SEO Toolset (SEMrush Project)  \n\nStep 5:  \nUses: Input 4 (Brand Guidelines), Input 5 (Product Specifications), Output 4 (Keyword Targeting Matrix)  \nAction: Create content assets with embedded CTAs  \nProduces: Article Drafts, Video Storyboards  \nStores/Sends To: Content Approval Workflow  \n\nStep 6:  \nUses: Output 2 (Messaging Framework Document), Output 3 (Cross-Channel Distribution Calendar)  \nAction: Schedule content with channel-specific optimizations  \nProduces: Published Campaign Assets  \nStores/Sends To: LinkedIn, YouTube, Industry Journal Portals  \n\nStep 7:  \nUses: Output 5 (Performance Dashboard), Input 7 (Lead Generation Targets)  \nAction: Monitor lead velocity and content engagement KPIs  \nProduces: Weekly Optimization Recommendations  \nStores/Sends To: Stakeholder Email List  \n\nDependency Consistency Check:  \n- All derivable inputs (Input 6, Output 4) fully decomposed to system/user sources  \n- USER-CONTROLLED inputs explicitly identified with provision requirements  \n- SYSTEM-RETRIEVABLE inputs mapped to specific endpoints  \n- No orphaned inputs; all outputs externally verifiable"
  },
  "aeb_analysis": {
    "steps_count": 7,
    "aeb_analysis_raw": "### Step-by-Step Analysis:\n\n---\n\n**Step 1**  \n- **Step**: Conduct gap analysis to identify content opportunities  \n- **Is AEB**: No  \n- **Reason**: Gap analysis inherently involves **sequencing** (e.g., comparing datasets, identifying overlaps/deficits) and **complex logic** to synthesize insights. It also interacts with **multiple input systems** (Market Research, Industry Trends, Historical Campaigns).  \n- **Suggestion**: Break into:  \n  1. Compare Market Research vs. Historical Campaign Data (AEB).  \n  2. Map gaps against Industry Trends Data (AEB).  \n\n---\n\n**Step 2**  \n- **Step**: Develop messaging architecture with value proposition mapping  \n- **Is AEB**: No  \n- **Reason**: Requires **branching logic** to align personas with value propositions and **synthesis** of multiple inputs. Not a single executable action.  \n- **Suggestion**: Split into:  \n  1. Map value propositions to Target Audience Personas (AEB).  \n  2. Validate alignment with Brand Guidelines/Product Specs (AEB).  \n\n---\n\n**Step 3**  \n- **Step**: Configure CRM workflows and landing page CTAs  \n- **Is AEB**: No  \n- **Reason**: Combines **two distinct system boundaries** (CRM workflows + landing page CTAs) and requires **sequencing** (e.g., workflow rules â†’ CTA placement).  \n- **Suggestion**: Separate into:  \n  1. Configure CRM workflows for Lead Generation Targets (AEB).  \n  2. Configure landing page CTAs using Distribution Channels List (AEB).  \n\n---\n\n**Step 4**  \n- **Step**: Generate SEO keyword clusters for content targeting  \n- **Is AEB**: Yes  \n- **Reason**: Single intent (clustering keywords), interacts with one system (SEO Toolset), and can be implemented as a single API call (e.g., SEMrush keyword tool). No branching/sequencing required.  \n\n---\n\n**Step 5**  \n- **Step**: Create content assets with embedded CTAs  \n- **Is AEB**: No  \n- **Reason**: Combines **multiple intents** (article drafting, video storyboarding, CTA embedding) and likely requires **validation** (e.g., brand compliance checks).  \n- **Suggestion**: Split into:  \n  1. Auto-generate article drafts using keyword clusters (AEB).  \n  2. Embed CTAs into content assets per Brand Guidelines (AEB).  \n\n---\n\n**Step 6**  \n- **Step**: Schedule content with channel-specific optimizations  \n- **Is AEB**: No  \n- **Reason**: Requires **multiple system boundaries** (LinkedIn, YouTube, etc.) and **channel-specific branching logic** (e.g., format adjustments).  \n- **Suggestion**: Break into:  \n  1. Schedule LinkedIn posts with platform-specific optimizations (AEB).  \n  2. Schedule YouTube videos with SEO metadata (AEB).  \n\n---\n\n**Step 7**  \n- **Step**: Monitor lead velocity and content engagement KPIs  \n- **Is AEB**: No  \n- **Reason**: Involves **data aggregation**, **analysis**, and **recommendation logic** (branching based on thresholds). Not directly executable as a single function.  \n- **Suggestion**: Split into:  \n  1. Query Performance Dashboard for engagement metrics (AEB).  \n  2. Generate recommendations using Lead Generation Targets (AEB).  \n\n---\n\n### Summary of AEBs:  \nOnly **Step 4** qualifies as an AEB. All other steps require decomposition to meet atomicity requirements.",
    "analysis_complete": true
  },
  "io_decomposed": true
}