{
  "task_id": "41115c59e156",
  "input": "Create a SaaS customer support workflow that triages cases, auto-resolves simple issues, escalates complex ones, and tracks performance.",
  "required_inputs": [],
  "outputs": [
    "result"
  ],
  "subtasks": [],
  "dependency_structure": {
    "type": "dependency_driven",
    "graph": {},
    "total_subtasks": 0
  },
  "execution_plan": {
    "model_used": "AI1",
    "model_endpoint": "qwen/qwen3-235b-a22b",
    "inputs": [
      {
        "name": "C",
        "source_type": "SYSTEM-RETRIEVABLE",
        "source_origin": "SaaS ticketing system API (e.g., Zendesk/Intercom)",
        "input_data": "Raw case records with timestamps, user IDs, issue descriptions, severity tags",
        "bound_reference": "None"
      },
      {
        "name": "T",
        "source_type": "USER-CONTROLLED",
        "source_origin": "Support team configuration dashboard",
        "input_data": "Priority scoring criteria (e.g., severity weights, user tier multipliers)",
        "bound_reference": null
      },
      {
        "name": "A",
        "source_type": "USER-CONTROLLED",
        "source_origin": "Knowledge base management interface",
        "input_data": "Pre-approved response templates mapped to issue categories",
        "bound_reference": null
      },
      {
        "name": "E",
        "source_type": "USER-CONTROLLED",
        "source_origin": "Internal SOP documentation",
        "input_data": "Escalation thresholds (e.g., score >80 → Tier 2), assigned teams/roles",
        "bound_reference": null
      },
      {
        "name": "P",
        "source_type": "USER-CONTROLLED",
        "source_origin": "Business intelligence team",
        "input_data": "Metric definitions (e.g., SLA adherence, resolution time)",
        "bound_reference": null
      },
      {
        "name": "H",
        "source_type": "SYSTEM-RETRIEVABLE",
        "source_origin": "Internal analytics database",
        "input_data": "Past resolution times, success rates by category",
        "bound_reference": "None"
      },
      {
        "name": "U",
        "source_type": "SYSTEM-RETRIEVABLE",
        "source_origin": "SaaS platform user API",
        "input_data": "Customer tier, contract SLA terms, contact information",
        "bound_reference": "None"
      },
      {
        "name": "S",
        "source_type": "SYSTEM-RETRIEVABLE",
        "source_origin": "Contract management system",
        "input_data": "Time-based resolution targets by severity/user tier",
        "bound_reference": "None"
      },
      {
        "name": "T",
        "source_type": "DERIVABLE",
        "source_origin": "Computed from Customer Support Cases + Triage Rules",
        "input_data": "Numerical priority scores per case",
        "bound_reference": "Input 1 + Input 2"
      },
      {
        "name": "E",
        "source_type": "DERIVABLE",
        "source_origin": "Computed from Triage Scores + Escalation Protocols",
        "input_data": "Cases requiring human intervention with priority rankings",
        "bound_reference": "Input 9 + Input 4"
      },
      {
        "name": "A",
        "source_type": "DERIVABLE",
        "source_origin": "Computed from Customer Support Cases + Auto-Resolution Templates",
        "input_data": "Issues matching predefined resolution patterns",
        "bound_reference": "Input 1 + Input 3"
      },
      {
        "name": "P",
        "source_type": "DERIVABLE",
        "source_origin": "Computed from Historical Resolution Data + SLA Thresholds",
        "input_data": "Aggregated metrics (e.g., average resolution time, SLA compliance rate)",
        "bound_reference": "Input 6 + Input 8"
      }
    ],
    "outputs": [
      "Triage-Tagged Case Dataset",
      "Auto-Resolved Case Records",
      "Escalated Case Queue",
      "Performance Dashboard Update"
    ],
    "steps": [
      "Uses: Customer Support Cases, Triage Rules  \nAction: Apply weighted scoring algorithm to cases using defined criteria  \nProduces: Triage Scores  \nStores/Sends To: Temporary in-memory dataset",
      "Uses: Triage Scores, Auto-Resolution Templates  \nAction: Match high-confidence cases (score ≤30) to resolution templates  \nProduces: Auto-Resolution Candidates  \nStores/Sends To: Automated response queue",
      "Uses: Auto-Resolution Candidates  \nAction: Deploy templated responses with confirmation triggers  \nProduces: Auto-Resolved Case Records  \nStores/Sends To: Ticketing system + customer email/SMS gateway",
      "Uses: Triage Scores, Escalation Protocols  \nAction: Generate priority-sorted escalation list using threshold rules  \nProduces: Escalation Priority Queue  \nStores/Sends To: Internal escalation API endpoint",
      "Uses: Escalation Priority Queue  \nAction: Push highest-priority cases to designated support channels  \nProduces: Escalated Case Queue  \nStores/Sends To: Tier 2 team collaboration platform",
      "Uses: Historical Resolution Data, SLA Thresholds  \nAction: Calculate compliance metrics and trend analysis  \nProduces: Performance Reports  \nStores/Sends To: BI platform database",
      "Uses: Performance Reports  \nAction: Generate visual dashboard with drill-down capabilities  \nProduces: Performance Dashboard Update  \nStores/Sends To: Executive reporting interface  \n\n[DEPENDENCY CHECK]"
    ],
    "raw_response": "Inputs:  \n1. Customer Support Cases  \n   Source Type: SYSTEM-RETRIEVABLE  \n   Source Origin: SaaS ticketing system API (e.g., Zendesk/Intercom)  \n   Input Data: Raw case records with timestamps, user IDs, issue descriptions, severity tags  \n   Bound Reference: None  \n\n2. Triage Rules  \n   Source Type: USER-CONTROLLED  \n   Source Origin: Support team configuration dashboard  \n   Input Data: Priority scoring criteria (e.g., severity weights, user tier multipliers)  \n   Note: Requires explicit user provision or linkage.  \n\n3. Auto-Resolution Templates  \n   Source Type: USER-CONTROLLED  \n   Source Origin: Knowledge base management interface  \n   Input Data: Pre-approved response templates mapped to issue categories  \n   Note: Requires explicit user provision or linkage.  \n\n4. Escalation Protocols  \n   Source Type: USER-CONTROLLED  \n   Source Origin: Internal SOP documentation  \n   Input Data: Escalation thresholds (e.g., score >80 → Tier 2), assigned teams/roles  \n   Note: Requires explicit user provision or linkage.  \n\n5. Performance Metrics Schema  \n   Source Type: USER-CONTROLLED  \n   Source Origin: Business intelligence team  \n   Input Data: Metric definitions (e.g., SLA adherence, resolution time)  \n   Note: Requires explicit user provision or linkage.  \n\n6. Historical Resolution Data  \n   Source Type: SYSTEM-RETRIEVABLE  \n   Source Origin: Internal analytics database  \n   Input Data: Past resolution times, success rates by category  \n   Bound Reference: None  \n\n7. User Account Details  \n   Source Type: SYSTEM-RETRIEVABLE  \n   Source Origin: SaaS platform user API  \n   Input Data: Customer tier, contract SLA terms, contact information  \n   Bound Reference: None  \n\n8. SLA Thresholds  \n   Source Type: SYSTEM-RETRIEVABLE  \n   Source Origin: Contract management system  \n   Input Data: Time-based resolution targets by severity/user tier  \n   Bound Reference: None  \n\n9. Triage Scores  \n   Source Type: DERIVABLE  \n   Source Origin: Computed from Customer Support Cases + Triage Rules  \n   Input Data: Numerical priority scores per case  \n   Bound Reference: Input 1 + Input 2  \n   Note: [DEPTH STOP - Terminal input, do not further decompose]  \n\n10. Escalation Priority Queue  \n    Source Type: DERIVABLE  \n    Source Origin: Computed from Triage Scores + Escalation Protocols  \n    Input Data: Cases requiring human intervention with priority rankings  \n    Bound Reference: Input 9 + Input 4  \n    Note: [DEPTH STOP - Terminal input, do not further decompose]  \n\n11. Auto-Resolution Candidates  \n    Source Type: DERIVABLE  \n    Source Origin: Computed from Customer Support Cases + Auto-Resolution Templates  \n    Input Data: Issues matching predefined resolution patterns  \n    Bound Reference: Input 1 + Input 3  \n    Note: [DEPTH STOP - Terminal input, do not further decompose]  \n\n12. Performance Reports  \n    Source Type: DERIVABLE  \n    Source Origin: Computed from Historical Resolution Data + SLA Thresholds  \n    Input Data: Aggregated metrics (e.g., average resolution time, SLA compliance rate)  \n    Bound Reference: Input 6 + Input 8  \n    Note: [DEPTH STOP - Terminal input, do not further decompose]  \n\nOutputs:  \n1. Triage-Tagged Case Dataset  \n   Type: Persisted state change  \n   Destination: Ticketing system database  \n\n2. Auto-Resolved Case Records  \n   Type: Observable artifact  \n   Destination: Audit log + customer notification system  \n\n3. Escalated Case Queue  \n   Type: Triggered action  \n   Destination: Tier 2 support team dashboard  \n\n4. Performance Dashboard Update  \n   Type: Measurable report  \n   Destination: Internal BI platform  \n\nSteps:  \nStep 1:  \nUses: Customer Support Cases, Triage Rules  \nAction: Apply weighted scoring algorithm to cases using defined criteria  \nProduces: Triage Scores  \nStores/Sends To: Temporary in-memory dataset  \n\nStep 2:  \nUses: Triage Scores, Auto-Resolution Templates  \nAction: Match high-confidence cases (score ≤30) to resolution templates  \nProduces: Auto-Resolution Candidates  \nStores/Sends To: Automated response queue  \n\nStep 3:  \nUses: Auto-Resolution Candidates  \nAction: Deploy templated responses with confirmation triggers  \nProduces: Auto-Resolved Case Records  \nStores/Sends To: Ticketing system + customer email/SMS gateway  \n\nStep 4:  \nUses: Triage Scores, Escalation Protocols  \nAction: Generate priority-sorted escalation list using threshold rules  \nProduces: Escalation Priority Queue  \nStores/Sends To: Internal escalation API endpoint  \n\nStep 5:  \nUses: Escalation Priority Queue  \nAction: Push highest-priority cases to designated support channels  \nProduces: Escalated Case Queue  \nStores/Sends To: Tier 2 team collaboration platform  \n\nStep 6:  \nUses: Historical Resolution Data, SLA Thresholds  \nAction: Calculate compliance metrics and trend analysis  \nProduces: Performance Reports  \nStores/Sends To: BI platform database  \n\nStep 7:  \nUses: Performance Reports  \nAction: Generate visual dashboard with drill-down capabilities  \nProduces: Performance Dashboard Update  \nStores/Sends To: Executive reporting interface  \n\n[DEPENDENCY CHECK]  \nAll inputs accounted for in steps  \nUSER-CONTROLLED inputs explicitly identified (2,3,4,5)  \nSYSTEM-RETRIEVABLE inputs mapped to endpoints (1,6,7,8)  \nDERIVABLE inputs fully decomposed to leaf nodes (9-12)  \nNo implicit data sources present"
  },
  "aeb_analysis": {
    "steps_count": 7,
    "aeb_analysis_raw": "### AEB Analysis Results\n\n---\n\n**Step 1**  \n- **Step**: Apply weighted scoring algorithm to cases using defined criteria  \n- **Is AEB**: **Yes**  \n- **Reason**:  \n  - Single intent: Scoring cases.  \n  - Interacts with one system boundary (algorithm processing input data).  \n  - No explicit branching/sequencing (assumes the algorithm is a single function/API).  \n  - Can be implemented as a single API call (e.g., `calculateTriageScores(cases, rules)`).  \n\n---\n\n**Step 2**  \n- **Step**: Match high-confidence cases (score ≤30) to resolution templates  \n- **Is AEB**: **No**  \n- **Reason**:  \n  - Contains **branching** (filtering by score threshold).  \n  - Combines filtering and template matching (two distinct intents).  \n- **Suggested Breakdown**:  \n  1. Filter cases with score ≤30 (single intent, no branching).  \n  2. Match filtered cases to resolution templates (single intent, no branching).  \n\n---\n\n**Step 3**  \n- **Step**: Deploy templated responses with confirmation triggers  \n- **Is AEB**: **No**  \n- **Reason**:  \n  - Interacts with **two system boundaries** (ticketing system + email/SMS gateway).  \n  - Combines response deployment and record creation (two intents).  \n- **Suggested Breakdown**:  \n  1. Send templated response via email/SMS gateway.  \n  2. Store auto-resolved case record in the ticketing system.  \n\n---\n\n**Step 4**  \n- **Step**: Generate priority-sorted escalation list using threshold rules  \n- **Is AEB**: **No**  \n- **Reason**:  \n  - Contains **branching** (threshold rules imply conditional logic).  \n  - Combines sorting and filtering (two intents).  \n- **Suggested Breakdown**:  \n  1. Filter triage scores using escalation thresholds.  \n  2. Sort filtered cases by priority.  \n\n---\n\n**Step 5**  \n- **Step**: Push highest-priority cases to designated support channels  \n- **Is AEB**: **Yes**  \n- **Reason**:  \n  - Single intent: Pushing cases to Tier 2 channels.  \n  - Interacts with one system boundary (collaboration platform API).  \n  - No branching/sequencing (assumes input is pre-sorted).  \n  - Can be implemented",
    "analysis_complete": true
  },
  "io_decomposed": true
}