{
  "task_id": "cafd836d235a",
  "input": "Optimize the delivery fleet by analyzing live data to adjust routing parameters within safe limits, monitoring outcomes, and reporting efficiency gains.",
  "required_inputs": [],
  "outputs": [
    "result"
  ],
  "subtasks": [],
  "dependency_structure": {
    "type": "dependency_driven",
    "graph": {},
    "total_subtasks": 0
  },
  "execution_plan": {
    "model_used": "AI1",
    "model_endpoint": "qwen/qwen3-235b-a22b",
    "inputs": [
      {
        "name": "L",
        "source_type": "SYSTEM-RETRIEVABLE",
        "source_origin": "Fleet telematics API (e.g., GPS, fuel consumption, speed sensors)",
        "input_data": "Real-time location, speed, fuel levels, engine status, route adherence",
        "bound_reference": "Connected vehicle systems"
      },
      {
        "name": "C",
        "source_type": "SYSTEM-RETRIEVABLE",
        "source_origin": "Route management system API",
        "input_data": "Planned routes, delivery windows, vehicle assignments",
        "bound_reference": "Logistics management platform"
      },
      {
        "name": "S",
        "source_type": "USER-CONTROLLED",
        "source_origin": "Fleet operations team",
        "input_data": "Maximum allowable detour time, fuel thresholds, driver hour limits",
        "bound_reference": "Requires explicit user provision or linkage."
      },
      {
        "name": "H",
        "source_type": "SYSTEM-RETRIEVABLE",
        "source_origin": "Operational data warehouse",
        "input_data": "Past route completion times, fuel consumption averages, on-time delivery rates",
        "bound_reference": "Time-series database"
      },
      {
        "name": "T",
        "source_type": "USER-CONTROLLED",
        "source_origin": "Operations management",
        "input_data": "Percentage reduction in fuel costs/time targets",
        "bound_reference": "Requires explicit user provision or linkage."
      },
      {
        "name": "R",
        "source_type": "SYSTEM-RETRIEVABLE",
        "source_origin": "Internal IAM system",
        "input_data": "API keys for route optimization engine",
        "bound_reference": "Authentication service"
      }
    ],
    "outputs": [
      "Optimized Route Plan",
      "Real-time Monitoring Dashboard",
      "Efficiency Gain Report"
    ],
    "steps": [
      "Uses: Live Vehicle Telemetry Data, Current Route Parameters\nAction: Pull real-time vehicle positions and status against planned routes\nProduces: Vehicle Position/Routing Deviation Matrix\nStores/Sends To: In-memory processing queue",
      "Uses: Safety Constraint Thresholds\nAction: Validate all potential route adjustments against safety boundaries\nProduces: Permissible Adjustment Window Specification\nStores/Sends To: Constraint validation service",
      "Uses: Historical Efficiency Metrics\nAction: Compute statistical baselines for route performance metrics\nProduces: Route Efficiency Benchmark Model\nStores/Sends To: Analytics database",
      "Uses: Vehicle Position/Routing Deviation Matrix, Permissible Adjustment Window Specification\nAction: Apply optimization algorithm to create alternative routing options\nProduces: Candidate Route Set (3 variations)\nStores/Sends To: Route evaluation module",
      "Uses: Candidate Route Set, Route Efficiency Benchmark Model\nAction: Simulate proposed routes against historical benchmarks\nProduces: Route Optimization Scorecard\nStores/Sends To: Decision support system",
      "Uses: Route Optimization Scorecard, Routing System Access Credentials\nAction: Implement top-scoring routes in navigation system\nProduces: Updated Route Execution Plan\nStores/Sends To: Fleet telematics interface",
      "Uses: Live Vehicle Telemetry Data, Updated Route Execution Plan\nAction: Track actual vs planned route execution metrics\nProduces: Route Compliance Monitoring Feed\nStores/Sends To: Real-time dashboard",
      "Uses: Route Compliance Monitoring Feed, Route Efficiency Benchmark Model\nAction: Quantify actual improvements vs historical baselines\nProduces: Quantified Efficiency Gain Metrics\nStores/Sends To: Reporting system\n\n[DEPTH STOP CONDITIONS MET: All leaf inputs are SYSTEM-RETRIEVABLE or USER-CONTROLLED]"
    ],
    "raw_response": "Inputs:\n1. Live Vehicle Telemetry Data\n   Source Type: SYSTEM-RETRIEVABLE\n   Source Origin: Fleet telematics API (e.g., GPS, fuel consumption, speed sensors)\n   Input Data: Real-time location, speed, fuel levels, engine status, route adherence\n   Bound Reference: Connected vehicle systems\n\n2. Current Route Parameters\n   Source Type: SYSTEM-RETRIEVABLE\n   Source Origin: Route management system API\n   Input Data: Planned routes, delivery windows, vehicle assignments\n   Bound Reference: Logistics management platform\n\n3. Safety Constraint Thresholds\n   Source Type: USER-CONTROLLED\n   Source Origin: Fleet operations team\n   Input Data: Maximum allowable detour time, fuel thresholds, driver hour limits\n   Bound Reference: Requires explicit user provision or linkage.\n\n4. Historical Efficiency Metrics\n   Source Type: SYSTEM-RETRIEVABLE\n   Source Origin: Operational data warehouse\n   Input Data: Past route completion times, fuel consumption averages, on-time delivery rates\n   Bound Reference: Time-series database\n\n5. Target Efficiency Gain\n   Source Type: USER-CONTROLLED\n   Source Origin: Operations management\n   Input Data: Percentage reduction in fuel costs/time targets\n   Bound Reference: Requires explicit user provision or linkage.\n\n6. Routing System Access Credentials\n   Source Type: SYSTEM-RETRIEVABLE\n   Source Origin: Internal IAM system\n   Input Data: API keys for route optimization engine\n   Bound Reference: Authentication service\n\nOutputs:\n1. Optimized Route Plan (updated routing parameters)\n2. Real-time Monitoring Dashboard (performance tracking)\n3. Efficiency Gain Report (quantified improvements vs baseline)\n\nSteps:\nStep 1: Retrieve Live Fleet Data\nUses: Live Vehicle Telemetry Data, Current Route Parameters\nAction: Pull real-time vehicle positions and status against planned routes\nProduces: Vehicle Position/Routing Deviation Matrix\nStores/Sends To: In-memory processing queue\n\nStep 2: Calculate Safety Compliance\nUses: Safety Constraint Thresholds\nAction: Validate all potential route adjustments against safety boundaries\nProduces: Permissible Adjustment Window Specification\nStores/Sends To: Constraint validation service\n\nStep 3: Analyze Historical Patterns\nUses: Historical Efficiency Metrics\nAction: Compute statistical baselines for route performance metrics\nProduces: Route Efficiency Benchmark Model\nStores/Sends To: Analytics database\n\nStep 4: Generate Route Proposals\nUses: Vehicle Position/Routing Deviation Matrix, Permissible Adjustment Window Specification\nAction: Apply optimization algorithm to create alternative routing options\nProduces: Candidate Route Set (3 variations)\nStores/Sends To: Route evaluation module\n\nStep 5: Validate Efficiency Improvements\nUses: Candidate Route Set, Route Efficiency Benchmark Model\nAction: Simulate proposed routes against historical benchmarks\nProduces: Route Optimization Scorecard\nStores/Sends To: Decision support system\n\nStep 6: Deploy Approved Routes\nUses: Route Optimization Scorecard, Routing System Access Credentials\nAction: Implement top-scoring routes in navigation system\nProduces: Updated Route Execution Plan\nStores/Sends To: Fleet telematics interface\n\nStep 7: Monitor Implementation\nUses: Live Vehicle Telemetry Data, Updated Route Execution Plan\nAction: Track actual vs planned route execution metrics\nProduces: Route Compliance Monitoring Feed\nStores/Sends To: Real-time dashboard\n\nStep 8: Calculate Efficiency Gains\nUses: Route Compliance Monitoring Feed, Route Efficiency Benchmark Model\nAction: Quantify actual improvements vs historical baselines\nProduces: Quantified Efficiency Gain Metrics\nStores/Sends To: Reporting system\n\n[DEPTH STOP CONDITIONS MET: All leaf inputs are SYSTEM-RETRIEVABLE or USER-CONTROLLED]"
  },
  "aeb_analysis": {
    "steps_count": 8,
    "aeb_analysis_raw": "### AEB Analysis Results\n\n---\n\n**Step 1**  \n- **Step:** Uses: Live Vehicle Telemetry Data, Current Route Parameters  \n  Action: Pull real-time vehicle positions and status against planned routes  \n  Produces: Vehicle Position/Routing Deviation Matrix  \n  Stores/Sends To: In-memory processing queue  \n- **Is AEB:** No  \n- **Reason:**  \n  - **Multiple system boundaries:** Involves retrieving data from two distinct sources (vehicle telemetry and route parameters), which likely belong to different systems.  \n  - **Sequencing and processing:** Requires retrieving both data sets first, then combining them into a matrix, which introduces sequencing and internal processing.  \n- **Suggestion:** Break into:  \n  1. Retrieve live vehicle telemetry data (AEB).  \n  2. Retrieve current route parameters (AEB).  \n  3. Combine data into a deviation matrix (AEB).\n\n---\n\n**Step 2**  \n- **Step:** Uses: Safety Constraint Thresholds  \n  Action: Validate all potential route adjustments against safety boundaries  \n  Produces: Permissible Adjustment Window Specification  \n  Stores/Sends To: Constraint validation service  \n- **Is AEB:** No  \n- **Reason:**  \n  - **Validation explicitly prohibited:** The action involves validating route adjustments against safety constraints, which violates the \"no validation or error handling\" rule.  \n  - **Branching logic:** Validation inherently requires conditional checks (e.g., \"is this adjustment safe?\"), introducing branching.  \n- **Suggestion:**  \n  - Use a pre-built constraint validation API that returns a binary result (safe/unsafe) without internal branching.  \n  - Separate validation logic into a dedicated AEB (e.g., \"Check Route Adjustment Safety\" with a single API call).\n\n---\n\n**Step 3**  \n- **Step:** Uses: Historical Efficiency Metrics  \n  Action: Compute statistical baselines for route performance metrics  \n  Produces: Route Efficiency Benchmark Model  \n  Stores/Sends To: Analytics database  \n- **Is AEB:** Yes  \n- **Reason:**  \n  - **Single intent:** Computing statistical baselines (e.g., averages, percentiles) is a unified task.  \n  - **Single system boundary:** Likely interacts with a single analytics database.  \n  - **No branching/sequencing:** Assumes the computation is a single function (e.g., `compute_baselines(metrics)`).  \n- **Suggestion:** None required.\n\n---\n\n**Step 4**  \n- **Step:** Uses: Vehicle Position/Routing Deviation Matrix, Permissible Adjustment Window Specification  \n  Action: Apply optimization algorithm to create alternative routing options  \n  Produces: Candidate Route Set (3 variations)  \n  Stores/Sends To: Route evaluation module  \n- **Is AEB:** Yes  \n- **Reason:**  \n  - **Single intent:** Applying an optimization algorithm is a unified action.  \n  - **Single system boundary:** Assumes the algorithm is encapsulated in one function/API.  \n  - **No branching/sequencing:** The algorithmâ€™s internal logic is abstracted (e.g., `generate_candidate_routes(deviation_matrix, constraints)`).  \n- **Suggestion:** None required.\n\n---\n\n**Step 5**  \n- **Step:** Uses: Candidate Route Set, Route Efficiency Benchmark Model  \n  Action: Simulate proposed routes against historical benchmarks  \n  Produces: Route Optimization Scorecard  \n  Stores",
    "analysis_complete": true
  },
  "io_decomposed": true
}