{
  "task_id": "27614dc7e3ea",
  "input": "Analyze a new market's entry potential by gathering data from multiple sources, synthesizing insights to address uncertainties, and producing a structured market entry strategy report.",
  "required_inputs": [],
  "outputs": [
    "result"
  ],
  "subtasks": [],
  "dependency_structure": {
    "type": "dependency_driven",
    "graph": {},
    "total_subtasks": 0
  },
  "execution_plan": {
    "model_used": "AI1",
    "model_endpoint": "qwen/qwen3-235b-a22b",
    "inputs": [
      {
        "name": "M",
        "source_type": "SYSTEM-RETRIEVABLE",
        "source_origin": "Statista/World Bank API",
        "input_data": "Historical market size (USD), CAGR, regional segmentation",
        "bound_reference": "None"
      },
      {
        "name": "C",
        "source_type": "SYSTEM-RETRIEVABLE",
        "source_origin": "Crunchbase API",
        "input_data": "Competitor revenue, product offerings, market share",
        "bound_reference": "None"
      },
      {
        "name": "R",
        "source_type": "SYSTEM-RETRIEVABLE",
        "source_origin": "Government open-data portal (e.g., trade.gov)",
        "input_data": "Tariff rates, licensing requirements, foreign ownership limits",
        "bound_reference": "None"
      },
      {
        "name": "C",
        "source_type": "USER-CONTROLLED",
        "source_origin": "Internal survey results (CSV upload)",
        "input_data": "Survey responses on product preferences, pricing sensitivity",
        "bound_reference": "Requires explicit user provision or linkage."
      },
      {
        "name": "I",
        "source_type": "USER-CONTROLLED",
        "source_origin": "Strategic planning team",
        "input_data": "Maximum allowable CAPEX for market entry",
        "bound_reference": "Requires explicit user provision or linkage."
      },
      {
        "name": "I",
        "source_type": "SYSTEM-RETRIEVABLE",
        "source_origin": "SAP ERP system",
        "input_data": "Historical ROI benchmarks, cost structures",
        "bound_reference": "None"
      },
      {
        "name": "M",
        "source_type": "DERIVABLE",
        "source_origin": "Synthesis of Competitor Portfolio Data (2) and Regulatory Restrictions (3)",
        "input_data": "Weighted barrier score (regulatory + competitive friction)",
        "bound_reference": "Inputs 2, 3"
      },
      {
        "name": "C",
        "source_type": "DERIVABLE",
        "source_origin": "Clustering analysis on Customer Preference Dataset (4)",
        "input_data": "Segmented personas with preference clusters",
        "bound_reference": "Input 4"
      }
    ],
    "outputs": [
      "Structured Market Entry Strategy Report",
      "Market attractiveness score",
      "Risk mitigation roadmap",
      "Recommended entry mode (e.g., JV, acquisition)",
      "Anonymized Market Data Warehouse Snapshot",
      "Aggregated datasets from Inputs 1–6, 7–8",
      "Triggered Action: Board Approval Workflow",
      "Automated email + calendar invite for strategy review meeting"
    ],
    "steps": [
      "Uses: Market Size & Growth Data (1)  \nAction: Clean and normalize time-series market data  \nProduces: Normalized Market Dataset  \nStores/Sends To: Internal data lake (AWS S3://market-entry/)",
      "Uses: Competitor Portfolio Data (2), Regulatory Restrictions (3)  \nAction: Calculate market concentration ratio (HHI) + regulatory friction index  \nProduces: Market Barrier Scorecard  \nStores/Sends To: Internal data lake (AWS S3://market-entry/)",
      "Uses: Customer Preference Dataset (4)  \nAction: Apply k-means clustering to identify 3–5 customer segments  \nProduces: Customer Segmentation Model (8)  \nStores/Sends To: Internal data lake (AWS S3://market-entry/)",
      "Uses: Investment Budget Threshold (5), Internal Financial System Access (6)  \nAction: Compare budget against historical ROI benchmarks  \nProduces: Financial Viability Assessment  \nStores/Sends To: Internal data lake (AWS S3://market-entry/)",
      "Uses: Market Barrier Scorecard (Step 2 output), Customer Segmentation Model (8), Financial Viability Assessment (Step 4 output)  \nAction: Synthesize inputs into weighted decision matrix  \nProduces: Strategic Insight Matrix  \nStores/Sends To: Internal data lake (AWS S3://market-entry/)",
      "Uses: Strategic Insight Matrix (Step 5 output)  \nAction: Generate structured report using pre-defined template logic  \nProduces: Structured Market Entry Strategy Report  \nStores/Sends To: Document management system (SharePoint://strategy-reports/)",
      "Uses: Structured Market Entry Strategy Report (Step 6 output)  \nAction: Trigger board approval workflow via Microsoft Power Automate  \nProduces: Triggered Action: Board Approval Workflow  \nStores/Sends To: Microsoft Teams channel #executive-strategy"
    ],
    "raw_response": "Inputs:  \n1. Market Size & Growth Data  \n   Source Type: SYSTEM-RETRIEVABLE  \n   Source Origin: Statista/World Bank API  \n   Input Data: Historical market size (USD), CAGR, regional segmentation  \n   Bound Reference: None  \n\n2. Competitor Portfolio Data  \n   Source Type: SYSTEM-RETRIEVABLE  \n   Source Origin: Crunchbase API  \n   Input Data: Competitor revenue, product offerings, market share  \n   Bound Reference: None  \n\n3. Regulatory Restrictions  \n   Source Type: SYSTEM-RETRIEVABLE  \n   Source Origin: Government open-data portal (e.g., trade.gov)  \n   Input Data: Tariff rates, licensing requirements, foreign ownership limits  \n   Bound Reference: None  \n\n4. Customer Preference Dataset  \n   Source Type: USER-CONTROLLED  \n   Source Origin: Internal survey results (CSV upload)  \n   Input Data: Survey responses on product preferences, pricing sensitivity  \n   Bound Reference: Requires explicit user provision or linkage.  \n\n5. Investment Budget Threshold  \n   Source Type: USER-CONTROLLED  \n   Source Origin: Strategic planning team  \n   Input Data: Maximum allowable CAPEX for market entry  \n   Bound Reference: Requires explicit user provision or linkage.  \n\n6. Internal Financial System Access  \n   Source Type: SYSTEM-RETRIEVABLE  \n   Source Origin: SAP ERP system  \n   Input Data: Historical ROI benchmarks, cost structures  \n   Bound Reference: None  \n\n7. Market Entry Barriers (DERIVABLE)  \n   Source Type: DERIVABLE  \n   Source Origin: Synthesis of Competitor Portfolio Data (2) and Regulatory Restrictions (3)  \n   Input Data: Weighted barrier score (regulatory + competitive friction)  \n   Bound Reference: Inputs 2, 3  \n   Note: [DEPTH STOP - Terminal input, do not further decompose]  \n\n8. Customer Segmentation Model (DERIVABLE)  \n   Source Type: DERIVABLE  \n   Source Origin: Clustering analysis on Customer Preference Dataset (4)  \n   Input Data: Segmented personas with preference clusters  \n   Bound Reference: Input 4  \n   Note: [DEPTH STOP - Terminal input, do not further decompose]  \n\nOutputs:  \n1. Structured Market Entry Strategy Report (PDF/DOCX)  \n   - Market attractiveness score  \n   - Risk mitigation roadmap  \n   - Recommended entry mode (e.g., JV, acquisition)  \n\n2. Anonymized Market Data Warehouse Snapshot  \n   - Aggregated datasets from Inputs 1–6, 7–8  \n\n3. Triggered Action: Board Approval Workflow  \n   - Automated email + calendar invite for strategy review meeting  \n\nSteps:  \nStep 1:  \nUses: Market Size & Growth Data (1)  \nAction: Clean and normalize time-series market data  \nProduces: Normalized Market Dataset  \nStores/Sends To: Internal data lake (AWS S3://market-entry/)  \n\nStep 2:  \nUses: Competitor Portfolio Data (2), Regulatory Restrictions (3)  \nAction: Calculate market concentration ratio (HHI) + regulatory friction index  \nProduces: Market Barrier Scorecard  \nStores/Sends To: Internal data lake (AWS S3://market-entry/)  \n\nStep 3:  \nUses: Customer Preference Dataset (4)  \nAction: Apply k-means clustering to identify 3–5 customer segments  \nProduces: Customer Segmentation Model (8)  \nStores/Sends To: Internal data lake (AWS S3://market-entry/)  \n\nStep 4:  \nUses: Investment Budget Threshold (5), Internal Financial System Access (6)  \nAction: Compare budget against historical ROI benchmarks  \nProduces: Financial Viability Assessment  \nStores/Sends To: Internal data lake (AWS S3://market-entry/)  \n\nStep 5:  \nUses: Market Barrier Scorecard (Step 2 output), Customer Segmentation Model (8), Financial Viability Assessment (Step 4 output)  \nAction: Synthesize inputs into weighted decision matrix  \nProduces: Strategic Insight Matrix  \nStores/Sends To: Internal data lake (AWS S3://market-entry/)  \n\nStep 6:  \nUses: Strategic Insight Matrix (Step 5 output)  \nAction: Generate structured report using pre-defined template logic  \nProduces: Structured Market Entry Strategy Report  \nStores/Sends To: Document management system (SharePoint://strategy-reports/)  \n\nStep 7:  \nUses: Structured Market Entry Strategy Report (Step 6 output)  \nAction: Trigger board approval workflow via Microsoft Power Automate  \nProduces: Triggered Action: Board Approval Workflow  \nStores/Sends To: Microsoft Teams channel #executive-strategy  \n\nDependency Consistency Check:  \n- All inputs used in at least one step  \n- No undeclared inputs in steps  \n- USER-CONTROLLED inputs (4,5) explicitly identified  \n- SYSTEM-RETRIEVABLE inputs (1,2,3,6) tied to endpoints  \n- DERIVABLE inputs (7,8) fully decomposed to leaf nodes"
  },
  "aeb_analysis": {
    "steps_count": 7,
    "aeb_analysis_raw": null,
    "analysis_complete": true
  },
  "io_decomposed": true
}